201503230058,2015,3,23,"",0,"",93,5,Southeast Asia,Aceh,Alue Mbang,5.093077,97.171831,1,0,"","03/23/2015: Assailants abducted two Indonesian Army (TNI-AD) military intelligence personnel in Alue Mbang village, Aceh province, Indonesia. The two hostages were found dead the following day, March 24, 2015. No group claimed responsibility; however, sources attributed the attack to the West Indonesia Mujahideen.",1,1,0,1,1,Insurgency/Guerilla Action,0,1,0,6,Hostage Taking (Kidnapping),"","","","",4,Military,34,"Military Personnel (soldiers, troops, officers, forces)",Indonesian Army (TNI-AD),"Military Intelligence Personnel: First Sergeant Indra, Second Sergeant Hendri",93,Indonesia,"","","","","","","","","","","","","","","","",West Indonesia Mujahideen,"","","","","","",0,"","",0,-99,1,0,"","","","","","","","","",5,Firearms,2,Automatic or Semi-Automatic Rifle,"","","","","","","","","","","","",An AK-47 and an M16 were used in the attack.,2,0,0,0,0,0,0,"","","","",1,2,0,-99,"","","",0,"","","","","",4,Hostage(s) killed (not during rescue attempt),0,"","\"\"\"Gunmen kidnap",kill two Indonesian soldiers in Aceh,"\"\" Agence France Presse -- English",March 24,"2015.\"","\"\"\"Terror group suspected of TNI personnel murder in Aceh","\"\" Jakarta Post",March 25,"2015.\""
201503300066,2015,3,30,"",0,"",93,5,Southeast Asia,South Sulawesi,Makassar,-5.130855,119.416528,1,0,"","03/30/2015: Security forces found an explosive device planted outside of a Kompas TV office in Makassar, South Sulawesi province, Indonesia. Jamaah Ansharut Daulah claimed responsibility for the incident in a note left with the device.",1,1,1,0,"","",0,0,0,3,Bombing/Explosion,"","","","",10,Journalists & Media,55,Television Journalist/Staff/Facility,Kompas TV,Office,93,Indonesia,"","","","","","","","","","","","","","","","",Jamaah Ansharut Daulah,"","","","","","",0,"","",0,-99,0,1,5,Note left at scene,"","","","","","","",6,Explosives,16,Unknown Explosive Type,"","","","","","","","","","","","",An explosive device in a plastic bag was used in the attack.,0,0,0,0,0,0,0,"","","","",0,"","","","","","","","","","","","","","","","","\"\"\"ISIS Supporters in Indonesia Declare New Group","\"\" Tempo.co",March 21,"2015.\"","\"\"\"Terrorism Digest: 31 March-1 April 2015","\"\" BBC Monitoring",April 1,"2015.\"",""
201505260090,2015,5,26,"",1,"",93,5,Southeast Asia,Papua,Enarotali,-3.930973,136.375962,1,0,"","05/26/2015: Assailants abducted two soldiers from Enarotali area, Papua province, Indonesia. The assailants took the soldiers to an elementary school and briefly held teachers hostage; the soldiers escaped on May 27, 2015. No group claimed responsibility for the incident; however, sources suspected the involvement of separatists.",1,1,1,0,"","",0,1,0,6,Hostage Taking (Kidnapping),5,Hostage Taking (Barricade Incident),"","",4,Military,34,"Military Personnel (soldiers, troops, officers, forces)",Indonesian National Armed Forces (TNI),"Soldiers: Lery, Soleh",93,Indonesia,8,Educational Institution,48,Teacher/Professor/Instructor,Inpres Komopa Elementary,Teacher: Elda Sanadi,93,Indonesia,"","","","","","","","",Separatists,"","","","","","",1,"","",0,-99,0,0,"","","","","","","","","",5,Firearms,5,Unknown Gun Type,"","","","","","","","","","","","","",0,0,0,0,0,0,0,"","","","",1,2,0,"",1,"","",0,"","","","","",3,Hostage(s) escaped (not during rescue attempt),2,"Casualty numbers for this incident conflict across sources. Following GTD protocol, the lowest reliable estimates are reported here.","\"\"\"Indonesia: Military Said to Hunt Armed Papuan Group for Allegedly Kidnapping Soldiers","\"\" Jakarta Globe Online",May 28,"2015.\"","\"\"\"Armed Group Seizes Two Soldiers in Papua","\"\" Tempo.co",May 27,"2015.\"",""
201506150133,2015,6,15,"",0,"",93,5,Southeast Asia,Papua,Puncak Jaya district,-4.091421,137.117461,3,0,"","06/15/2015: Assailants opened fire on and set fire to the Evangelical Church of Indonesia (GIDI) church in Puncak Jaya district, Papua province, Indonesia. No casualties were reported. No group claimed responsibility for the incident; however, sources suspected the involvement of the Free Papua Movement (OPM-Organisasi Papua Merdeka).",1,1,1,0,"","",0,1,0,7,Facility/Infrastructure Attack,"","","","",15,Religious Figures/Institutions,86,Place of Worship,The Evangelical Church of Indonesia (GIDI),Church,93,Indonesia,"","","","","","","","","","","","","","","","",Free Papua Movement (OPM-Organisasi Papua Merdeka),"","","","","","",1,"","",0,-99,0,0,"","","","","","","","","",8,Incendiary,18,Arson/Fire,"","","","","","","","","","","","","",0,0,0,0,0,0,1,3,Minor (likely < $1 million),-99,A church building was damaged in this attack.,0,"","","","","","","","","","","","","","","","","\"\"\"Indonesia: Police Investigate Burning Down of Papua Church","\"\" Jakarta Globe Online",June 16,"2015.\"","\"\"\"Police Investigate Burning Down of Papua Church","\"\" Jakarta Globe",June 16,"2015.\"",""
201507090045,2015,7,9,"",0,"",93,5,Southeast Asia,Banten,Tangerang,-6.202456,106.652695,1,0,"","07/09/2015: An explosive device detonated in a restroom at the Alam Sutera mall in Tangerang city, Banten province, Indonesia. There were no reported casualties in the blast. No group claimed responsibility for the incident; however, sources attributed the attack to Muslim fundamentalists.",1,1,1,0,"","",0,1,0,3,Bombing/Explosion,"","","","",1,Business,7,Retail/Grocery/Bakery,Alam Sutera Mall,Restroom,93,Indonesia,"","","","","","","","","","","","","","","","",Muslim extremists,"","","","","","",0,"","",0,-99,0,0,"","","","","","","","","",6,Explosives,17,Other Explosive Type,"","","","","","","","","","","","",A homemade explosive device consisting of chemicals with a timing device were used in the attack.,0,0,0,0,0,0,1,3,Minor (likely < $1 million),-99,A toilet was damaged in this attack.,0,"","","","","","","","","","","","","","","","","\"\"\"Police Link Mall Toilet Blast to Islamist Terrorists","\"\" Jakarta Globe",July 12,"2015.\"","\"\"\"Home-made bomb blast in Indonesian mall","\"\" NEWS.com.au",July 10,"2015.\"","\"\"\"Police: Low-explosive bomb caused blast at Indonesia mall"
201507170086,2015,7,17,"",0,"",93,5,Southeast Asia,Papua,Karubaga,-3.684015,138.479002,1,0,The incident occurred in Tolikara district.,"07/17/2015: Assailants set fire to the Baitul Mutaqqin Mosque and threw stones at worshippers in Karubaga, Tolikara district, Papua province, Indonesia. This was one of three attacks in Karubaga on the same day. At least one assailant was killed and 10 others were injured across all three incidents. No group claimed responsibility; however, sources attributed the attacks to Christian extremists.",1,1,1,0,"","",1,1,0,2,Armed Assault,7,Facility/Infrastructure Attack,"","",15,Religious Figures/Institutions,86,Place of Worship,Baitul Mutaqqin Mosque,Mosque,93,Indonesia,"","","","","","","","","","","","","","","","",Christian extremists,"","","","","","The specific motive is unknown; however, sources noted that the attack occurred on Eid ul Fitr, a Muslim holiday.",0,"","",0,-99,0,0,"","","","","","","","","",8,Incendiary,18,Arson/Fire,12,Other,"","","","","","","","","","",Fire and stones were used in the attack.,1,0,1,4,0,4,1,3,Minor (likely < $1 million),-99,A mosque was damaged in this attack.,0,"","","","","","","","","","","","","","","","","\"\"\"Police Probe GIDI President over Tolikara Incident","\"\" Tempo.co",August 5,"2015.\"","\"\"\"Extremists burn down mosque on Eid","\"\" World Bulletin",July 17,"2015.\"",""
201507170087,2015,7,17,"",0,"",93,5,Southeast Asia,Papua,Karubaga,-3.684015,138.479002,1,0,The incident occurred in Tolikara district.,"07/17/2015: Assailants set fire to an unknown number of civilian residences in Karubaga, Tolikara district, Papua province, Indonesia. This was one of three attacks in Karubaga on the same day. At least one assailant was killed and 10 others were injured across all three incidents. No group claimed responsibility; however, sources attributed the attacks to Christian extremists.",1,1,1,0,"","",1,1,0,7,Facility/Infrastructure Attack,"","","","",14,Private Citizens & Property,76,House/Apartment/Residence,Not Applicable,Residences,93,Indonesia,"","","","","","","","","","","","","","","","",Christian extremists,"","","","","","The specific motive is unknown; however, sources noted that the attack occurred on Eid ul Fitr, a Muslim holiday.",0,"","",0,-99,0,0,"","","","","","","","","",8,Incendiary,18,Arson/Fire,"","","","","","","","","","","","","",0,0,0,3,0,3,1,4,Unknown,-99,An unknown number of houses were damaged in this attack.,0,"","","","","","","","","","","","","","","","","\"\"\"Police Probe GIDI President over Tolikara Incident","\"\" Tempo.co",August 5,"2015.\"","\"\"\"Extremists burn down mosque on Eid","\"\" World Bulletin",July 17,"2015.\"",""
201507170088,2015,7,17,"",0,"",93,5,Southeast Asia,Papua,Karubaga,-3.684015,138.479002,1,0,The incident occurred in Tolikara district.,"07/17/2015: Assailants set fire to an unknown number of shops in Karubaga, Tolikara district, Papua province, Indonesia. This was one of three attacks in Karubaga on the same day. At least one assailant was killed and 10 others were injured across all three incidents. No group claimed responsibility; however, sources attributed the attacks to Christian extremists.",1,1,1,0,"","",1,1,0,7,Facility/Infrastructure Attack,"","","","",1,Business,7,Retail/Grocery/Bakery,Unknown,Stores,93,Indonesia,"","","","","","","","","","","","","","","","",Christian extremists,"","","","","","The specific motive is unknown; however, sources noted that the attack occurred on Eid ul Fitr, a Muslim holiday.",0,"","",0,-99,0,0,"","","","","","","","","",8,Incendiary,18,Arson/Fire,"","","","","","","","","","","","","",0,0,0,3,0,3,1,4,Unknown,-99,An unknown number of shops were damaged in this attack.,0,"","","","","","","","","","","","","","","","","\"\"\"Police Probe GIDI President over Tolikara Incident","\"\" Tempo.co",August 5,"2015.\"","\"\"\"Extremists burn down mosque on Eid","\"\" World Bulletin",July 17,"2015.\"",""
201507200081,2015,7,20,"",0,"",93,5,Southeast Asia,Yogyakarta,Bangunharjo,-7.8348,110.366463,1,0,The incident occurred in Saman hamlet,"07/20/2015: Assailants set a tire on fire at the front door of a Baptist Church in Saman hamlet, Bangunharjo sub-district, Yogyakarta province, Indonesia. No casualties were reported. No group claimed responsibility for the incident.",1,1,1,0,"","",0,1,0,7,Facility/Infrastructure Attack,"","","","",15,Religious Figures/Institutions,86,Place of Worship,Unknown,Baptist Church,93,Indonesia,"","","","","","","","","","","","","","","","",Unknown,"","","","","","The specific motive is unknown; however, sources noted that a mosque had recently been targeted in a predominantly Christian area.",0,"","",0,4,0,0,"","","","","","","","","",8,Incendiary,20,Gasoline or Alcohol,"","","","","","","","","","","","",Gasoline was used in the attack.,0,0,0,0,0,0,1,3,Minor (likely < $1 million),-99,The front of a church was damaged in this attack.,0,"","","","","","","","","","","","","","","","","\"\"\"Indonesian churches attacked after mosque burned on Eid","\"\" MENAFN",July 22,"2015.\"","\"\"\"Two churches in Yogya",C. Java survive arson attacks,"\"\" Jakarta Post",July 22,"2015.\""
201507200082,2015,7,20,"",0,"",93,5,Southeast Asia,Central Java,Tlepok,-7.784329,109.897585,1,0,"","07/20/2015: Assailants set fire to the front door and the western entrance of the Javanese Christian Church (GKJ) in Tlepok sub-district, Central Java province, Indonesia. No casualties were reported. No group claimed responsibility for the incident.",1,1,1,0,"","",0,1,0,7,Facility/Infrastructure Attack,"","","","",15,Religious Figures/Institutions,86,Place of Worship,Javanese Christian Church (GKJ),Church,93,Indonesia,"","","","","","","","","","","","","","","","",Unknown,"","","","","","The specific motive is unknown; however, sources noted that a mosque was recently targeted in a predominantly Christian area.",0,"","",0,4,0,0,"","","","","","","","","",8,Incendiary,18,Arson/Fire,"","","","","","","","","","","","",Gasoline was used in the attack.,0,0,0,0,0,0,1,3,Minor (likely < $1 million),-99,The front of a church was damaged in this attack.,0,"","","","","","","","","","","","","","","","","\"\"\"Indonesian churches attacked after mosque burned on Eid","\"\" MENAFN",July 22,"2015.\"","\"\"\"Two churches in Yogya",C. Java survive arson attacks,"\"\" Jakarta Post",July 22,"2015.\""
201508190123,2015,8,19,"",0,"",93,5,Southeast Asia,Central Sulawesi,Unknown,-1.342116,121.655155,4,0,The incident occurred in the Auma area,"08/19/2015: Assailants opened fire on police personnel in Auma area, Central Sulawesi province, Indonesia. A police officer was killed in the attack. No group claimed responsibility; however, a source attributed the incident to Mujahidin Indonesia Timur (MIT).",1,1,1,0,"","",0,1,0,2,Armed Assault,"","","","",3,Police,25,Police Security Forces/Officers,Indonesian National Police (INP),Officers,93,Indonesia,"","","","","","","","","","","","","","","","",Mujahidin Indonesia Timur (MIT),"","","","","","",0,"","",0,-99,0,0,"","","","","","","","","",5,Firearms,5,Unknown Gun Type,"","","","","","","","","","","","","",1,0,0,0,0,0,0,"","","","",0,"","","","","","","","","","","","","","","","","\"\"\"Indonesian cop killed in jungle ambush","\"\" The Straits Times (Singapore)",August 22,"2015.\"","","",START Primary Collection,0,0
201508290051,2015,8,29,"",0,"",93,5,Southeast Asia,Jakarta,East Jakarta,-6.226782,106.900175,1,0,The incident occurred near the Citarum Barat River,"08/29/2015: Security forces discovered and defused an explosive device in East Jakarta, Indonesia. No group claimed responsibility for the incident.",1,1,1,0,"","",0,0,0,3,Bombing/Explosion,"","","","",20,Unknown,"","",Unknown,Unknown,93,Indonesia,"","","","","","","","","","","","","","","","",Unknown,"","","","","","",0,"","",0,-99,0,0,"","","","","","","","","",6,Explosives,"","","","","","","","","","","","","","",A locally assembled explosive device made of an iron paralon pipe with a battery circuit and cables inside a plastic bag was used in the attack.,0,0,0,0,0,0,0,"","","","",0,"","","","","","","","","","","","","","","","","\"\"\"Greater Jakarta: Resident finds homemade bomb in E. Jakarta","\"\" Jakarta Post",August 31,"2015.\"","\"\"\"Kalimalang Bomb Professionally Assembled: Police","\"\" Tempo.co",August 30,"2015.\"","\"\"\"POLICE DEFUSE AND EXPLODE LOCALLY ASSEMBLED BOMB"
