201702270001,2017,2,27,"",0,"",93,5,Southeast Asia,West Java,Bandung,-6.909219,107.593381,1,0,The incident occurred at Pandawa Park in the Bandung neighborhood.,"02/27/2017: An assailant detonated an explosive device at Pandawa Park in Bandung, West Java, Indonesia. The assailant then fled to a nearby government building, which he set on fire before being shot and killed by security forces. No other casualties were reported in the attack. No group claimed responsibility for the incident; however, sources identified the assailant, Yayat Cahdiyat, as a member of Jamaah Ansharut Daulah. Additionally, sources suspected that Cahdiyat may have been a member of Jamaah Ansharut Tauhid (JAT).",1,1,1,0,"","",0,1,0,3,Bombing/Explosion,2,Armed Assault,7,Facility/Infrastructure Attack,2,Government (General),21,Government Building/Facility/Office,Government of Bandung,Building,93,Indonesia,14,Private Citizens & Property,79,"Public Area (garden, parking lot, garage, beach, public building, camp)",Pandawa Park,Park,93,Indonesia,"","","","","","","","",Jamaah Ansharut Daulah,"",Jamaah Ansharut Tauhid (JAT),"","","","The specific motive is unknown; however, sources noted that the assailant, Yayat Cahdiyat had allegedly demanded the release of his associates from prison.",0,1,"",0,1,0,0,"","",0,"","","","","","",6,Explosives,17,Other Explosive Type,5,Firearms,5,Unknown Gun Type,8,Incendiary,18,Arson/Fire,"","","","","An explosives-laden pressure cooker, firearms, fire, and a knife were used in the attack.",1,0,1,0,0,0,1,3,Minor (likely < $1 million),-99,"An office building was damaged in this attack,",0,"","","","","","","","","","","","","","","","","\"\"\"Police Chief: Malaysia Police Capture Bandung Bomber Suspect","\"\" Tempo.co",December 12,"2017.\"","\"\"\"IS-linked Indonesian shot dead after bomb attack","\"\" Agence France-Presse Top News (English)",t,February 27,"2017.\""
201704080042,2017,4,8,"",0,"",93,5,Southeast Asia,East Java,Tuban district,-6.984746,111.952249,3,0,"","04/08/2017: Assailants opened fire on Traffic Police officers in Tuban district, East Java, Indonesia. At least six assailants were killed in the ensuing clash. No group claimed responsibility; however, sources attributed the attack to Jamaah Ansharut Daulah.",1,1,1,0,"","",0,0,0,2,Armed Assault,"","","","",3,Police,25,Police Security Forces/Officers,Traffic Police,Officers,93,Indonesia,"","","","","","","","","","","","","","","","",Jamaah Ansharut Daulah,"","","","","","",0,"","",0,6,0,0,"","","","","","","","","",5,Firearms,2,Automatic or Semi-Automatic Rifle,"","","","","","","","","","","","",M16 machine guns were used in the attack.,6,0,6,0,0,0,0,"","","","",0,"","","","","","","","","","","","","","","","","\"\"\"Firefight kills six linked to Islamic State after failed ambush in Indonesia","\"\" Japan Times",April 9,"2017.\"","\"\"\"Thailand: 6 men linked to IS killed after failed ambush in Indonesia","\"\" Bangkok Post Online",April 9,"2017.\"","\"\"\"Police kill six suspected Islamic militants in Indonesia"
201704110029,2017,4,11,"",0,"",93,5,Southeast Asia,Central Java,Banyumas,-7.514167,109.294167,1,0,The incident occurred in Banyumas district.,"04/11/2017: An assailant rammed his motorcycle into a police station and stabbed police officers in Banyumas, Central Java, Indonesia. Three police officers were injured in the attack before the assailant, identified as Muhammad Ibnu Dar, was arrested. No group claimed responsibility for the incident; however, sources attributed the attack to Jamaah Ansharut Daulah.",1,1,1,0,"","",0,1,0,2,Armed Assault,"","","","",3,Police,22,"Police Building (headquarters, station, school)",Indonesian National Police (INP),Banyumas Municipal Police Station,93,Indonesia,"","","","","","","","","","","","","","","","",Jamaah Ansharut Daulah,"","","","","","The specific motive is unknown; however, sources suspected that the attack was carried out in response to the arrest of Jamaah Ansharut Daulah leaders.",0,"","",0,1,1,0,"","","","","","","","","",9,Melee,23,Knife or Other Sharp Object,10,"Vehicle (not to include vehicle-borne explosives, i.e., car or truck bombs)","","","","","","","","","","",A Honda Beat motorcycle and a machete were used in the attack.,0,0,0,3,0,0,0,"","","","",0,"","","","","","","","","","","","","","","","The victims included Ata Suparta, Irfan, and Karsono.","\"\"\"Banyumas Police Attacker Motivated by Recent Shooting of IS Militants: Police Chief","\"\" Jakarta Globe",April 12,"2017.\"","\"\"\"Indonesia: Alleged ISIL supporter injures three police officers in knife attack in Banyumas",Central Java,"\"\" OSC Report (from multiple sources)",April 11,"2017.\""
201704110034,2017,4,11,"",0,"",93,5,Southeast Asia,Jakarta,Jakarta,-6.132423,106.874438,1,0,"","04/11/2017: Assailants attacked Senior Corruption Eradication Commission (KPK) investigator Novel Baswedan with acid in North Jakarta, Jakarta Special Capital Region, Indonesia. Baswedan was wounded in the attack. No group claimed responsibility for the incident.",1,1,1,0,"","",0,1,0,8,Unarmed Assault,"","","","",2,Government (General),18,"Government Personnel (excluding police, military)",Senior Corruption Eradication Commission (KPK),Investigator: Novel Baswedan,93,Indonesia,"","","","","","","","","","","","","","","","",Unknown,"","","","","","",0,"","",0,2,0,0,"","","","","","","","","",2,Chemical,"","","","","","","","","","","","","","",Acid was used in the attack.,0,0,0,1,0,0,0,"","","","",0,"","","","","","","","","","","","","","","","","\"\"\"Novel to undergo eye surgery","\"\" Jakarta Post",February 11,"2018.\"","\"\"\"Cops Desperate to Solve Novel Attack Case",Ombudsman Says,"\"\" Tempo.co",January 26,"2018.\""
201704130019,2017,4,13,"",0,"",93,5,Southeast Asia,Central Java,Ambarawa,-7.26024,110.396835,1,0,The incident occurred in the Panjang neighborhood.,"04/13/2017: An explosive device detonated at St. Yusuf Catholic Church in Ambarawa, Central Java, Indonesia. There were no reported casualties in the blast. No group claimed responsibility for the incident.",1,1,1,0,"","",0,1,0,3,Bombing/Explosion,"","","","",15,Religious Figures/Institutions,86,Place of Worship,St. Yusuf Catholic Church,Church,93,Indonesia,"","","","","","","","","","","","","","","","",Unknown,"","","","","","",0,"","",0,1,1,0,"","","","","","","","","",6,Explosives,17,Other Explosive Type,"","","","","","","","","","","","",A firework placed in a glass bottle was used in the attack.,0,0,0,0,0,0,0,"","","","",0,"","","","","","","","","","","","","","","","","\"\"\"Indonesia: Jokowi Urges Caution After Minor Explosion at Ambarawa Church","\"\" Jakarta Globe Online",April 14,"2017.\"","","",START Primary Collection,-9,-9
201705240002,2017,5,24,"",0,"",93,5,Southeast Asia,Jakarta,Jakarta,-6.229956,106.866515,1,0,The incident occurred in the Kampung Melayu neighborhood.,"05/24/2017: A suicide bomber detonated at a toilet near a bus station in Kampung Melayu neighborhood, Jakarta, Indonesia. This was one of two suicide bombings at the same station within a short period of time. In addition to the two assailants, at least three police officers were killed and ten people, including five officers and five civilians, were injured across both blasts. Jamaah Ansharut Daulah claimed responsibility for the incidents. Sources also suspected the possible involvement of Mujahidin Indonesia Timur (MIT) in the attacks.",1,1,1,0,"","",1,1,1,3,Bombing/Explosion,"","","","",3,Police,25,Police Security Forces/Officers,Indonesian National Police (INP),Officers,93,Indonesia,19,Transportation,101,Bus Station/Stop,TransJakarta,Bust Station,93,Indonesia,"","","","","","","","",Jamaah Ansharut Daulah,"",Mujahidin Indonesia Timur (MIT),"","","","",0,1,"",0,1,0,1,7,"Posted to website, blog, etc.",0,"","","","","","",6,Explosives,13,Suicide (carried bodily by human being),"","","","","","","","","","","","","An explosives-laden pressure cooker containing triacetone triperoxide, nails, and buckshots and concealed inside a carrier bag was used in the attack.",3,0,1,5,0,0,1,3,Minor (likely < $1 million),-99,A bus station was damaged in this attack.,0,"","","","","","","","","","","","","","","","Casualty numbers conflict across sources. Following GTD protocol, the lowest reliable estimates are reported here. Casualty numbers represent a division of the total number of those killed and wounded across incidents 201705240002 and 201705240003. The victims included Taufan Tsunami and Ridho Setiawan.","\"\"\"Police Identify Explosives Used in Kampung Melayu Suicide Attack","\"\" Jakarta Globe",May 28,"2017.\"","\"\"\"Indonesia makes arrests as Islamic State claims Jakarta attacks","\"\" Reuters UK",May 26,"2017.\"","\"\"\"IS claims suicide attack on Jakarta bus station"
201705240003,2017,5,24,"",0,"",93,5,Southeast Asia,Jakarta,Jakarta,-6.229956,106.866515,1,0,The incident occurred in the Kampung Melayu neighborhood.,"05/24/2017: A suicide bomber detonated at a bus station in Kampung Melayu neighborhood, Jakarta, Indonesia. This was one of two suicide bombings at the same station within a short period of time. In addition to the two assailants, at least three police officers were killed and ten people, including five officers and five civilians, were injured across both blasts. Jamaah Ansharut Daulah claimed responsibility for the incidents. Sources also suspected the possible involvement of Mujahidin Indonesia Timur (MIT) in the attacks.",1,1,1,0,"","",1,1,1,3,Bombing/Explosion,"","","","",3,Police,25,Police Security Forces/Officers,Indonesian National Police (INP),Officers,93,Indonesia,19,Transportation,101,Bus Station/Stop,TransJakarta,Bus Station,93,Indonesia,"","","","","","","","",Jamaah Ansharut Daulah,"",Mujahidin Indonesia Timur (MIT),"","","","",0,1,"",0,1,0,1,7,"Posted to website, blog, etc.",0,"","","","","","",6,Explosives,13,Suicide (carried bodily by human being),"","","","","","","","","","","","","An explosives-laden pressure cooker containing triacetone triperoxide, nails, and buckshots and concealed inside a carrier bag was used in the attack.",2,0,1,5,0,0,1,3,Minor (likely < $1 million),-99,A bus station was damaged in this attack.,0,"","","","","","","","","","","","","","","","Casualty numbers conflict across sources. Following GTD protocol, the lowest reliable estimates are reported here. Casualty numbers represent a division of the total number of those killed and wounded across incidents 201705240002 and 201705240003. The victims included Imam Giland Adinata.","\"\"\"Police Identify Explosives Used in Kampung Melayu Suicide Attack","\"\" Jakarta Globe",May 28,"2017.\"","\"\"\"Indonesia makes arrests as Islamic State claims Jakarta attacks","\"\" Reuters UK",May 26,"2017.\"","\"\"\"IS claims suicide attack on Jakarta bus station"
201706250002,2017,6,25,"",0,"",93,5,Southeast Asia,North Sumatra,Medan,3.59143,98.669477,1,0,"","06/25/2017: Two assailants stabbed and killed a police officer at a checkpost in Medan, North Sumatra, Indonesia. One assailant was killed and another assailant was injured as police personnel responded to the attack. No group claimed responsibility for the incident; however, sources identified the assailants as members of Jamaah Ansharut Daulah.",1,1,1,0,"","",0,1,0,2,Armed Assault,"","","","",3,Police,22,"Police Building (headquarters, station, school)",Indonesian National Police (INP),Checkpost,93,Indonesia,"","","","","","","","","","","","","","","","",Jamaah Ansharut Daulah,"","","","","","",0,"","",0,2,1,0,"","","","","","","","","",9,Melee,23,Knife or Other Sharp Object,"","","","","","","","","","","","","",2,0,1,1,0,1,0,"","","","",0,"","","","","","","","","","","","","","","",The victims included Aiptu Martua Sigalingging.,"\"\"\"UPDATE1: Militants attack Sumatra police HQ",2 killed,on Eid al-Fitr holiday,"\"\" Japan Economic Newswire",June 25,"2017.\"","\"\"\"North Sumatra Attacker Spent Six Months in Syria: Police","\"\" Jakarta Globe",June 27
201706300012,2017,6,30,"",0,"",93,5,Southeast Asia,Jakarta,Jakarta,-6.241655,106.800505,1,0,"","\"06/30/2017: An assailant armed with a bayonet stabbed two police officers at the Falatehan mosque in Jakarta, Indonesia. The assailant was killed and the two police officers were injured in the attack. No group claimed responsibility for the incident; however, sources stated that the assailant shouted \"\"infidel\"\" while carrying out the attack.\"",1,1,1,0,"","",0,1,0,2,Armed Assault,"","","","",3,Police,25,Police Security Forces/Officers,Mobile Brigade,Officers,93,Indonesia,"","","","","","","","","","","","","","","","",Muslim extremists,"","","","","","\"The specific motive is unknown; however, sources noted that the assailant allegedly yelled \"\"infidel\"\" while carrying out the attack.\"",0,"","",0,1,0,0,"","","","","","","","","",9,Melee,23,Knife or Other Sharp Object,"","","","","","","","","","","","",A bayonet was used in the attack.,1,0,1,2,0,0,0,"","","","",0,"","","","","","","","","","","","","","","","","\"\"\"Two Indonesian Police Officers Stabbed by Suspected Militant","\"\" New York Times",June 30,"2017.\"","\"\"\"Indonesian policemen injured in attack by Muslim militant","\"\" Japan Economic Newswire",June 30,"2017.\"","\"\"\"Suspected militant shot dead after stabbing Indonesian policemen.(Uncategorized)"
201707050032,2017,7,5,"",0,"",93,5,Southeast Asia,Central Java,Sidareja,-7.484817,108.7834,1,0,"","07/05/2017: An explosive device detonated at a Religious Affairs Office (KUA) in Sidareja, Central Java, Indonesia. There were no reported casualties in the blast. No group claimed responsibility for the attack.",1,1,1,0,"","",0,1,0,3,Bombing/Explosion,"","","","",2,Government (General),21,Government Building/Facility/Office,Government of Indonesia,Religious Affairs Office (KUA),93,Indonesia,"","","","","","","","","","","","","","","","",Unknown,"","","","","","",0,"","",0,-99,0,0,"","","","","","","","","",6,Explosives,17,Other Explosive Type,"","","","","","","","","","","","",A three-kilogram explosive device contained in a gas canister was used in the attack.,0,0,0,0,0,0,1,3,Minor (likely < $1 million),-99,An office was damaged in this attack.,0,"","","","","","","","","","","","","","","",A pamphlet was discovered at the scene of the blast that expressed displeasure with a cleric in Cirebon.,"\"\"\"Gas canister 'bomb' explodes at Religious Affairs Office in Central Java","\"\" Jakarta Post",July 5,"2017.\"","\"\"\"Indonesia: State PAS News Roundup 06 July 2017","\"\" US Embassy Public Affairs Section",July 6,"2017.\"",""
201708030025,2017,8,3,"",0,"",93,5,Southeast Asia,Central Sulawesi,Lobu,0.559,121.211122,1,0,The incident occurred in the Parigi Moutong district.,"08/03/2017: Assailants shot and killed a farmer at his farm in Lobu, Central Sulawesi, Indonesia. No group claimed responsibility; however, sources attributed the attack to the Mujahidin Indonesia Timur (MIT).",1,1,1,0,"","",0,1,0,2,Armed Assault,"","","","",14,Private Citizens & Property,72,Farmer,Not Applicable,Farmer: Simson,93,Indonesia,"","","","","","","","","","","","","","","","",Mujahidin Indonesia Timur (MIT),"","","","","","",0,"","",0,-99,0,0,"","","","","","","","","",5,Firearms,5,Unknown Gun Type,"","","","","","","","","","","","","",1,0,0,0,0,0,0,"","","","",0,"","","","","","","","","","","","","","","","","\"\"\"Central Sulawesi farmer allegedly shot dead by MIT terrorist","\"\" Jakarta Post",August 3,"2017.\"","\"\"\"ASD -- Southeast Asia Terrorist Media Weekly Wrap-up 30 July - 12 August 2017","\"\" US Army Asian Studies Detachment",August 21,"2017.\"",""
201709030016,2017,9,3,"",0,"",93,5,Southeast Asia,Jakarta,Jakarta,-6.194019,106.825309,1,0,"","09/03/2017: An assailant threw a petrol bomb at the Embassy of Myanmar in Jakarta, Indonesia. There were no reported casualties in the attack. No group claimed responsibility for the incident.",1,1,1,0,"","",0,1,0,7,Facility/Infrastructure Attack,"","","","",7,Government (Diplomatic),46,Embassy/Consulate,Ministry of Foreign Affairs,Embassy of Myanmar to Indonesia,138,Myanmar,"","","","","","","","","","","","","","","","",Unknown,"","","","","","The specific motive is unknown; however, sources noted that the attack may have been related to a demonstration against the persecution of members of the Rohingya community in Myanmar.",0,"","",0,1,0,0,"","","","","","","","","",8,Incendiary,19,Molotov Cocktail/Petrol Bomb,"","","","","","","","","","","","",A petrol bomb was used in the attack.,0,0,0,0,0,0,1,3,Minor (likely < $1 million),-99,A terrace was damgaed in this attack.,0,"","","","","","","","","","","","","","","","","\"\"\"Indonesian envoy to urge halt to violence against Rohingya Muslims","\"\" The Irish Times",September 4,"2017.\"","\"\"\"Burma: Explosions rock Arakan border region","\"\" Democratic Voice of Burma Online",September 4,"2017.\"","\"\"\"Burma: Petrol bomb thrown at Myanmar embassy in Indonesia"
