201509070082,2015,9,7,"September 1-13, 2015",0,"",93,5,Southeast Asia,Central Sulawesi,Balinggi,-1.062318,120.366831,1,0,"","09/00/2015: Between September 1st and September 13th, assailants beheaded Nyoman Astika, a farmer, in Balinggi village, Central Sulawesi province, Indonesia. No group claimed responsibility for the incident; however, sources attributed the attack to Mujahidin Indonesia Timur (MIT) and stated that the attack was carried out in revenge for an encounter between police and the group in August.",1,1,1,0,"","",0,1,0,6,Hostage Taking (Kidnapping),"","","","",14,Private Citizens & Property,72,Farmer,Not Applicable,Farmer: Nyoman Astika,93,Indonesia,"","","","","","","","","","","","","","","","",Mujahidin Indonesia Timur (MIT),"","","","","","The specific motive is unknown; however, sources posited that the attack was carried out in retaliation for an encounter between police and Mujahidin Indonesia Timur (MIT) in August 2015.",0,"","",0,-99,0,0,"","","","","","","","","",9,Melee,23,Knife or Other Sharp Object,"","","","","","","","","","","","","",1,0,0,0,0,0,0,"","","","",1,1,0,-99,"","","",0,"","","","","",4,Hostage(s) killed (not during rescue attempt),0,"","\"\"\"Santoso terrorists accused of 3 murders in C. Sulawesi","\"\" Jakarta Post",September 17,"2015.\"","","",START Primary Collection,0,0
201509090070,2015,9,9,"",1,"",93,5,Southeast Asia,Papua,Skopro,-2.945536,140.973754,1,0,"","09/09/2015: Assailants opened fire on loggers in Skopro village, Papua province, Indonesia. At least one person was injured and two others were abducted by the assailants. The hostages were freed on September 17, 2015. The Free Papua Movement (OPM-Organisasi Papua Merdeka) claimed responsibility for the incident and demanded the release of two detainees in exchange for the victims.",1,1,1,0,"","",0,1,0,6,Hostage Taking (Kidnapping),2,Armed Assault,"","",1,Business,5,Industrial/Textiles/Factory,Unknown,"Loggers: Kuba Marmahu, Ladiri, Badar",93,Indonesia,"","","","","","","","","","","","","","","","",Free Papua Movement (OPM-Organisasi Papua Merdeka),"","","","","",The Free Papua Movement (OPM-Organisasi Papua Merdeka) claimed responsibility for the incident and demanded the release of two detainees in exchange for the victims.,0,"","",0,-99,0,1,8,Personal claim,"","","","","","","",5,Firearms,5,Unknown Gun Type,"","","","","","","","","","","","","",0,0,0,1,0,0,0,"","","","",1,2,0,"",8,"","",0,"","","","",The assailants demanded the release of two individuals imprisoned by the Keerom Police in exchange for the hostage victims.,2,Hostage(s) released by perpetrators,2,"Casualty numbers for this attack conflict across sources. Following GTD protocol, the majority reliable estimates are reported here.","\"\"\"Indonesia: Hostages freed",hunt for captors goes on,"\"\" The Jakarta Post Online",September 19,"2015.\"","\"\"\"PNG soldiers free Indonesian captives","\"\" Radio New Zealand",September 18,"2015.\""
201509140092,2015,9,14,"",0,"",93,5,Southeast Asia,Central Sulawesi,Torue,-1.030164,120.274027,1,0,"","09/14/2015: Assailants attacked and killed a civilian identified as Hengky in Torue village, Central Sulawesi province, Indonesia. No group claimed responsibility for the incident; however, sources attributed the attack to Mujahidin Indonesia Timur (MIT) and stated that the attack was carried out in revenge for an encounter between police and the group in August.",1,1,1,0,"","",0,1,0,9,Unknown,"","","","",14,Private Citizens & Property,68,Named Civilian,Not Applicable,Civilian: Hengky,93,Indonesia,"","","","","","","","","","","","","","","","",Mujahidin Indonesia Timur (MIT),"","","","","","The specific motive is unknown; however, sources posited that the attack was carried out in retaliation for an encounter between police and the Mujahidin Indonesia Timur (MIT) in August 2015.",0,"","",0,-99,0,0,"","","","","","","","","",13,Unknown,"","","","","","","","","","","","","","","",1,0,0,0,0,0,0,"","","","",0,"","","","","","","","","","","","","","","","","\"\"\"Santoso terrorists accused of 3 murders in C. Sulawesi","\"\" Jakarta Post",September 17,"2015.\"","","",START Primary Collection,0,0
201509150083,2015,9,8,"September 1-15, 2015",0,"",93,5,Southeast Asia,Central Sulawesi,Salubunga,0.581565,120.803539,2,1,"","09/00/2015: Between September 1 and September 15, 2015, assailants attacked and killed a civilian near Salubunga village, Central Sulawesi province, Indonesia. No group claimed responsibility for the incident; however, sources attributed the attack to Mujahidin Indonesia Timur (MIT) and stated that the attack was carried out in revenge for an encounter between police and the group in August.",1,1,1,0,"","",0,1,0,2,Armed Assault,"","","","",14,Private Citizens & Property,67,Unnamed Civilian/Unspecified,Not Applicable,Civilian,93,Indonesia,"","","","","","","","","","","","","","","","",Mujahidin Indonesia Timur (MIT),"","","","","","The specific motive is unknown; however, sources posited that the attack was carried out in retaliation for an encounter between police and the Mujahidin Indonesia Timur (MIT) in August 2015.",0,"","",0,-99,0,0,"","","","","","","","","",9,Melee,23,Knife or Other Sharp Object,"","","","","","","","","","","","","",1,0,0,0,0,0,0,"","","","",0,"","","","","","","","","","","","","","","","","\"\"\"Santoso terrorists accused of 3 murders in C. Sulawesi","\"\" Jakarta Post",September 17,"2015.\"","","",START Primary Collection,0,0
201509170117,2015,9,17,"",0,"",93,5,Southeast Asia,Central Sulawesi,Sausu,-1.053327,120.449562,1,0,"","09/17/2015: Assailants beheaded three people in Sausu, Central Sulawesi, Indonesia. No group claimed responsibility; however, sources attributed the attack to the Mujahidin Indonesia Timur (MIT).",1,1,1,0,"","",0,1,0,6,Hostage Taking (Kidnapping),"","","","",14,Private Citizens & Property,67,Unnamed Civilian/Unspecified,Not Applicable,Civilians,93,Indonesia,"","","","","","","","","","","","","","","","",Mujahidin Indonesia Timur (MIT),"","","","","","",0,"","",0,-99,1,0,"","","","","","","","","",9,Melee,23,Knife or Other Sharp Object,"","","","","","","","","","","","","",3,0,0,0,0,0,0,"","","","",1,3,0,-99,"","","",0,"","","","","",4,Hostage(s) killed (not during rescue attempt),0,"","\"\"\"New terrorist leader",wife captured without a fight,"\"\" Jakarta Post",September 15,"2016.\"","","",START Primary Collection,0
201510070087,2015,10,7,"",0,"",93,5,Southeast Asia,Central Sulawesi,Poso,-1.394556,120.754062,1,0,The incident occurred in the Poso Pesisir neighborhood.,"10/07/2015: Assailants opened fire on a police armored vehicle in Poso Pesisir neighborhood, Poso town, Central Sulawesi province, Indonesia. There were no reported casualties. No group claimed responsibility for the incident; however, sources attributed the attack to Mujahidin Indonesia Timur (MIT).",1,1,1,0,"","",0,0,0,2,Armed Assault,"","","","",3,Police,23,Police Patrol (including vehicles and convoys),Indonesian National Police (INP),Police Vehicle,93,Indonesia,"","","","","","","","","","","","","","","","",Mujahidin Indonesia Timur (MIT),"","","","","","",0,"","",0,2,0,0,"","","","","","","","","",5,Firearms,5,Unknown Gun Type,"","","","","","","","","","","","","",0,0,0,0,0,0,0,"","","","",0,"","","","","","","","","","","","","","","","","\"\"\"Chinese Uighurs key players in IS-linked MIT: Police","\"\" Jakarta Post",January 7,"2016.\"","","",START Primary Collection,0,0
201510130072,2015,10,13,"",0,"",93,5,Southeast Asia,Aceh,Suka Makmur,5.397895,95.362715,1,0,"","10/13/2015: Assailants set fire to a church in Suka Makmur village, Aceh province, Indonesia. There were no reported casualties in the attack. This was one of three related attacks targeting churches in Aceh on this date. No group claimed responsibility for the incidents; however, sources attributed the attacks to the Aceh Singkil Islamic Care Youth Students Association (PPI).",1,1,1,0,"","",1,1,0,7,Facility/Infrastructure Attack,"","","","",15,Religious Figures/Institutions,86,Place of Worship,Huria Kristinen Indonesia,Church,93,Indonesia,"","","","","","","","","","","","","","","","",Aceh Singkil Islamic Care Youth Students Association (PPI),"","","","","","The specific motive is unknown; however, sources noted that there had been recent complaints regarding churches lacking permits.",0,"","",0,20,3,0,"","","","","","","","","",8,Incendiary,18,Arson/Fire,"","","","","","","","","","","","","",0,0,0,0,0,0,1,3,Minor (likely < $1 million),-99,A church was damaged in this attack.,0,"","","","","","","","","","","","","","","","","\"\"\"Indonesian president urges calm after clashes over Aceh church","\"\" Deutsche Presse-Agentur",October 14,"2015.\"","\"\"\"Aceh Singkil shooting suspect arrested",fair settlement sought,"\"\" Jakarta Post",October 18,"2015.\""
201510130073,2015,10,13,"",0,"",93,5,Southeast Asia,Aceh,Aceh Singkil district,2.358946,97.87216,3,0,"","10/13/2015: Assailants set fire to a church in Aceh Singkil district, Aceh province, Indonesia. There were no reported casualties in the attack. This was one of three related attacks targeting churches in Aceh on this date. No group claimed responsibility for the incidents; however, sources attributed the attacks to the Aceh Singkil Islamic Care Youth Students Association (PPI).",1,1,1,0,"","",1,1,0,7,Facility/Infrastructure Attack,"","","","",15,Religious Figures/Institutions,86,Place of Worship,Unknown,Catholic Church,93,Indonesia,"","","","","","","","","","","","","","","","",Aceh Singkil Islamic Care Youth Students Association (PPI),"","","","","","The specific motive is unknown; however, sources noted that there had been recent complaints regarding churches lacking permits.",0,"","",0,20,3,0,"","","","","","","","","",8,Incendiary,18,Arson/Fire,"","","","","","","","","","","","","",0,0,0,0,0,0,1,3,Minor (likely < $1 million),-99,A church was damaged in this attack.,0,"","","","","","","","","","","","","","","","","\"\"\"Indonesian president urges calm after clashes over Aceh church","\"\" Deutsche Presse-Agentur",October 14,"2015.\"","\"\"\"Aceh Singkil shooting suspect arrested",fair settlement sought,"\"\" Jakarta Post",October 18,"2015.\""
201510130074,2015,10,13,"",0,"",93,5,Southeast Asia,Aceh,Dangguran,2.351637,97.863914,2,0,The incident occurred in the Aceh Singkil district.,"10/13/2015: Assailants attacked a church in Dangguran village, Aceh Singkil district, Aceh province, Indonesia. An assailant was killed and four others, including a police officer and three assailants, were injured in the ensuing clash. This was one of three related attacks targeting churches in Aceh on this date. No group claimed responsibility for the incidents; however, sources attributed the attacks to the Aceh Singkil Islamic Care Youth Students Association (PPI).",1,1,1,0,"","",1,1,0,7,Facility/Infrastructure Attack,"","","","",15,Religious Figures/Institutions,86,Place of Worship,Unknown,Catholic Church,93,Indonesia,"","","","","","","","","","","","","","","","",Aceh Singkil Islamic Care Youth Students Association (PPI),"","","","","","The specific motive is unknown; however, sources noted that there had been recent complaints regarding churches lacking permits.",0,"","",0,20,3,0,"","","","","","","","","",8,Incendiary,18,Arson/Fire,13,Unknown,"","","","","","","","","","","",1,0,1,4,0,3,1,3,Minor (likely < $1 million),-99,A church was damaged in this attack.,0,"","","","","","","","","","","","","","","","","\"\"\"Indonesian president urges calm after clashes over Aceh church","\"\" Deutsche Presse-Agentur",October 14,"2015.\"","\"\"\"Aceh Singkil shooting suspect arrested",fair settlement sought,"\"\" Jakarta Post",October 18,"2015.\""
201511290002,2015,11,29,"",0,"",93,5,Southeast Asia,Central Sulawesi,Maranda,-1.267704,120.576326,1,0,"","11/29/2015: An assailant shot and killed a soldier in Maranda village, Central Sulawesi province, Indonesia. No group claimed responsibility for the incident; however, sources attributed the attack to Mujahidin Indonesia Timur (MIT).",1,1,0,1,1,Insurgency/Guerilla Action,0,1,0,2,Armed Assault,"","","","",4,Military,34,"Military Personnel (soldiers, troops, officers, forces)",Indonesian National Armed Forces (TNI),72 Raider Infantry Battalion Soldier,93,Indonesia,"","","","","","","","","","","","","","","","",Mujahidin Indonesia Timur (MIT),"","","","","","",0,"","",0,1,0,0,"","","","","","","","","",5,Firearms,5,Unknown Gun Type,"","","","","","","","","","","","","",1,0,0,0,0,0,0,"","","","",0,"","","","","","","","","","","","","","","","","\"\"\"Indonesian soldier killed in ambush in Poso","\"\" Jakarta Post",November 29,"2015.\"","","",START Primary Collection,0,0
201511300029,2015,11,30,"",0,"",93,5,Southeast Asia,Papua,Namuni Kampong,-2.533126,137.763757,2,0,"","11/30/2015: Assailants attacked Major John de Fretes and two other soldiers in Namuni Kampong, Papua province, Indonesia. Fretes, a senior military officer, was killed in the attack. No group claimed responsibility for the incident; however, sources attributed the attack to separatists.",1,1,0,1,1,Insurgency/Guerilla Action,0,1,0,2,Armed Assault,"","","","",4,Military,34,"Military Personnel (soldiers, troops, officers, forces)",Indonesian Army (TNI-AD),"Soldiers: Major John de Fretes, Avan, Simon",93,Indonesia,"","","","","","","","","","","","","","","","",Separatists,"","","","","","",0,"","",0,-99,0,0,"","","","","","","","","",5,Firearms,5,Unknown Gun Type,"","","","","","","","","","","","","",1,0,0,"",0,0,0,"","","","",0,"","","","","","","","","","","","","","","","","\"\"\"Suspected rebels kill military officer in Indonesia's Papua","\"\" Deutsche Presse-Agentur",December 1,"2015.\"","\"\"\"Suspected rebels kill military officer in Indonesia's Papua","\"\" Global English (Middle East and North Africa Financial Network)",December 1,"2015.\"","\"\"\"Indonesia: Military officer shot dead by separatist"
201512270050,2015,12,27,"",0,"",93,5,Southeast Asia,Papua,Sinak,-3.68219,137.493137,2,1,The incident occurred in Puncak Jaya district.,"12/27/2015: Assailants opened fire on an Indonesian National Police (INP) station in Sinak subdistrict, Puncak Jaya district, Papua province, Indonesia. At least three officers were killed and two others were injured in the assault. No group claimed responsibility; however, sources attributed the attack to Lekagak Tenggamati. Additional sources suspected that the incident was carried out by the Free Papua Movement (OPM-Organisasi Papua Merdeka).",1,1,1,0,"","",0,1,0,2,Armed Assault,"","","","",3,Police,22,"Police Building (headquarters, station, school)",Indonesian National Police (INP),Police Station,93,Indonesia,"","","","","","","","","","","","","","","","",Lekagak Tenggamati,"",Free Papua Movement (OPM-Organisasi Papua Merdeka),"","","","The specific motive is unknown; however, sources suspected that the attack may have been carried out in order to obtain weapons.",0,1,"",0,-99,0,0,"","",0,"","","","","","",5,Firearms,5,Unknown Gun Type,"","","","","","","","","","","","","",3,0,0,2,0,0,0,"","","","",0,"","","","","","","","","","","","","","","","The victims included First Brigadier Ridho, Second Brigadier Arman, and Second Brigadier Ilham. Casualty numbers for this incident conflict across sources. Following GTD protocol, the majority reliable estimates are reported here.","\"\"\"3 Police Personnel Killed at Sinak Attack","\"\" Tempo.co",December 28,"2015.\"","\"\"\"Indonesian police probes deadly attacks on police station","\"\" Xinhua General News Service",December 28,"2015.\"","\"\"\"Gunmen kill 3 police in Indonesia's Papua"
