201407090079,2014,7,9,"",0,"",93,5,Southeast Asia,Aceh,Muara Tiga,5.512597,95.793513,1,0,"","07/09/2014: An explosive device was discovered near a road in Muara Tiga area, Aceh province, Indonesia. There were no reports of damages or detonation of the device. No group claimed responsibility for the incident.",1,1,1,0,"","",0,0,0,3,Bombing/Explosion,"","","","",20,Unknown,"","",Unknown,Unknown,93,Indonesia,"","","","","","","","","","","","","","","","",Unknown,"","","","","","",0,"","",0,-99,0,0,"","","","","","","","","",6,Explosives,16,Unknown Explosive Type,"","","","","","","","","","","","","",0,0,0,0,0,0,0,"","","","",0,"","","","","","","","","","","","","","","","","\"\"\"Indonesia enjoys peaceful election: Minister","\"\" Jakarta Post",July 9,"2014.\"","","",START Primary Collection,-9,-9
201407110079,2014,7,11,"",0,"",93,5,Southeast Asia,Jakarta,Jakarta,-6.208763,106.845599,1,0,"","07/11/2014: An assailant threw an incendiary device at Indonesian Survey Network (JSI) offices in Jakarta city, Jakarta province, Indonesia. There were no reported casualties in the attack. No group claimed responsibility for the incident.",1,1,1,0,"","",0,0,0,7,Facility/Infrastructure Attack,"","","","",1,Business,"","",Indonesian Survey Network (JSI),Offices,93,Indonesia,"","","","","","","","","","","","","","","","",Unknown,"","","","","","",0,"","",0,1,0,0,"","","","","","","","","",8,Incendiary,19,Molotov Cocktail/Petrol Bomb,"","","","","","","","","","","","",A Molotov cocktail was used in the attack.,0,0,0,0,0,0,0,"","","","",0,"","","","","","","","","","","","","","","","","\"\"\"Election Survey Network Targeted in Molotov Cocktail Attack","\"\" Jakarta Globe",July 11,"2014.\"","","",START Primary Collection,-9,-9
201407160061,2014,7,16,"",0,"",93,5,Southeast Asia,Papua,Dangobak,-3.72402,138.062184,2,0,"","07/16/2014: Assailants opened fire on a food transport convoy in Dangobak village, Papua province, Indonesia. One person was killed and two others were wounded in the attack. No group claimed responsibility for the incident.",1,1,1,0,"","",0,1,0,7,Facility/Infrastructure Attack,"","","","",14,Private Citizens & Property,73,Vehicles/Transportation,Not Applicable,Food Transport Convoy,93,Indonesia,"","","","","","","","","","","","","","","","",Unknown,"","","","","","",0,"","",0,-99,0,0,"","","","","","","","","",5,Firearms,5,Unknown Gun Type,8,Incendiary,18,Arson/Fire,"","","","","","","","","",1,0,0,2,0,0,1,3,Minor (likely < $1 million),-99,Four vehicles were damaged in this attack.,0,"","","","","","","","","","","","","","","","","\"\"\"Armed attack in Papua kills 1",injures 2,"\"\" Brunei Times",July 18,"2014.\"","\"\"\"One Killed",Two Injured in Papua Armed Ambush of Food Convoy,"\"\" Jakarta Globe",July 17
201407280039,2014,7,28,"",0,"",93,5,Southeast Asia,Papua,Lany Jaya district,-3.983728,138.31722,3,0,"","07/28/2014: Assailants opened fire on police officers in Lany Jaya district, Papua province, Indonesia. Two police officers were killed and six others were wounded in the attack. No group claimed responsibility for the incident; however, sources attributed the attack to the Free Papua Movement (OPM-Organisasi Papua Merdeka).",1,1,1,0,"","",0,1,0,2,Armed Assault,"","","","",3,Police,25,Police Security Forces/Officers,Indonesian National Police (INP),Officers,93,Indonesia,"","","","","","","","","","","","","","","","",Free Papua Movement (OPM-Organisasi Papua Merdeka),"","","","","","",0,"","",0,5,0,0,"","","","","","","","","",5,Firearms,5,Unknown Gun Type,"","","","","","","","","","","","","",2,0,0,6,0,0,0,"","","","",0,"","","","","","","","","","","","","","","","Casualty numbers for this attack conflict across sources. Following GTD protocol, the majority reliable estimates are reported here.","\"\"\"Five separatists shot dead in Indonesia's Papua","\"\" Agence France Presse -- English",August 1,"2014.\"","\"\"\"Five OPM Fighters Shot Dead By Indonesian Army in Papua","\"\" Jakarta Globe",August 1,"2014.\"","\"\"\"Bodies of police officers killed by alleged separatists in Papua evacuated"
201407280040,2014,7,28,"",0,"",93,5,Southeast Asia,Papua,Tingginambut,-3.718583,138.061641,1,0,"","07/28/2014: Assailants opened fire on a military post in Tingginambut district, Papua province, Indonesia. Three soldiers were wounded in the attack. No group claimed responsibility for the incident.",1,1,0,1,1,Insurgency/Guerilla Action,0,1,0,2,Armed Assault,"","","","",4,Military,27,Military Barracks/Base/Headquarters/Checkpost,Indonesian National Armed Forces (TNI),Outpost,93,Indonesia,"","","","","","","","","","","","","","","","",Unknown,"","","","","","",0,"","",0,-99,0,0,"","","","","","","","","",5,Firearms,5,Unknown Gun Type,"","","","","","","","","","","","","",0,0,0,3,0,0,-9,"","","",It is unknown if the military outpost was damaged in this attack.,0,"","","","","","","","","","","","","","","","","\"\"\"Five OPM Fighters Shot Dead By Indonesian Army in Papua","\"\" Jakarta Globe",August 1,"2014.\"","\"\"\"Two Papua Police Officers Shot Dead in Alleged Separatist Attack","\"\" Jakarta Globe",July 29,"2014.\"",""
201408010011,2014,8,1,"",0,"",93,5,Southeast Asia,Papua,Lany Jaya,-3.97119,138.32666,2,0,"","08/01/2014: Assailants opened fire on a group of police and military personnel in Lany Jaya district, Papua province, Indonesia. Five assailants were killed and two security personnel were wounded in the attack. No group claimed responsibility for the incident; however, police attributed it to the Free Papua Movement (OPM-Organisasi Papua Merdeka).",1,1,0,1,1,Insurgency/Guerilla Action,0,1,0,2,Armed Assault,"","","","",4,Military,29,Military Unit/Patrol/Convoy,Indonesian National Armed Forces (TNI),Patrol,93,Indonesia,"","","","","","","","","","","","","","","","",Free Papua Movement (OPM-Organisasi Papua Merdeka),"","","","","","",0,"","",0,5,0,0,"","","","","","","","","",5,Firearms,5,Unknown Gun Type,"","","","","","","","","","","","","",5,0,5,2,0,"",0,"","","","",0,"","","","","","","","","","","","","","","","","\"\"\"Five separatists shot dead in Indonesia's Papua","\"\" Agence France Presse -- English",August 1,"2014.\"","\"\"\"Five OPM Fighters Shot Dead By Indonesian Army in Papua","\"\" Jakarta Globe",August 1,"2014.\"",""
201408160055,2014,8,16,"",0,"",93,5,Southeast Asia,West Nusa Tenggara,Unknown,-8.65299,117.366908,4,0,"","08/16/2014: Assailants opened fire on a police chief in West Nusa Tenggara province, Indonesia. The police chief was killed in the attack. No group claimed responsibility for the incident.",1,1,1,0,"","",0,1,0,2,Armed Assault,"","","","",3,Police,25,Police Security Forces/Officers,Indonesian National Police (INP),Police Chief,93,Indonesia,"","","","","","","","","","","","","","","","",Unknown,"","","","","","",0,"","",0,2,0,0,"","","","","","","","","",5,Firearms,5,Unknown Gun Type,"","","","","","","","","","","","","",1,0,0,0,0,0,0,"","","","",0,"","","","","","","","","","","","","","","","","\"\"\"Counterterrorism Digest: 15-16 August 2014","\"\" BBC Monitoring",August 16,"2014.\"","","",START Primary Collection,-9,-9
201409170088,2014,9,17,"",0,"",93,5,Southeast Asia,Papua,Lanny Jaya district,-3.971033,138.319028,3,0,"","09/17/2014: Assailants opened fire on Indonesian National Armed Forces (TNI) soldiers and Indonesian National Police (INP) officers near an airfield in Lanny Jaya district, Papua province, Indonesia. At least one assailant was killed and an unknown number of other people were injured in the assault. The Free Papua Movement (OPM-Organisasi Papua Merdeka) claimed responsibility for the attack.",1,1,1,0,"","",0,1,0,2,Armed Assault,"","","","",3,Police,25,Police Security Forces/Officers,Indonesian National Police (INP),Officers,93,Indonesia,4,Military,34,"Military Personnel (soldiers, troops, officers, forces)",Indonesian National Armed Forces (TNI),Soldiers,93,Indonesia,"","","","","","","","",Free Papua Movement (OPM-Organisasi Papua Merdeka),"","","","","","",0,"","",0,30,0,1,8,Personal claim,"","","","","","","",5,Firearms,5,Unknown Gun Type,"","","","","","","","","","","","","",1,0,1,"",0,"",0,"","","","",0,"","","","","","","","","","","","","","","","","\"\"\"OPM fighter killed in Papua","\"\" Radio New Zealand",September 18,"2014.\"","\"\"\"Military: Separatist Killed in Papua Firefight","\"\" Jakarta Globe",September 17,"2014.\"",""
201409180066,2014,9,18,"",0,"",93,5,Southeast Asia,Central Sulawesi,Taunca,-1.571144,120.627997,2,0,"","09/18/2014: Assailants killed a civilian suspected of being an informant in Taunca village, Central Sulawesi province, Indonesia. Mujahidin Indonesia Timur (MIT) claimed responsibility for the incident and stated that victim was targeted because the group believed he was an informant for Indonesian authorities.",1,1,1,0,"","",0,1,0,2,Armed Assault,"","","","",14,Private Citizens & Property,113,Alleged Informant,Not Applicable,Suspected Informant: Fadli,93,Indonesia,"","","","","","","","","","","","","","","","",Mujahidin Indonesia Timur (MIT),"","","","","",The Mujahidin Indonesia Timur (MIT) claimed responsibility for the incident and stated that Fadli was targeted because they believed he was an informant for Indonesian authorities.,0,"","",0,5,0,1,7,"Posted to website, blog, etc.","","","","","","","",9,Melee,23,Knife or Other Sharp Object,"","","","","","","","","","","","","",1,0,0,0,0,0,0,"","","","",1,1,0,1,"","","",0,"","","","","",4,Hostage(s) killed (not during rescue attempt),0,"","\"\"\"Indonesia militants claim slaying of 'police informant'","\"\" Agence France Presse -- English",September 22,"2014.\"","\"\"\"Chinese Uighurs key players in IS-linked MIT: Police","\"\" Jakarta Post",January 7,"2016.\"","\"\"\"Bima terror suspects arrested; militants kill Poso farmer"
201409250062,2014,9,25,"",0,"",93,5,Southeast Asia,Papua,Tingginambut,-3.707248,138.06826,1,0,"","09/25/2014: Assailants opened fire on military personnel at a market in Tingginambut area, Papua province, Indonesia. One soldier was killed in the attack. No group claimed responsibility for the incident.",1,1,0,1,1,Insurgency/Guerilla Action,0,1,0,2,Armed Assault,"","","","",4,Military,34,"Military Personnel (soldiers, troops, officers, forces)",Indonesian National Armed Forces (TNI),Soldiers,93,Indonesia,"","","","","","","","","","","","","","","","",Unknown,"","","","","","",0,"","",0,10,0,0,"","","","","","","","","",5,Firearms,5,Unknown Gun Type,"","","","","","","","","","","","","",1,0,0,0,0,0,1,3,Minor (likely < $1 million),-99,A weapon was stolen in this attack.,0,"","","","","","","","","","","","","","","","","\"\"\"Indonesian Soldier Killed in Papua Market Ambush","\"\" Jakarta Globe",September 25,"2014.\"","","",START Primary Collection,-9,-9
201410070019,2014,10,7,"",0,"",93,5,Southeast Asia,Central Sulawesi,Tangofa,-2.961944,122.297222,1,0,"","10/07/2014: Assailants opened fire on a mobile brigade in Tangofa village, Central Sulawesi province, Indonesia. One assailant was wounded in the ensuing clash. No group claimed responsibility for the incident; however, sources attributed the attack to Mujahidin Indonesia Timur (MIT).",1,1,1,0,"","",0,1,0,2,Armed Assault,"","","","",3,Police,23,Police Patrol (including vehicles and convoys),Mobile Brigade,Patrol,93,Indonesia,"","","","","","","","","","","","","","","","",Mujahidin Indonesia Timur (MIT),"","","","","","The specific motive is unknown; however, sources suspected that the attack was in response to a series of arrests made by the police's anti-terror unit on October 5, 2014.",0,"","",0,-99,0,0,"","","","","","","","","",6,Explosives,17,Other Explosive Type,5,Firearms,5,Unknown Gun Type,"","","","","","","","",Thrown homemade bombs and firearms were used in the attack.,0,0,0,1,0,1,0,"","","","",0,"","","","","","","","","","","","","","","","","\"\"\"Indonesia: Police: Poso Terrorists Getting More Daring","\"\" Jakarta Globe Online",October 7,"2014.\"","\"\"\"Southeast Asia Snapshot 8 October 2014","\"\" OSC Summary",October 8,"2014.\"",""
201410090088,2014,10,9,"",0,"",93,5,Southeast Asia,South Sumatra,Palembang,-2.990934,104.756556,1,0,The incident occurred in the Sukadadi area of Sukaramai neighborhood,"10/09/2014: An explosive device detonated near a residence in Palembang city, South Sumatra province, Indonesia. At least one person was wounded in the blast. No group claimed responsibility for the attack.",1,1,1,0,"","",0,1,0,3,Bombing/Explosion,"","","","",14,Private Citizens & Property,76,House/Apartment/Residence,Not Applicable,House,93,Indonesia,"","","","","","","","","","","","","","","","",Unknown,"","","","","","",0,"","",0,-99,0,0,"","","","","","","","","",6,Explosives,17,Other Explosive Type,"","","","","","","","","","","","","A homemade bomb, resembling an emergency lamp, was used in the attack.",0,0,0,1,0,0,1,3,Minor (likely < $1 million),-99,A house was damaged in this attack.,0,"","","","","","","","","","","","","","","","","\"\"\"Woman critically injured by homemade bomb","\"\" Jakarta Post",October 10,"2014.\"","","",START Primary Collection,-9,-9
201411060057,2014,11,6,"",0,"",93,5,Southeast Asia,Yogyakarta,Yogyakarta,-7.797831,110.37727,1,0,"","11/06/2014: Assailants opened fire on the vehicle of Amien Rais in Yogyakarta city, Yogyakarta Special Region, Indonesia. Rais, the former speaker of the People's Consultative Assembly, was not in the car at the time of the attack and no casualties were reported. No group claimed responsibility for the incident.",1,1,1,0,"","",0,0,0,1,Assassination,"","","","",2,Government (General),15,Politician or Political Party Movement/Meeting/Rally,People's Consultative Assembly,Vehicle of Former Speaker: Amien Rais,93,Indonesia,"","","","","","","","","","","","","","","","",Unknown,"","","","","","",0,"","",0,-99,0,0,"","","","","","","","","",5,Firearms,5,Unknown Gun Type,"","","","","","","","","","","","","",0,0,0,0,0,0,1,3,Minor (likely < $1 million),-99,A vehicle was damaged in this attack.,0,"","","","","","","","","","","","","","","","","\"\"\"Amien's house shot at by unidentified people","\"\" Jakarta Post",November 6,"2014.\"","\"\"\"Indonesia: Police Probe &#8216;Terror' Attack on Amien Rais' Car","\"\" Jakarta Globe Online",November 6,"2014.\"",""
201411260051,2014,11,26,"",0,"",93,5,Southeast Asia,East Java,Probolinggo,-7.751978,113.215594,1,0,"","11/26/2014: An explosive device detonated at the house of an anti-corruption activist in Probolinggo city, East Java region, Indonesia. No casualties were reported in the attack. No group claimed responsibility for the incident.",1,1,1,0,"","",0,1,0,3,Bombing/Explosion,"","","","",12,NGO,61,Domestic NGO,Monitoring Agency for Indonesian Public Officials,House of Chair: Buchori Muslim,93,Indonesia,"","","","","","","","","","","","","","","","",Unknown,"","","","","","",0,"","",0,-99,0,0,"","","","","","","","","",6,Explosives,28,Dynamite/TNT,"","","","","","","","","","","","",Modified fishing dynamite was used in the attack.,0,0,0,0,0,0,1,3,Minor (likely < $1 million),-99,A home and a street stall were damaged in this attack.,0,"","","","","","","","","","","","","","","","","\"\"\"Anti-Corruption Activist Targeted in Bombing in Probolinggo","\"\" Tempo.co",November 27,"2014.\"","","",START Primary Collection,-9,-9
201412100085,2014,12,10,"",1,"",93,5,Southeast Asia,Central Sulawesi,Napu,-1.444871,120.323085,1,1,"","12/10/2014: Assailants abducted five people near Napu, Central Sulawesi, Indonesia. One of the hostages was killed on an unspecified date, while two hostsages escaped on an unspecified date. The fate of the remaning two hostages is unknown. No group claimed responsibility for the incident; however, sources attributed the attack to Mujahidin Indonesia Timur (MIT).",1,1,1,0,"","",0,1,0,6,Hostage Taking (Kidnapping),"","","","",14,Private Citizens & Property,68,Named Civilian,Not Applicable,"Civilians: Obet Sabola, Yunus Penini, Harun Torimbi",93,Indonesia,"","","","","","","","","","","","","","","","",Mujahidin Indonesia Timur (MIT),"","","","","","The specific motive is unknown; however, sources posited that Mujahidin Indonesia Timur (MIT) abducted the victims in order to have them work in the forest as guides.",0,"","",0,-99,0,0,"","","","","","","","","",13,Unknown,"","","","","","","","","","","","","","","",1,0,0,"",0,0,0,"","","","",1,5,0,"",-99,"","",0,"","","","","",6,Combination,2,The victims included Gara Tudu and Fiktor Polaba.,"\"\"\"Missing villagers seen walking with Santoso in Poso forest","\"\" Jakarta Post",April 4,"2016.\"","","",START Primary Collection,0,0
201412150068,2014,12,15,"",1,"",93,5,Southeast Asia,Central Sulawesi,Sedoa,-1.348347,120.344541,1,0,"","12/15/2014: Assailants abducted two people in Sedoa, Central Sulawesi, Indonesia. The outcome of the kidnapping is unknown. No group claimed responsibility; however, sources attributed the attack to the Eastern Indonesia Mujahidin (MIT).",1,1,1,0,"","",0,1,0,6,Hostage Taking (Kidnapping),"","","","",14,Private Citizens & Property,67,Unnamed Civilian/Unspecified,Not Applicable,Civilians,93,Indonesia,"","","","","","","","","","","","","","","","",Mujahidin Indonesia Timur (MIT),"","","","","","",0,"","",0,-99,1,0,"","","","","","","","","",13,Unknown,"","","","","","","","","","","","","","","","",0,0,"",0,0,0,"","","","",1,2,0,"",-99,"","",0,"","","","","",7,Unknown,-99,"","\"\"\"New terrorist leader",wife captured without a fight,"\"\" Jakarta Post",September 15,"2016.\"","","",START Primary Collection,0
201412310106,2014,12,31,2014-12-31 00:00:00,1,"",93,5,Southeast Asia,Central Sulawesi,Lembah Napu,-1.753123,120.643559,2,0,The incident occurred in Poso district.,"12/31/2014: Assailants abducted a local resident from Lembah Napu village, Central Sulawesi province, Indonesia. The resident was killed on an unspecified date. No group claimed responsibility for the incident; however, officials attributed the attack to Mujahidin Indonesia Timur (MIT).",1,1,1,0,"","",0,1,0,6,Hostage Taking (Kidnapping),"","","","",14,Private Citizens & Property,67,Unnamed Civilian/Unspecified,Not Applicable,Civilian,93,Indonesia,"","","","","","","","","","","","","","","","",Mujahidin Indonesia Timur (MIT),"","","","","","",0,"","",0,-99,0,0,"","","","","","","","","",13,Unknown,"","","","","","","","","","","","","","","",1,0,0,0,0,0,0,"","","","",1,1,0,"",-99,"","",0,"","","","","",4,Hostage(s) killed (not during rescue attempt),0,"","\"\"\"Indonesia: Poso terrorist group responsible for 7 incidents: Acting police chief","\"\" The Jakarta Post Online",April 5,"2015.\"","","",START Primary Collection,0,0
201501010014,2015,1,1,"",0,"",93,5,Southeast Asia,Papua,Utikini Baru,-4.472451,136.834972,1,0,"","01/01/2015: Assailants opened fire and used machetes to attack a police patrol providing security for a mining company in Utikini Baru village, Papua province, Indonesia. Two police officers and a civilian security guard were killed in the attack. No group claimed responsibility; however, sources attributed the incident to the Free Papua Movement (OPM-Organisasi Papua Merdeka).",1,1,1,0,"","",0,1,0,2,Armed Assault,"","","","",3,Police,23,Police Patrol (including vehicles and convoys),Indonesian National Police (INP),Patrol,93,Indonesia,1,Business,10,Mining,PT Freeport Indonesia,Security Guard: Suko Miartono,93,Indonesia,"","","","","","","","",Free Papua Movement (OPM-Organisasi Papua Merdeka),"","","","","","",0,"","",0,-99,0,0,"","","","","","","","","",5,Firearms,5,Unknown Gun Type,9,Melee,23,Knife or Other Sharp Object,"","","","","","","","",A machete was used in the attack.,3,0,0,0,0,0,0,"","","","",0,"","","","","","","","","","","","","","","","","\"\"\"Police pursue armed attackers following Papua killings","\"\" Radio New Zealand",January 4,"2015.\"","\"\"\"Two police",guard killed in Papua attack,"\"\" Herald Sun",January 2,"2015.\""
201501160071,2015,1,16,"",0,"",93,5,Southeast Asia,Central Sulawesi,Tangkura,-1.395818,120.75453,2,0,The incident occurred in Tangkura village.,"01/16/2015: Assailants opened fire on civilians in Tangkura village, Poso district, Central Sulawesi province, Indonesia. Three civilians were killed in the attack. No group claimed responsibility; however, sources attributed the incident to Mujahidin Indonesia Timur (MIT).",1,1,1,0,"","",0,1,0,2,Armed Assault,"","","","",14,Private Citizens & Property,68,Named Civilian,Not Applicable,"Civilians: Hery Tobio, Aditia Tetembo, Tomy Halifa",93,Indonesia,"","","","","","","","","","","","","","","","",Mujahidin Indonesia Timur (MIT),"","","","","","",0,"","",0,-99,0,0,"","","","","","","","","",5,Firearms,5,Unknown Gun Type,"","","","","","","","","","","","","",3,0,0,0,0,0,0,"","","","",0,"","","","","","","","","","","","","","","","","\"\"\"Indonesia: Poso terrorist group responsible for 7 incidents: Acting police chief","\"\" The Jakarta Post Online",April 5,"2015.\"","\"\"\"Poso Farmers Shot Dead by Armed Militia","\"\" Tempo.co",January 16,"2015.\"","\"\"\"Three Killed in Poso as Police Hunt Terror Fugitive Santoso in Forest"
201502210047,2015,2,21,"",0,"",93,5,Southeast Asia,West Java,Bekasi,-6.296612,107.025364,1,0,The incident occurred in the Mustikajaya area of the Ciketing Asem neibhborhood.,"02/21/2015: An explosive device delivered to a businessperson was defused in Ciketing Asem neighborhood, Bekasi city, West Java province, Indonesia. No group claimed responsibility for the attack.",1,1,1,0,"","",0,0,0,3,Bombing/Explosion,"","","","",14,Private Citizens & Property,77,Laborer (General)/Occupation Identified,Not Applicable,Businessperson: Cece,93,Indonesia,"","","","","","","","","","","","","","","","",Unknown,"","","","","","",0,"","",0,-99,0,0,"","","","","","","","","",6,Explosives,31,Pipe Bomb,"","","","","","","","","","","","",A pipe bomb containing steel pellets and white powder and hidden inside a package was used in the attack.,0,0,0,0,0,0,0,"","","","",0,"","","","","","","","","","","","","","","","","\"\"\"Greater Jakarta: Bomb squad detonates suspicious package","\"\" Jakarta Post",February 23,"2015.\"","","",START Primary Collection,-9,-9
201502230061,2015,2,23,"",0,"",93,5,Southeast Asia,West Java,Depok,-6.392711,106.823432,1,0,"","02/23/2015: An explosive device detonated in the children's play area at ITC Depok Mall in Depok city, West Java province, Indonesia. There were no reported casualties in the blast. No group claimed responsibility for the attack.",1,1,1,0,"","",0,1,0,3,Bombing/Explosion,"","","","",1,Business,7,Retail/Grocery/Bakery,ITC Depok Mall,Children's Play Area,93,Indonesia,"","","","","","","","","","","","","","","","",Unknown,"","","","","","",0,"","",0,-99,0,0,"","","","","","","","","",2,Chemical,30,Explosive,"","","","","","","","","","","","",A homemade explosive device containing chlorine was used in the attack.,0,0,0,0,0,0,1,3,Minor (likely < $1 million),-99,A mall was damaged in this attack.,0,"","","","","","","","","","","","","","","","","\"\"\"Isis members suspected in foiled Indonesian terror attack","\"\" Malaysian Insider",March 25,"2015.\"","\"\"\"Depok's ITC Bomb Blast Contains Suspicious Chemical Fluid","\"\" Tempo.co",February 24,"2015.\"","\"\"\"Bomb explodes in mall outside Jakarta"
