201404150092,2014,4,15,"",0,"",1004,11,Sub-Saharan Africa,Unity,Bentiu,9.259689,29.800148,1,0,"","04/15/2014: Assailants attacked an abandoned World Food Programme (WFP) building serving as a civilian shelter and abducted an unknown number of people in Bentiu town, Unity state, South Sudan. An unknown number of people were killed in the attack. This was one of five attacks in Bentiu town on April 15, 2014. No group claimed responsibility for the incident; however, sources attributed the attack to the Sudan People's Liberation Movement in Opposition (SPLM-IO).",1,1,1,0,"","",1,1,0,6,Hostage Taking (Kidnapping),"","","","",14,Private Citizens & Property,67,Unnamed Civilian/Unspecified,Not Applicable,Civilians,1004,South Sudan,"","","","","","","","","","","","","","","","",Sudan People's Liberation Movement in Opposition (SPLM-IO),"","","","","","The specific motive is unknown; however, sources noted that the Sudan People's Liberation Movement in Opposition (SPLM-IO) had broadcasted hate messages encouraging violence against non-Nuer civilians prior to the attack.",0,"","",0,-99,0,0,"","","","","","","","","",13,Unknown,"","","","","","","","","","","","","","","","",0,0,"",0,0,0,"","","","",1,-99,0,-99,"","","",0,"","","","","",6,Combination,-99,There were an unknown number of hostages in this attack. An unknown number of hostages were released in this attack. An unknown number of hostages were killed in this attack.,"\"\"\"UN Reveals 353 Killed in South Sudan Attacks","\"\" VOA News",January 9,"2015.\"","\"\"\"UN condemns 'targeted ethnic killings' in South Sudan","\"\" Deutsche Welle",April 21,"2014.\"","\"\"\"Hundreds of civilians killed in South Sudan ethnic massacre: U.N."
201404150093,2014,4,15,"",0,"",1004,11,Sub-Saharan Africa,Unity,Bentiu,9.259689,29.800148,1,0,"","04/15/2014: Assailants attacked the residence of a merchant and abducted 48 traders in Bentiu town, Unity state, South Sudan. Forty-five traders were killed and three others were wounded and released the same day. This was one of five attacks in Bentiu town on April 15, 2014. No group claimed responsibility for the incident; however, sources attributed it to the Sudan People's Liberation Movement in Opposition (SPLM-IO).",1,1,1,0,"","",1,1,0,6,Hostage Taking (Kidnapping),2,Armed Assault,"","",14,Private Citizens & Property,77,Laborer (General)/Occupation Identified,Not Applicable,Traders,1004,South Sudan,"","","","","","","","","","","","","","","","",Sudan People's Liberation Movement in Opposition (SPLM-IO),"","","","","","",0,"","",0,-99,0,0,"","","","","","","","","",5,Firearms,2,Automatic or Semi-Automatic Rifle,"","","","","","","","","","","","",A machine gun was used in the attack.,45,0,0,3,0,0,0,"","","","",1,48,0,1,"","","",0,"","","","","",6,Combination,3,Forty-five of the hostages were killed shortly after the abduction. Three of the hostages were injured and released on the same day.,"\"\"\"UN Reveals 353 Killed in South Sudan Attacks","\"\" VOA News",January 9,"2015.\"","\"\"\"Hundreds Feared Dead in Bentiu Massacres",South Sudan,"\"\" AllAfrica.com",April 18,"2014.\""
201404160038,2014,4,16,"",0,"",1004,11,Sub-Saharan Africa,Upper Nile,Renk,11.763188,32.840416,1,0,"Event occurred in the city of Renk, Upper Nile.","04/16/2014: Assailants opened fire on Renk city, Upper Nile state, South Sudan. An unknown number of people were wounded in the attack. No group claimed responsibility for the incident.",1,1,1,0,"","",0,1,0,2,Armed Assault,"","","","",14,Private Citizens & Property,75,Village/City/Town/Suburb,Renk Town,Town,1004,South Sudan,"","","","","","","","","","","","","","","","",Unknown,"","","","","","",0,"","",0,-99,0,0,"","","","","","","","","",5,Firearms,5,Unknown Gun Type,"","","","","","","","","","","","","",0,0,0,"",0,"",0,"","","","",0,"","","","","","","","","","","","","","","","","\"\"\"Highlights: Sudan Daily Media Highlights 21 April 14","\"\" OSC Summary",April 18,"2014.\"","","",START Primary Collection,-9,-9
201404180010,2014,4,17,"",1,"",1004,11,Sub-Saharan Africa,Jonglei,Bor,6.219991,31.550005,1,0,"","04/17/2014: Assailants launched rocket propelled grenades and opened fire on a United Nations Mission in the Republic of South Sudan (UNMISS) base, where civilians had sought refuge in Bor town, Jonglei state, South Sudan. At least 62 people, including 15 assailants, were killed and 100 others were wounded in the attack. Additionally, an unknown number of people were abducted and the whereabouts of the hostages in unknown. No group claimed responsibility for the incident.",1,1,1,0,"","",0,1,0,6,Hostage Taking (Kidnapping),2,Armed Assault,"","",7,Government (Diplomatic),47,"International Organization (peacekeeper, aid agency, compound)",United Nations Mission in the Republic of South Sudan (UNMISS),Base,422,International,14,Private Citizens & Property,67,Unnamed Civilian/Unspecified,Not Applicable,Civilians,1004,South Sudan,"","","","","","","","",Unknown,"","","","","","",0,"","",0,350,0,0,"","","","","","","","","",6,Explosives,11,"Projectile (rockets, mortars, RPGs, etc.)",5,Firearms,5,Unknown Gun Type,"","","","","","","","",A rocket propelled grenade and firearms were used in the attack.,62,0,15,100,0,"",1,3,Minor (likely < $1 million),-99,A United Nations (UN) base was damaged in this attack.,1,-99,0,"",-99,"","",0,"","","","","",7,Unknown,-99,"Casualty numbers for this incident conflict across sources. Following GTD protocol, the most recent reliable estimates are reported here.","\"\"\"UN confirms hundreds slaughtered in S.Sudan atrocities","\"\" Agence France Presse -- English",January 9,"2015.\"","\"\"\"UN says 58 killed in   attack   on UN base in SSudan","\"\" The Associated Press",April 19,"2014.\"","\"\"\"Gunmen Kill 20 In Attack On S. Sudan UN Base"
201404240033,2014,4,24,"",0,"",1004,11,Sub-Saharan Africa,Upper Nile,Tonga,9.472056,31.057187,1,0,"Event occurred along the river around the village of Tonga, Upper Nile province.","04/24/2014: Assailants opened fire and launched rocket propelled grenades at a United Nations Mission in the Republic of South Sudan (UNMISS) barge convoy in Tonga village, Upper Nile state, South Sudan. Four people, including crew members and peacekeepers, were wounded in the attack. No group claimed responsibility for the incident.",1,1,1,0,"","",0,1,0,2,Armed Assault,"","","","",7,Government (Diplomatic),47,"International Organization (peacekeeper, aid agency, compound)",United Nations Mission in the Republic of South Sudan (UNMISS),Barge Convoy,422,International,"","","","","","","","","","","","","","","","",Unknown,"","","","","","",0,"","",0,-99,0,0,"","","","","","","","","",6,Explosives,11,"Projectile (rockets, mortars, RPGs, etc.)",5,Firearms,5,Unknown Gun Type,"","","","","","","","",RPGs and small arms were used in the attack.,0,0,0,4,0,0,1,3,Minor (likely < $1 million),-99,A convoy of supply barges were damaged in this attack.,0,"","","","","","","","","","","","","","","","","\"\"\"UN barges   fired   on in S. Sudan; peacekeepers hit","\"\" The Associated Press",April 25,"2014.\"","\"\"\"UN Mission in South Sudan condemns attack on barge convoy carrying aid supplies","\"\" BusinessWeek",April 25,"2014.\"","\"\"\"UN Mission slams   attack   on barges delivering supplies to Malakal base in South Sudan"
201405110098,2014,5,11,"",0,"",1004,11,Sub-Saharan Africa,Unity,Bentiu,9.260078,29.8,1,1,The incident(s) occurred on roads leading into the city,"05/11/2014: Assailants attacked military positions near Bentiu town, Unity state, South Sudan. Twenty-seven assailants were killed as government forces repulsed the assault. No group claimed responsibility for the incident; however, officials attributed the attack to the Sudan People's Liberation Movement in Opposition (SPLM-IO).",1,1,0,1,1,Insurgency/Guerilla Action,0,1,0,9,Unknown,"","","","",4,Military,34,"Military Personnel (soldiers, troops, officers, forces)",Sudan People's Liberation Army (SPLA),Forces,1004,South Sudan,"","","","","","","","","","","","","","","","",Sudan People's Liberation Movement in Opposition (SPLM-IO),"","","","","","",0,"","",0,-99,0,0,"","","","","","","","","",13,Unknown,"","","","","","","","","","","","","","","",27,0,27,"",0,"",-9,"","","",It is unknown if any property was damaged in this attack.,0,"","","","","","","","","","","","","","","",There is also doubt that this incident meets terrorism-related criteria because there was speculation that state-backed government forces launched the attack.,"\"\"\"South Sudan Government",Rebels Trade Blame As Ceasefire Broken,"\"\" AFP (World Service)",May 11,"2014.\"","\"\"\"Fighting greets S. Sudan truce","\"\" Boston Globe",May 12,"2014.\""
201405150065,2014,5,15,"May 1-31, 2014",0,"",1004,11,Sub-Saharan Africa,Central Equatoria,Juba,4.855349,31.567781,1,0,"","05/00/2014: Sometime between May 1 and May 31, 2014, assailants abducted Colonel Edward Dawes from his vehicle in Juba, Central Equatoria, South Sudan. Dawes, a British United Nations Mission in the Republic of South Sudan (UNMISS) peacekeeper, was injured in the kidnapping before escaping a few hours later. No group claimed responsibility for the incident.",1,1,1,0,"","",0,1,0,6,Hostage Taking (Kidnapping),"","","","",7,Government (Diplomatic),47,"International Organization (peacekeeper, aid agency, compound)",United Nations Mission in the Republic of South Sudan (UNMISS),Vehicle of British Colonel Edward Dawes,422,International,"","","","","","","","","","","","","","","","",Unknown,"","","","","","",0,"","",0,-99,0,0,"","","","","","","","","",5,Firearms,5,Unknown Gun Type,13,Unknown,"","","","","","","","","","","",0,0,0,1,0,0,0,"","","","",1,1,0,-99,"","","",0,"","","","","",3,Hostage(s) escaped (not during rescue attempt),1,"","\"\"\"Kidnapped colonel had teeth smashed and gun muzzle put in his mouth","\"\" The Daily Telegraph (London)",March 19,"2016.\"","\"\"\"British Army officer 'kidnapped and beaten' during peacekeeping mission in South Sudan","\"\" AfricaNewsDesk.com",March 18,"2016.\"","\"\"\"British Army officer 'kidnapped and beaten' during peacekeeping mission in South Sudan"
201407020059,2014,7,2,"",0,"",1004,11,Sub-Saharan Africa,Warap,Gogrial district,8.533056,28.100278,3,0,The incident occurred in the Mayen Juur village,"07/02/2014: Assailants attacked the village of Mayen Juur, Gogrial district, Warap state, South Sudan. Eight people, including two civilians, were killed and 11 others were wounded in the attack. No group claimed responsibility for the incident; however, sources attributed the attack to Sudan People's Liberation Movement in Opposition (SPLM-IO).",1,1,1,0,"","",0,1,0,9,Unknown,"","","","",4,Military,34,"Military Personnel (soldiers, troops, officers, forces)",Sudan People's Liberation Army (SPLA),Soldiers,1004,South Sudan,14,Private Citizens & Property,75,Village/City/Town/Suburb,Mayen Juur Village,Village,1004,South Sudan,"","","","","","","","",Sudan People's Liberation Movement in Opposition (SPLM-IO),"","","","","","",0,"","",0,-99,0,0,"","","","","","","","","",13,Unknown,"","","","","","","","","","","","","","","",8,0,0,11,0,0,0,"","","","",0,"","","","","","","","","","","","","","","","","\"\"\"S. Sudan rebels accused of killing 8 people in Warrap state","\"\" Sudan Tribune",July 6,"2014.\"","\"\"\"South Sudan Rebels Accused of Killing Eight People in Warrap State","\"\" Big News Network",July 5,"2014.\"",""
