201101020007,2011,1,2,"",0,"",603,8,Western Europe,Northern Ireland,Lisburn,54.515694,-6.055724,1,0,County Antrim. The attack occurred on Brokerstown Road in Lisburn.,"01/02/2011: On Sunday, on Brokerstown Road in Lisburn, Northern Ireland, unidentified assailants threw a petrol bomb at a civilian residence. No casualties were reported but the house and a nearby vehicle were damaged. No group claimed responsibility for the attack.",1,1,1,0,"","",0,1,0,7,Facility/Infrastructure Attack,"","","","",14,Private Citizens & Property,76,House/Apartment/Residence,"",A civilian residence,233,Northern Ireland,"","","","","","","","","","","","","","","","",Unknown,"","","","","",The specific motive for the attack is unknown.,0,"","",0,-99,0,0,"","","","","","","","","",8,Incendiary,20,Gasoline or Alcohol,"","","","","","","","","","","","",A petrol bomb was used in the attack.,0,0,0,0,0,0,1,3,Minor (likely < $1 million),"",The house and a nearby vehicle were damaged.,0,"","","","","","","","","","","","","","","","","Jane�s Intelligence, �Incendiary Device Attack Targets Residence in Northern Ireland's Lisburn,� Terrorism Watch Report, BBC, January 4, 2011.","\"Mirror, \"\"Couple Are Unhurt in Bomb Blast; Attack","\"\" LexisNexis Academic",Mirror,January 3,"2011.\"","",ISVG,-9
201101080014,2011,1,8,"",0,"",603,8,Western Europe,Northern Ireland,Garvagh,54.981084,-6.682382,1,0,"County Derry / Londonderry. The attack took place outside a home in Garvagh, County Derry, Northern Ireland.","01/08/2011: On Saturday, in Garvagh, County Derry, Northern Ireland, in one of two linked attacks, unidentified assailants threw a petrol bomb at a car outside the home of a Catholic woman, which set fire to and destroyed one car and damaged one house. No casualties were reported and no group claimed responsibility.",1,1,1,0,"","",1,1,0,7,Facility/Infrastructure Attack,"","","","",14,Private Citizens & Property,69,Religion Identified,"",The car of a Catholic woman,233,Northern Ireland,"","","","","","","","","","","","","","","","",Unknown,"","","","","",The specific motive for the attack is unknown.,0,"","",0,-99,0,0,"","","","","","","","","",8,Incendiary,20,Gasoline or Alcohol,"","","","","","","","","","","","",A petrol bomb was used in the attack.,0,0,0,0,0,0,1,3,Minor (likely < $1 million),"",One car was destroyed and one house was damaged.,0,"","","","","","","","","","","","","","","","","\"Agence France Presse, \"\"Double Petrol Bomb Attack in N. Ireland Causes Damage","\"\" World News Connection",Agence France Presse,January 8,"2011.\"","\"RTE News, \"\"PSNI Investigates Derry Petrol Bomb Attack","\"\" LexisNexis Academic",RTE News,January 8
201101080015,2011,1,8,"",0,"",603,8,Western Europe,Northern Ireland,Garvagh,54.981084,-6.682382,1,0,"County Derry / Londonderry. The attack took place at the house of a Protestant-Catholic couple in Garvagh, County Derry, Northern Ireland.","01/08/2011: On Saturday, in Garvagh, County Derry, Northern Ireland, in one of two linked attacks, unidentified assailants threw a petrol bomb at the home of a Protestant-Catholic couple, burning and damaging the house but causing no casualties. No group claimed responsibility for the attack.",1,1,1,0,"","",1,1,0,2,Armed Assault,"","","","",14,Private Citizens & Property,69,Religion Identified,"",The home of a Protestant-Catholic couple,233,Northern Ireland,"","","","","","","","","","","","","","","","",Unknown,"","","","","",The specific motive for the attack was religious.,0,"","",0,-99,0,0,"","","","","","","","","",8,Incendiary,20,Gasoline or Alcohol,"","","","","","","","","","","","",A petrol bomb was used in the attack.,0,0,0,0,0,0,1,3,Minor (likely < $1 million),"",The house was sustained an unknown amount of property damaged.,0,"","","","","","","","","","","","","","","","","\"Agence France Presse, \"\"Double Petrol Bomb Attack in N. Ireland Causes Damage","\"\" World News Connection",Agence France Presse,January 8,"2011.\"","","",ISVG,-9
201101140012,2011,1,14,"",0,"",603,8,Western Europe,Northern Ireland,Belfast,54.607712,-5.95621,1,0,"The incident occurred at the Royal Mail office on Tomb Street in Belfast, Northern Ireland.","01/14/2011: On Friday morning around 1100, at the Royal Mail office on Tomb Street in Belfast, Northern Ireland, a package containing fireworks exploded as it was being handled by one of the employees at the office. There were no casualties or reported damages and no group claimed responsibility for the attack.",1,1,1,0,"","",0,1,0,3,Bombing/Explosion,"","","","",2,Government (General),21,Government Building/Facility/Office,Royal Mail,The Royal Mail office in Belfast,233,Northern Ireland,"","","","","","","","","","","","","","","","",Unknown,"","","","","",The specific motive for the attack is unknown.,0,"","",0,-99,0,0,"","","","","","","","","",6,Explosives,17,Other Explosive Type,"","","","","","","","","","","","",A package containing fireworks was used in the attack.,0,0,0,0,0,0,0,"","","","",0,"","","","","","","","","","","","","","","","","\"Reuters, \"\"Small Parcel Bomb Explodes in N. Ireland",No Injury,"\"\" Reuters",January 14,2011,"http://www.trust.org/alertnet/news/small-parcel-bomb-explodes-in-nireland-no-injury/.\"","\"Press Association, \"\"Firework Causes Sorting Office Explosion","\"\" LexisNexis Academic",Press Association
201101150016,2011,1,15,"",0,"",603,8,Western Europe,Northern Ireland,Aughnacloy,54.460273,-6.943692,1,1,"The attack occurred outside of Aughnacloy, County Tyrone.","01/15/2011: On Saturday, at Dergina Orange Hall outside of Aughnacloy, County Tyrone, Northern Ireland, in one of three related attacks, suspected republican dissidents smashed out the windows and threw paint on the front door of the building, causing an unknown amount of damage. No casualties were reported and no group claimed responsibility for the attack, but republican dissidents were suspected to be responsible.",1,1,1,0,"","",0,1,0,7,Facility/Infrastructure Attack,"","","","",14,Private Citizens & Property,79,"Public Area (garden, parking lot, garage, beach, public building, camp)",Dergina Orange Hall,The Dergina Orange Hall was targeted in the attack.,233,Northern Ireland,"","","","","","","","","","","","","","","","",Unknown,"","","","","",The specific motive for the attack is unknown.,0,"","",0,-99,0,0,"","","","","","","","","",11,Sabotage Equipment,"","",13,Unknown,"","","","","","","","","","",Paint and unknown weapons were used in the attack.,0,0,0,0,0,0,1,3,Minor (likely < $1 million),"",The Dergina Orange Hall was damaged.,0,"","","","","","","","","","","","","","","","","Jane�s Intelligence, �Suspected Militants Attack Orange Hall in Northern Ireland's County Tyrone,� Terrorism Watch Report, BBC, January 17, 2011.","\"Sunday Life, \"\"Orange Hall is Vandalised","\"\" LexisNexis Academic",Sunday Life,January 16,"2011.\"","",ISVG,-9
201101170006,2011,1,17,"",0,"",603,8,Western Europe,Northern Ireland,Londonderry,55.011562,-7.312045,1,0,"The incident occurred at the United Kingdom City of Culture office in Londonderry, Northern Ireland.","01/17/2011: On Monday night around 0330, at the United Kingdom City of Culture office in Londonderry, Northern Ireland, unidentified assailants detonated an improvised explosive device at the front door of the office, causing no casualties but damaging the door. No group claimed responsibility for the attack, but republican dissidents were suspected to be responsible.",1,1,1,0,"","",0,1,0,3,Bombing/Explosion,"","","","",2,Government (General),21,Government Building/Facility/Office,United Kingdom City of Culture,The United Kingdom City of Culture office in Londonderry,233,Northern Ireland,"","","","","","","","","","","","","","","","",Unknown,"","","","","",The specific motive for the attack is unknown.,0,"","",0,-99,0,0,"","","","","","","","","",6,Explosives,17,Other Explosive Type,"","","","","","","","","","","","",An improvised explosive device was used in the attack.,0,0,0,0,0,0,1,3,Minor (likely < $1 million),"",The front door of the office was damaged in the attack.,0,"","","","","","","","","","","","","","","","","\"Belfast Telegraph, \"\"Political Leaders Condemn Bomb Attack in Northern Ireland's Londonderry","\"\" World News Connection",Belfast Telegraph,January 17,"2011.\"","\"Belfast News, \"\"Outcry Over City of Culture Offices Blast","\"\" LexisNexis Academic",Belfast News,January 18
201101230002,2011,1,23,"",0,"",603,8,Western Europe,Northern Ireland,Belfast,54.607712,-5.95621,1,0,County Antrim/County Down. The attack took place in Belfast.,"01/23/2011: On Sunday, in Belfast, Northern Ireland, two police officers responded to a call at a local video rental store. Just outside of the store members of the Oglaigh na hEireann had planted a remote-controlled improvised explosive device (RCIED), which they were planning to detonate when the officers arrived on the scene. The group decided not to detonate the RCIED after a local citizen approached the officers and left the area, leaving both the RCIED and a secondary tripwire attached to an Irish army grenade on a bike, in place. Officers discovered the RCIED at an unknown time on 01/26/2011. The secondary IED was not discovered until 01/27/2011. The Oglaigh na hEireann claimed responsibility for the devices in a communication on 01/25/2011. No casualties or damages were reported.",1,1,1,0,"","",0,0,0,3,Bombing/Explosion,"","","","",3,Police,25,Police Security Forces/Officers,Belfast Law Enforcement,Belfast law enforcement personnel,233,Northern Ireland,1,Business,7,Retail/Grocery/Bakery,"",A local video rental store was targeted.,233,Northern Ireland,"","","","","","","","",Real Irish Republican Army (RIRA),"","","","","",The specific motive for the attack is unknown.,0,"","",0,-99,0,1,2,Call (post-incident),"","","","","","","",6,Explosives,12,Remote Trigger,"","","","","","","","","","","","",A remote-controlled improvised explosive device and a secondary tripwire attached to an Irish army grenade were used in the attack.,0,0,0,0,0,0,0,"","","","",0,"","","","","","","","","","","","","","","","","\"Belfast Telegraph, \"\"Belfast Daily Told Details of N Ireland Dissident Group's 'Double-Ambush' Plan","\"\" World News Connection",Belfast Telegraph,January 31,"2011.\"","\"Irish Times, \"\"Bomb Left on Bike in Belfast","\"\" Irish Times",February 8,2011
201101260020,2011,1,26,"",0,"",603,8,Western Europe,Northern Ireland,Carnlough,54.992107,-5.990309,1,0,"County Antrim. The attack took place on Ballymena Road in the village of Carnlough, County Antrim, Northern Ireland.","01/26/2011: On Wednesday, in the village of Carnlough, County Antrim, Northern Ireland, suspected dissident republican militants placed a pipe bomb on Ballymena Road, but it was discovered and safely defused by security forces. No casualties or damages were reported and no group claimed responsibility, but republican dissidents were suspected to be responsible.",1,1,1,0,"","",0,0,0,3,Bombing/Explosion,"","","","",14,Private Citizens & Property,67,Unnamed Civilian/Unspecified,"",Civilians,233,Northern Ireland,"","","","","","","","","","","","","","","","",Unknown,"","","","","",The specific motive for the attack is unknown.,0,"","",0,-99,0,0,"","","","","","","","","",6,Explosives,31,Pipe Bomb,"","","","","","","","","","","","","",0,0,0,0,0,0,0,"","","","",0,"","","","","","","","","","","","","","","","","Jane�s Intelligence, �Security Forces Make Safe IED in Northern Ireland's County Antrim,� Terrorism Watch Report, BBC, January 27, 2011.","\"Belfast Telegraph, \"\"Pipe-Bombers Condemned","\"\" LexisNexis Academic",Belfast Telegraph,January 27,"2011.\"","\"RTE News, \"\"Suspected Dissident Car Bomb Plot in Belfast","\"\" LexisNexis Academic",RTE News
201101290001,2011,1,29,"",0,"",603,8,Western Europe,Northern Ireland,Belfast,54.607712,-5.95621,1,0,"The incident occurred at a house on Carlisle Road in the New Lodge area of Belfast, Northern Ireland.","01/29/2011: On Saturday, in the New Lodge area of Belfast, Northern Ireland, unidentified masked gunmen entered a civilian home on Carlisle Road and shot a 17-year-old boy in the leg, injuring him. No group claimed responsibility for the attack, but republican dissidents were suspected to be responsible.",1,1,1,0,"","",0,1,0,2,Armed Assault,"","","","",14,Private Citizens & Property,67,Unnamed Civilian/Unspecified,"",A civilian,233,Northern Ireland,"","","","","","","","","","","","","","","","",Unknown,"","","","","",The specific motive for the attack is unknown.,0,"","",0,-99,0,0,"","","","","","","","","",5,Firearms,5,Unknown Gun Type,"","","","","","","","","","","","",Unknown firearms were used in the attack.,0,0,0,1,0,0,0,"","","","",0,"","","","","","","","","","","","","","","","","Jane�s Intelligence, �Suspected Dissident Republicans Wound Man in Northern Ireland's Belfast,� Terrorism Watch Report, BBC, January 31, 2011.","\"Sunday Mirror, \"\"Youth Shot in the Leg","\"\" LexisNexis Academic",Sunday Mirror,January 30,"2011.\"","\"News of the World, \"\"Belfast Teen Shot","\"\" LexisNexis Academic",News of the World
201102020017,2011,2,2,"",0,"",603,8,Western Europe,Northern Ireland,Belfast,54.607712,-5.95621,1,0,"County Antrim/County Down. The attack took place in the Westrock Park area residential area in Belfast, Northern Ireland.","02/02/2011: On Wednesday evening at 1825, in the Westrock Park area of Belfast, Northern Ireland, a civilian was shot in both of his ankles, in a paramilitary style, by suspected dissident republican militants. The attack occurred in a residential area behind some houses. No group claimed responsibility for the attack.",1,1,1,0,"","",0,1,0,2,Armed Assault,"","","","",14,Private Citizens & Property,67,Unnamed Civilian/Unspecified,"",A civilian was targeted in the attack.,233,Northern Ireland,"","","","","","","","","","","","","","","","",Unknown,"","","","","",The specific motive for the attack is unknown.,0,"","",0,-99,0,0,"","","","","","","","","",5,Firearms,5,Unknown Gun Type,"","","","","","","","","","","","",Unknown firearms were used in the attack.,0,0,0,1,0,0,0,"","","","",0,"","","","","","","","","","","","","","","","","Jane�s Intelligence, �Suspected Dissident Republicans Wound Civilian in Northern Ireland's Belfast,� Terrorism Watch Report, BBC, February 3, 2011.","\"BBC Monitoring Europe, \"\"Man Shot in Ankles in West Belfast","\"\" BBC Monitoring Europe",February 2,2011,"http://www.bbc.co.uk/news/uk-northern-ireland-12349232.\"","\"Irish Times, \"\"Police Appeal after Man Shot in Belfast","\"\" LexisNexis Academic",Irish Times
201102030008,2011,2,3,"",0,"",603,8,Western Europe,Northern Ireland,Belfast,54.607712,-5.95621,1,0,"County Antrim/County Down. The attack took place in a communal corridor in a block of flats on Cavehill Road in Belfast, Northern Ireland.","02/03/2011: On Thursday afternoon at 1430, in Belfast, Northern Ireland, an improvised explosive device was found in a communal corridor in a block of residences on Cavehill Road. Residents were forced to leave their residence while police worked to disabled the device. Just before 1800 hours, police successfully disabled the device and were able to remove it from the scene. Dissident republican militants are believed to be behind the device; however, no group claimed responsibility for the device. No casualties or damages were reported.",1,1,1,0,"","",0,0,0,3,Bombing/Explosion,"","","","",14,Private Citizens & Property,74,Marketplace/Plaza/Square,"",A block of residences was targeted in the attack.,233,Northern Ireland,"","","","","","","","","","","","","","","","",Unknown,"","","","","",The specific motive for the attack is unknown.,0,"","",0,-99,0,0,"","","","","","","","","",6,Explosives,17,Other Explosive Type,"","","","","","","","","","","","",An improvised explosive device was used in the attack.,0,0,0,0,0,0,0,"","","","",0,"","","","","","","","","","","","","","","","","\"Belfast Telegraph, \"\"Two Bomb Alerts Force Families Out","\"\" LexisNexis Academic",Belfast Telegraph,February 4,"2011.\"","Jane�s Intelligence, �Security Forces Make Safe IED in Northern Ireland's Belfast,� Terrorism Watch Report, BBC, February 4, 2011.","\"Irish News, \"\"Family Target of Bomb Again","\"\" LexisNexis Academic",Irish News
201102030009,2011,2,3,"",0,"",603,8,Western Europe,Northern Ireland,Belfast,54.607712,-5.95621,1,0,"The incident occurred at a house on Stratheden Street in Belfast, Northern Ireland.","02/03/2011: On Thursday morning at 0700, on Stratheden Street in Belfast, Northern Ireland, an improvised explosive device, described as a pipe bomb, was discovered on the window sill of a house. Residents in the area had to evacuate while police worked to defuse the device. After about four hours, police conducted a controlled explosion and rendered the device safe. No damage or casualties were reported. No group has claimed responsibility for the device; however, dissident republican militants are suspected to be responsible.",1,1,1,0,"","",0,0,0,3,Bombing/Explosion,"","","","",14,Private Citizens & Property,76,House/Apartment/Residence,"",A civilian house was targeted in the attack.,233,Northern Ireland,"","","","","","","","","","","","","","","","",Unknown,"","","","","",The specific motive for the attack is unknown.,0,"","",0,-99,0,0,"","","","","","","","","",6,Explosives,31,Pipe Bomb,"","","","","","","","","","","","","",0,0,0,0,0,0,0,"","","","",0,"","","","","","","","","","","","","","","","","\"Belfast Telegraph, \"\"Two Bomb Alerts Force Families Out","\"\" LexisNexis Academic",Belfast Telegraph,February 4,"2011.\"","\"Irish News, \"\"Family Target of Bomb Again","\"\" LexisNexis Academic",Irish News,February 4
201102100017,2011,2,10,"",0,"",603,8,Western Europe,Northern Ireland,Belfast,54.607712,-5.95621,1,0,"The incident occurred in a Royal Mail office on Tomb Street in Belfast, Northern Ireland.","02/10/2011: On Thursday morning around 1030, on Tomb Street in Belfast, Northern Ireland, police discovered and removed an improvised explosive device from a Royal Mail sorting office, planted by suspected unidentified militants. No casualties or property damage was reported and no group claimed responsibility for the attack.",1,1,1,0,"","",0,0,0,3,Bombing/Explosion,"","","","",2,Government (General),21,Government Building/Facility/Office,Royal Mail,A Royal Mail sorting office,233,Northern Ireland,"","","","","","","","","","","","","","","","",Unknown,"","","","","",The specific motive for the attack is unknown.,0,"","",0,-99,0,0,"","","","","","","","","",6,Explosives,17,Other Explosive Type,"","","","","","","","","","","","",An improvised explosive device was used in the attack.,0,0,0,0,0,0,0,"","","","",0,"","","","","","","","","","","","","","","","","Jane�s Intelligence, �Police Safely Remove IED from Royal Mail Sorting Office in Northern Ireland's Belfast,� Terrorism Watch Report, BBC, February 11, 2011.","\"Irish News, \"\"Device Found at Royal Mail Office","\"\" LexisNexis Academic",Irish News,February 11,"2011.\"","",ISVG,-9
201102160012,2011,2,16,"",0,"",603,8,Western Europe,Northern Ireland,Magherafelt,54.755402,-6.606029,1,0,"County Derry / Londonderry. The attack took place in the Sandy Braes area of Magherafelt, County Derry.","02/16/2011: On Wednesday at 0000 midnight, in the Sandy Braes area of Magherafelt, County Derry, Northern Ireland, suspected dissident republicans planted a pipe bomb outside of a house. Nearby homes were evacuated while the device was handled by Army bomb experts. The attack caused no casualties or damages and no group claimed responsibility but the Real Irish Republican Army (RIRA) was suspected.",1,1,1,0,"","",0,0,0,3,Bombing/Explosion,"","","","",14,Private Citizens & Property,76,House/Apartment/Residence,"",A house was targeted in the attack.,233,Northern Ireland,"","","","","","","","","","","","","","","","",Real Irish Republican Army (RIRA),"","","","","",The specific motive for the attack is unknown.,1,"","",0,-99,0,0,"","","","","","","","","",6,Explosives,31,Pipe Bomb,"","","","","","","","","","","","","",0,0,0,0,0,0,0,"","","","",0,"","","","","","","","","","","","","","","","","\"Belfast Telegraph, \"\"Real IRA Pipe-Bomb 'Could Have Been Lethal'","\"\" LexisNexis Academic",Belfast Telegraph,February 17,"2011.\"","\"Sun, \"\"Bombs in Streets","\"\" LexisNexis Academic",Sun,February 17
201102280011,2011,2,28,"",0,"",603,8,Western Europe,Northern Ireland,Antrim,54.713382,-6.216761,1,0,"County Antrim. The attack occurred in the Ballygore Road area of County Antrim, Northern Ireland.","02/28/2011: On Monday evening around 2030, in the Ballygore Road area of County Antrim, Northern Ireland, a man was attacked by unidentified militants with hammers, injuring him in the attack. No group claimed responsibility for the attack.",1,1,1,0,"","",0,1,0,8,Unarmed Assault,"","","","",14,Private Citizens & Property,67,Unnamed Civilian/Unspecified,"",A civilian was targeted in the attack.,233,Northern Ireland,"","","","","","","","","","","","","","","","",Unknown,"","","","","",The specific motive for the attack is unknown.,0,"","",0,-99,0,0,"","","","","","","","","",9,Melee,21,Blunt Object,"","","","","","","","","","","","",Hammers were used in the attack.,0,0,0,1,0,0,0,"","","","",0,"","","","","","","","","","","","","","","","","Jane�s Intelligence, �Unidentified Militants Wound Man in Northern Ireland's Antrim,� Terrorism Watch Report, BBC, March 2, 2011.","\"Belfast Telegraph, \"\"Man in Hospital after Gang Attack","\"\" LexisNexis Academic",Belfast Telegraph,March 2,"2011.\"","",ISVG,-9
201103020012,2011,3,2,"",0,"",603,8,Western Europe,Northern Ireland,Derry,55.011562,-7.312045,1,0,"County Derry / Londonderry. The attack occurred near Glen Road in Derry, County Derry, Northern Ireland.","03/02/2011: On Wednesday night, near Glen Road in Derry, County Derry, Northern Ireland, police officers investigating reports of an abandoned car were shot at, while returning to their vehicle, by unidentified militants. No casualties were reported. The car being investigated had been reported stolen. No group claimed responsibility for the attack.",1,1,1,0,"","",0,0,0,2,Armed Assault,"","","","",3,Police,25,Police Security Forces/Officers,Derry Law Enforcement,The target of the attack was Derry law enforcement personnel.,233,Northern Ireland,"","","","","","","","","","","","","","","","",Unknown,"","","","","",The specific motive for the attack is unknown.,0,"","",0,-99,0,0,"","","","","","","","","",5,Firearms,5,Unknown Gun Type,"","","","","","","","","","","","",Unknown firearms were used in the attack.,0,0,0,0,0,0,0,"","","","",0,"","","","","","","","","","","","","","","","","Jane�s Intelligence, �Unidentified Militants Attack Police Patrol in Northern Ireland's Londonderry,� Terrorism Watch Report, BBC, March 3, 2011.","\"Belfast Telegraph, \"\"Suspected Dissident Republicans Target N Ireland Police in Londonderry Attack","\"\" World News Connection",Belfast Telegraph,March 3,"2011.\"","",ISVG,-9
201103110011,2011,3,11,"",0,"",603,8,Western Europe,Northern Ireland,Antrim,54.713382,-6.216761,1,0,"County Antrim. The attack took place in Antrim, County Antrim, Northern Ireland.","03/11/2011: On Friday night shortly before 0400, in Antrim, County Antrim, Northern Ireland, unidentified militants threw a pipe bomb through the window of Democratic Unionist Party candidate, John Smyth Jr. The device landed on Smyth's bed, shortly after he had exited the room, then detonated. The amount of damage that resulted from the blast is unknown. No casualties were reported and no group claimed responsibility for the attack.",1,1,1,0,"","",0,1,0,3,Bombing/Explosion,"","","","",14,Private Citizens & Property,84,Political Party Member/Rally,Democratic Unionist Party,"Democratic Unionist Party candidate, John Smyth Jr., was targeted in the attack.",233,Northern Ireland,"","","","","","","","","","","","","","","","",Unknown,"","","","","",The specific motive for the attack is unknown.,0,"","",0,-99,0,0,"","","","","","","","","",6,Explosives,31,Pipe Bomb,"","","","","","","","","","","","","",0,0,0,0,0,0,1,3,Minor (likely < $1 million),"",The attack caused an unknown amount of property damage to the house.,0,"","","","","","","","","","","","","","","","","Jane�s Intelligence, �Bomb Attack Targets Residence of Unionist Election Candidate in Northern Ireland's Antrim,� Terrorism Watch Report, BBC, March 14, 2011.","\"Patrice Dougan, \"\"A Pipe-Bomb on His Bed... If He'd Been Asleep it Would Have Killed Him","\"\" LexisNexis Academic",Belfast Telegraph,March 12,"2011.\"","\"Lesley-Anne Henry, \"\"Pipe Bomb is Thrown at Home of DUP Candidate","\"\" LexisNexis Academic",Belfast Telegraph
