201307040035,2013,7,4,"",0,"",603,8,Western Europe,Northern Ireland,Dundonald,54.593097,-5.79461,1,0,"","07/04/2013: A pipe bomb detonated at a civilian residence in Dundonald area, Castlereagh district, Northern Ireland, United Kingdom. There were no reported casualties resulting from the blast; however, a vehicle was damaged. No group claimed responsibility for the incident.",1,1,1,0,"","",0,1,0,3,Bombing/Explosion,"","","","",14,Private Citizens & Property,76,House/Apartment/Residence,Not Applicable,Millar's Forge,233,Northern Ireland,"","","","","","","","","","","","","","","","",Unknown,"","","","","","",0,"","",0,-99,0,0,"","","","","","","","","",6,Explosives,31,Pipe Bomb,"","","","","","","","","","","","","",0,0,0,0,0,0,1,3,Minor (likely < $1 million),-99,A vehicle was damaged in this attack.,0,"","","","","","","","","","","","","","","","","\"\"\"Pipe bomb explodes in east Belfast","\"\" BBC",July 4,"2013.\"","\"\"\"Pipe bomb explodes in east Belfast","\"\" MyVillage.com",July 4,"2013.\"",""
201307080051,2013,7,8,"",0,"",603,8,Western Europe,Northern Ireland,Belfast,54.607712,-5.95621,1,0,The incident occurred in the Ardoyne neighborhood of the city.,"07/08/2013: Assailants burned a vehicle in Ardoyne neighborhood, Belfast city, Belfast district, Northern Ireland, United Kingdom. No casualties were reported. This incident represents one of two vehicles torched in the area on this day. Oglaigh na hEireann claimed responsibility for the incident.",1,1,1,0,"","",1,1,0,7,Facility/Infrastructure Attack,"","","","",14,Private Citizens & Property,73,Vehicles/Transportation,Not Applicable,Vehicle,233,Northern Ireland,"","","","","","","","","","","","","","","","",Oglaigh na hEireann,"","","","","","",0,"","",0,-99,0,1,10,Unknown,"","","","","","","",8,Incendiary,18,Arson/Fire,"","","","","","","","","","","","","",0,0,0,0,0,0,1,3,Minor (likely < $1 million),-99,A vehicle was damaged in this attack.,0,"","","","","","","","","","","","","","","","","\"\"\"House bomb 'bid to kill police in ambush'","\"\" The Irish News",July 13,"2013.\"","","",START Primary Collection,0,0
201307080052,2013,7,8,"",0,"",603,8,Western Europe,Northern Ireland,Belfast,54.607712,-5.95621,1,0,The incident occurred in the Ardoyne neighborhood of the city.,"07/08/2013: Assailants burned a vehicle in Ardoyne area, Belfast city, Belfast district, Northern Ireland, United Kingdom. No casualties were reported. This incident represents one of two vehicles torched in the area on this day. Oglaigh na hEireann claimed responsibility for the incident.",1,1,1,0,"","",1,1,0,7,Facility/Infrastructure Attack,"","","","",14,Private Citizens & Property,73,Vehicles/Transportation,Not Applicable,Vehicle,233,Northern Ireland,"","","","","","","","","","","","","","","","",Oglaigh na hEireann,"","","","","","",0,"","",0,-99,0,1,10,Unknown,"","","","","","","",8,Incendiary,18,Arson/Fire,"","","","","","","","","","","","","",0,0,0,0,0,0,1,3,Minor (likely < $1 million),-99,A vehicle was damaged in this attack.,0,"","","","","","","","","","","","","","","","","\"\"\"House bomb 'bid to kill police in ambush'","\"\" The Irish News",July 13,"2013.\"","","",START Primary Collection,0,0
201307090015,2013,7,9,"",0,"",603,8,Western Europe,Northern Ireland,Belfast,54.607712,-5.95621,1,0,The incident occurred near Alliance Avenue in the Ardoyne area of the city.,"07/09/2013: A pipe bomb was discovered and defused inside a house in Belfast, Northern Ireland, United Kingdom. The bomb was intended to target police officers, who were lured to the area by a report of gunshots inside the same house. Oglaigh na hEireann claimed responsibility for the attack.",1,1,1,0,"","",0,0,0,3,Bombing/Explosion,"","","","",3,Police,25,Police Security Forces/Officers,Police Service of Northern Ireland (PSNI),Officers,233,Northern Ireland,"","","","","","","","","","","","","","","","",Oglaigh na hEireann,"","","","","","The specific motive is unknown; however, a source speculates that the incident may have been related to the upcoming Ulster loyalist Orange Order parade in Northern Ireland.",0,"","",0,-99,0,1,10,Unknown,"","","","","","","",6,Explosives,31,Pipe Bomb,"","","","","","","","","","","","","",0,0,0,0,0,0,0,"","","","",0,"","","","","","","","","","","","","","","","","\"\"\"Bomb found in north Belfast ahead of Orange Order parade","\"\" Gulf News",July 10,"2013.\"","\"\"\"Belfast bomb 'an attempt' to kill police officers","\"\" RTE Online",July 10,"2013.\"","\"\"\"PSNI says Belfast bomb was designed to kill officers"
201307120010,2013,7,12,"",0,"",603,8,Western Europe,England,Tipton,52.526144,-2.066317,1,0,"","07/12/2013: A pipe bomb detonated at the Kanz Ul Iman Masjid mosque in Tipton city, West Midlands region, England, United Kingdom. No casualties were reported. White extremists claimed responsibility for the incident and authorities detained and convicted Pavlo Lapshyn in connection with the incident in October, 2013. This incident occurred on the same day as the funeral for Lee Rigby, a soldier killed by alleged Islamic extremists in London.",1,1,1,0,"","",0,1,0,3,Bombing/Explosion,"","","","",15,Religious Figures/Institutions,86,Place of Worship,Kanzul Iman Masjid Mosque,Mosque,216,Great Britain,"","","","","","","","","","","","","","","","",White extremists,"","","","","","The specific motive is unknown; however, sources note that the incident coincided with the funeral of Lee Rigby, a British soldier who was killed by suspected Islamist extremists in May 2013.",0,"","",1,1,1,1,8,Personal claim,"","","","","","","",6,Explosives,17,Other Explosive Type,"","","","","","","","","","","","",A homemade explosive device containing nails was used in the attack.,0,0,0,0,0,0,0,"","","","",0,"","","","","","","","","","","","","","","","","\"\"\"Pavlo Lapshyn jailed for 40 years for murder and mosque bombs","\"\" The Guardian",October 25,"2013.\"","\"\"\"'Terror attack' blast near mosque","\"\" ITV.com",July 12,"2013.\"","\"\"\"UK police investigate mosque explosion"
201307150032,2013,7,15,"",0,"",603,8,Western Europe,Northern Ireland,Belfast,54.607712,-5.95621,1,0,The incident occurred in the Ardoyne neighborhood of the city.,"07/15/2013: Assailants threw a pipe bomb at police in Belfast city, Belfast district, Northern Ireland, United Kingdom. No one was injured in the blast. No group claimed responsibility for the incident; however, authorities attribute the attack to Irish Republican extremists who were protesting the government's recent decision to prohibit the holding of an Orange Order parade.",1,1,1,0,"","",0,1,0,3,Bombing/Explosion,2,Armed Assault,"","",3,Police,25,Police Security Forces/Officers,Police Service of Northern Ireland (PSNI),Officers,233,Northern Ireland,"","","","","","","","","","","","","","","","",Dissident Republicans,"","","","","","The specific motive is unknown; however, sources note that the incident occurred as Northern Ireland loyalists were protesting the government's recent decision to prohibit the holding of an Orange Order parade.",0,"","",0,-99,0,0,"","","","","","","","","",6,Explosives,31,Pipe Bomb,8,Incendiary,19,Molotov Cocktail/Petrol Bomb,"","","","","","","","",A pipe bomb containing nails as well as petrol bombs were used in the attack.,0,0,0,0,0,0,0,"","","","",0,"","","","","","","","","","","","","","","","","\"\"\"Northern Ireland police survive republican pipe b ...","\"\" Focus Bulgaria",July 15,"2013.\"","\"\"\"Fourth night of violence flares in Belfast as a pipe bomb and other explosives are thrown at police","\"\" Big News Network",July 16,"2013.\"","\"\"\"Humphrey Condemns Nail Bomb Attack"
201308080028,2013,8,8,"",0,"",603,8,Western Europe,Northern Ireland,Londonderry,55.011562,-7.312045,1,0,"","08/08/2013: Assailants threw a petrol bomb at a civilian home in Londonderry city, County Londonderry, Northern Ireland, United Kingdom. There were no reports of casualties or property damage in the attack. No group claimed responsibility for the incident.",1,1,1,0,"","",0,0,0,2,Armed Assault,"","","","",14,Private Citizens & Property,76,House/Apartment/Residence,Conway Park,Residence,233,Northern Ireland,"","","","","","","","","","","","","","","","",Unknown,"","","","","","",0,"","",0,3,0,0,"","","","","","","","","",8,Incendiary,19,Molotov Cocktail/Petrol Bomb,"","","","","","","","","","","","",A petrol bomb was used in the attack.,0,0,0,0,0,0,0,"","","","",0,"","","","","","","","","","","","","","","","","\"\"\"Police hunt petrol bomb attackers","\"\" BBC",August 8,"2013.\"","\"\"\"Petrol bomb attack 'a hate crime'","\"\" UTV",August 8,"2013.\"","\"\"\"Petrol Bomb Attack Targets House"
201308090006,2013,8,9,"",0,"",603,8,Western Europe,Northern Ireland,Lisburn,54.515694,-6.055724,1,0,"","08/09/2013: An explosive device was discovered and defused at the Lady Wallace Crescent in Lisburn city, Lisburn district, Northern Ireland, United Kingdom. No group claimed responsibility for the incident.",1,1,1,0,"","",0,0,0,3,Bombing/Explosion,"","","","",14,Private Citizens & Property,76,House/Apartment/Residence,Not Applicable,Lady Wallace Crescent,233,Northern Ireland,"","","","","","","","","","","","","","","","",Unknown,"","","","","","",0,"","",0,-99,0,0,"","","","","","","","","",6,Explosives,31,Pipe Bomb,"","","","","","","","","","","","","",0,0,0,0,0,0,0,"","","","",0,"","","","","","","","","","","","","","","","","\"\"\"Pipe bomb made safe by Army in city","\"\" BBC",August 9,"2013.\"","","",START Primary Collection,-9,-9
201308090010,2013,8,9,"",0,"",603,8,Western Europe,Northern Ireland,Belfast,54.607712,-5.95621,1,0,"","08/09/2013: Assailants attacked police as they were providing security for a pro-Irish republican parade in Belfast city, Belfast district, Northern Ireland, United Kingdom. At least 56 officers were wounded in the attack. No group claimed responsibility for the incident; however, authorities attributed the attack to Protestant extremists.",1,1,1,0,"","",0,1,0,2,Armed Assault,"","","","",3,Police,25,Police Security Forces/Officers,Police Service of Northern Ireland (PSNI),Riot Police: Officers,233,Northern Ireland,"","","","","","","","","","","","","","","","",Protestant extremists,"","","","","","",0,"","",0,-99,0,0,"","","","","","","","","",9,Melee,23,Knife or Other Sharp Object,9,Melee,21,Blunt Object,"","","","","","","","",Bricks and other blunt objects as well as a sword were used in the attack.,0,0,0,56,0,"",1,3,Minor (likely < $1 million),-99,"Several vehicles, scaffolding and pavement were damaged in this attack.",0,"","","","","","","","","","","","","","","","","\"\"\"Northern Ireland Police Vow to Pursue Militants","\"\" AllVoices",August 10,"2013.\"","\"\"\"Police hurt in Northern Ireland sectarian violence","\"\" Yahoo! News",August 9,"2013.\"",""
201308100044,2013,8,10,"",0,"",603,8,Western Europe,Northern Ireland,Newry,54.183052,-6.341388,1,0,"","08/10/2013: Assailants attacked the Robert L. Mitchell Hall in Newry town, Newry and Mourne district, Northern Ireland, United Kingdom. After vandalizing the building with paint, the assailants attempt to set fire to the hall by lighting newspapers on the building's roof. There were no reports of injuries in the attack; however, the hall suffered minor damage from the fire. No group claimed responsibility for the incident, which authorities described as a sectarian attack.",1,1,1,0,"","",0,1,0,7,Facility/Infrastructure Attack,"","","","",14,Private Citizens & Property,82,Labor Union Related,Loyal Orange Institution,Robert L. Mitchell Memorial Hall,233,Northern Ireland,"","","","","","","","","","","","","","","","",Unknown,"","","","","","The specific motive is unknown; however, local officials speculated that the attack was sectarian in nature between Northern Ireland's Protestant and Catholic communities.",0,"","",0,-99,0,0,"","","","","","","","","",8,Incendiary,18,Arson/Fire,12,Other,"","","","","","","","","","",Lit newspapers and paint were used in the attack.,0,0,0,0,0,0,1,3,Minor (likely < $1 million),-99,The building was vandalized with paint and the roof was damaged in this attack.,0,"","","","","","","","","","","","","","","","","\"\"\"Orange hall damaged in city attack","\"\" BBC",August 11,"2013.\"","\"\"\"Orangeman's Home Attacked In Coleraine","\"\" 4NI",August 12,"2013.\"","\"\"\"Orange Hall Attacked"
201308120003,2013,8,12,"",0,"",603,8,Western Europe,Northern Ireland,Belfast,54.607712,-5.95621,1,0,The incident took place along Stewartstown road.,"08/12/2013: Assailants threw two pipe bombs at the Woodbourne Police Station in Belfast, Northern Ireland, United Kingdom. One of the pipe bombs detonated while the other device was picked up by children and turned into police, who defused it. There were no reported casualties in the attack. No group claimed responsibility; however, sources attributed the incident to Oglaigh na hEireann.",1,1,1,0,"","",0,1,0,3,Bombing/Explosion,"","","","",3,Police,22,"Police Building (headquarters, station, school)",Woodbourne Police,Police Station,233,Northern Ireland,"","","","","","","","","","","","","","","","",Oglaigh na hEireann,"","","","","","",0,"","",0,-99,0,0,"","","","","","","","","",6,Explosives,31,Pipe Bomb,"","","","","","","","","","","","",Two pipe bombs were used in the attack.,0,0,0,0,0,0,0,"","","","",0,"","","","","","","","","","","","","","","","","\"\"\"Children 'picked up' bomb in city","\"\" BBC",August 13,"2013.\"","\"\"\"Children pick up unexploded pipe bomb in Belfast","\"\" ITV.com",August 13,"2013.\"","\"\"\"Children lift bomb meant for police"
201308150005,2013,8,15,"",0,"",603,8,Western Europe,Northern Ireland,Belfast,54.607712,-5.95621,1,0,The incident took place in the New Lodge area of the city.,"08/15/2013: A pipe bomb detonated at a residence in Carlisle Square, New Lodge area, Belfast city, Belfast district, Northern Ireland, United Kingdom. There were no reported casualties; however, the front door of the targeted residence was damaged in the blast. No group claimed responsibility for the incident.",1,1,1,0,"","",0,1,0,3,Bombing/Explosion,"","","","",14,Private Citizens & Property,76,House/Apartment/Residence,Not Applicable,Residence,233,Northern Ireland,"","","","","","","","","","","","","","","","",Unknown,"","","","","","",0,"","",0,-99,0,0,"","","","","","","","","",6,Explosives,31,Pipe Bomb,"","","","","","","","","","","","",A thrown pipe bomb was used in the attack.,0,0,0,0,0,0,1,3,Minor (likely < $1 million),-99,The front door of the home was damaged in this attack.,0,"","","","","","","","","","","","","","","","","\"\"\"Residents escape injury in attack","\"\" BBC",August 16,"2013.\"","\"\"\"Belfast house damaged in pipe bomb blast","\"\" Irish Examiner",August 16,"2013.\"","\"\"\"Pipe bomb damages north Belfast house"
201308160027,2013,8,16,"",0,"",603,8,Western Europe,Northern Ireland,Ballymena,54.86538,-6.28038,1,0,"","08/16/2013: An explosive device was found and defused in the parking lot outside the Ballymena Showgrounds in Ballymena town, Ballymena district, Northern Ireland, United Kingdom. No casualties were reported and no group claimed responsibility for the incident.",1,1,1,0,"","",0,0,0,3,Bombing/Explosion,"","","","",1,Business,11,Entertainment/Cultural/Stadium/Casino,Ballymena Showgrounds,Showgrounds,233,Northern Ireland,"","","","","","","","","","","","","","","","",Unknown,"","","","","","",0,"","",0,-99,0,0,"","","","","","","","","",6,Explosives,31,Pipe Bomb,"","","","","","","","","","","","","",0,0,0,0,0,0,0,"","","","",0,"","","","","","","","","","","","","","","","","\"\"\"Bomb found at Ballymena showgrounds","\"\" Irish Times",August 17,"2013.\"","\"\"\"Pipe bomb found in Ballymena stadium","\"\" UTV",August 17,"2013.\"",""
201308180028,2013,8,18,"",0,"",603,8,Western Europe,Northern Ireland,Belfast,54.607712,-5.95621,1,0,The incident occurred on Kells avenue in the Suffolk area.,"08/18/2013: Assailants threw a piece of pavement through the window of a house in Belfast city, Belfast district, Northern Ireland, United Kingdom. No injuries were reported. No group claimed responsibility for the incident; however, police officials speculated that the attack was sectarian in nature.",1,1,1,0,"","",0,1,0,7,Facility/Infrastructure Attack,"","","","",14,Private Citizens & Property,76,House/Apartment/Residence,Not Applicable,Residence,233,Northern Ireland,"","","","","","","","","","","","","","","","",Unknown,"","","","","","The specific motive is unknown; however, sources speculated that the attack was part of a larger trend of sectarian violence.",0,"","",0,-99,0,0,"","","","","","","","","",12,Other,"","","","","","","","","","","","","","",A broken piece of a paving stone was thrown in the attack.,0,0,0,0,0,0,1,3,Minor (likely < $1 million),-99,A window was damaged in this attack.,0,"","","","","","","","","","","","","","","",The house had previously been targeted in an attack in June. That attack is identified as 201306190036.,"\"\"\"'Sectarian' attack on Belfast house","\"\" UTV",August 18,"2013.\"","","",START Primary Collection,-9,-9
201308230030,2013,8,23,"",0,"",603,8,Western Europe,Northern Ireland,Rasharkin,54.957758,-6.482205,1,0,"","08/23/2013: A pipe bomb was safely defused in Rasharkin village, Ballymoney district, Northern Ireland, United Kingdom. No group claimed responsibility for the incident.",1,1,1,0,"","",0,0,0,3,Bombing/Explosion,"","","","",20,Unknown,"","",Unknown,Unknown,233,Northern Ireland,"","","","","","","","","","","","","","","","",Unknown,"","","","","","",0,"","",0,-99,0,0,"","","","","","","","","",6,Explosives,31,Pipe Bomb,"","","","","","","","","","","","","",0,0,0,0,0,0,0,"","","","",0,"","","","","","","","","","","","","","","","","\"\"\"'Pipe bomb' found in Rasharkin","\"\" UTV",August 23,"2013.\"","","",START Primary Collection,-9,-9
201308260007,2013,8,26,"",0,"",603,8,Western Europe,England,Harlow,51.767787,0.087806,1,0,"","08/26/2013: Three assailants attempted to set fire to the Harlow Islamic Center on Paringdon Road in Harlow town, England, United Kingdom. There were no reported casualties; however, the targeted center sustained minor damage in the attack. No group claimed responsibility for the incident.",1,1,1,0,"","",0,1,0,7,Facility/Infrastructure Attack,"","","","",15,Religious Figures/Institutions,86,Place of Worship,Harlow Islamic Center,Mosque,216,Great Britain,"","","","","","","","","","","","","","","","",Unknown,"","","","","","The specific motive is unknown; however, sources label this incident as being a targeted anti-Muslim attack. It is also important to note that several mosques have been attacked following the attack on British soldier Lee Rigby on May 22, 2013.",0,"","",0,3,0,0,"","","","","","","","","",8,Incendiary,18,Arson/Fire,"","","","","","","","","","","","",Industrial foam used for insulation was used in the attack.,0,0,0,0,0,0,1,3,Minor (likely < $1 million),-99,An Islamic center was damaged in this attack.,0,"","","","","","","","","","","","","","","","","\"\"\"CCTV of Islamic centre arson issued","\"\" BBC",August 28,"2013.\"","\"\"\"Islamic centre arson attack probed","\"\" BBC",August 26,"2013.\"","\"\"\"CCTV footage of suspects in arson attack on Harlow mosque released by police"
201308270011,2013,8,27,"",0,"",603,8,Western Europe,Northern Ireland,Cullyhanna,54.130584,-6.586169,1,0,"","08/27/2013: Two explosives were discovered in Cullyhanna village, Armagh district, Northern Ireland, United Kingdom. The devices were safely detonated on August 28, 2013. Oglaigh na hEireann claimed responsibility for the incident, stating that the attack was aborted when their primary target failed to appear in the area.",1,1,1,0,"","",0,0,0,3,Bombing/Explosion,"","","","",20,Unknown,"","",Unknown,Unknown,233,Northern Ireland,"","","","","","","","","","","","","","","","",Oglaigh na hEireann,"","","","","","",0,"","",0,-99,0,1,10,Unknown,"","","","","","","",6,Explosives,11,"Projectile (rockets, mortars, RPGs, etc.)","","","","","","","","","","","","",Two mortar launchers with tubes made from 8-10 foot drainage pipes were used in the attack.,0,0,0,0,0,0,0,"","","","",0,"","","","","","","","","","","","","","","",The Crossmaglen Examiner suggest this may have been a some Surface-to-Air Missile launcher made from components from Hezbollah. Unknown source validity score.,"\"\"\"Security alert over after three days","\"\" BBC",August 29,"2013.\"","\"\"\"Further disruption after mortar find","\"\" BBC",August 28,"2013.\"","\"\"\"Abandoned bombs represent 'unfinished business' � ONH claim responsibility"
201308270021,2013,8,27,"",0,"",603,8,Western Europe,England,Portishead,51.485286,-2.767633,1,0,"","08/27/2013: Assailants set fire to a police firearms training center under construction in Portishead town, South West region, England, United Kingdom. No one was hurt in the attack, but the building Sustained extensive fire damage. The Angry Foxes Cell claimed responsibility for the incident, stating that the attack was carried out in conjunction with All Coppers Are Bastards (ACAB).",1,1,1,0,"","",0,1,0,7,Facility/Infrastructure Attack,"","","","",3,Police,22,"Police Building (headquarters, station, school)","Police of Avon, Somerset, Gloucestershire, and Wiltshire",Under-Construction Firearms Training Center,216,Great Britain,"","","","","","","","","","","","","","","","",Angry Foxes Cell,"",All Coppers Are Bastards (ACAB),"","","",A statement from the All Coppers Are Bastards (ACAB) and Angry Foxes Cell stated that the attack was meant to protest the planned killing of animals and because they considered the police to be a symbol of oppression.,0,0,"",0,-99,0,1,7,"Posted to website, blog, etc.",0,"","","","","","",8,Incendiary,18,Arson/Fire,"","","","","","","","","","","","",Paint stripper was used as an accelerant in the attack.,0,0,0,0,0,0,1,3,Minor (likely < $1 million),-99,A building was damaged in this attack.,0,"","","","","","","","","","","","","","","","Members of two anarchist groups, the Angry Foxes Cell and the All Coppers Are Bastards (ACAB) group, claimed joint responsibility for the incident, stating that it was meant as a protest against the planned killing of over 5000 badgers. The Informal Anarchist Federation (IAF) also claimed responsibility for the fire.","\"\"\"Police gun centre probe 'days away'","\"\" BBC",August 30,"2013.\"","\"\"\"Badger cull: anarchists claim destruction of £16m police firing range","\"\" telegraph.co.uk",August 28,"2013.\"","\"\"\"Anarchist claim responsibility for arson attack on police building in the UK's South East England"
201308290039,2013,8,29,"",0,"",603,8,Western Europe,England,Bristol,51.439889,-2.547182,1,0,The incident occurred in the Brislington area of the city.,"08/29/2013: Assailants detonated an incendiary device at a Barclays bank branch in Brislington area, Bristol city, South West region, England, United Kingdom. There were no reports of casualties in the attack; however, the fire caused damage to an air conditioning unit. The Informal Anarchist Federation claimed responsibility for the incident in a post online.",1,1,1,0,"","",0,1,0,7,Facility/Infrastructure Attack,"","","","",1,Business,3,Bank/Commerce,Barclays PLC,Bank Branch,216,Great Britain,"","","","","","","","","","","","","","","","",Informal Anarchist Federation,"","","","","","",0,"","",0,-99,0,1,7,"Posted to website, blog, etc.","","","","","","","",8,Incendiary,18,Arson/Fire,"","","","","","","","","","","","","",0,0,0,0,0,0,1,3,Minor (likely < $1 million),-99,A bank building and an air conditioning unit were damaged in this attack.,0,"","","","","","","","","","","","","","","","","\"\"\"\"\"Anarchists\"\" claim to have started Brislington bank fire","\"\" Bristol Post",September 1,"2013.\"","\"\"\"Fire breaks out at Brislington bank","\"\" Bristol Post",August 29,"2013.\"",""
201309040021,2013,9,4,"",0,"",603,8,Western Europe,Northern Ireland,Carrickfergus,54.71373,-5.80818,1,0,Incident occurred on Larne road,"09/04/2013: A pipe bomb was discovered and defused in Carrickfergus town, Carrickfergus district, Northern Ireland, United Kingdom. No group claimed responsibility for the incident.",1,1,1,0,"","",0,0,0,3,Bombing/Explosion,"","","","",14,Private Citizens & Property,76,House/Apartment/Residence,Not Applicable,Residence,233,Northern Ireland,"","","","","","","","","","","","","","","","",Unknown,"","","","","","",0,"","",0,-99,0,0,"","","","","","","","","",6,Explosives,31,Pipe Bomb,"","","","","","","","","","","","","",0,0,0,0,0,0,0,"","","","",0,"","","","","","","","","","","","","","","","","\"\"\"Pipe bomb found in Carrickfergus","\"\" BBC",September 4,"2013.\"","\"\"\"Pipe bomb causes Carrick security alert","\"\" UTV",September 4,"2013.\"",""
201309100019,2013,9,10,2013-09-10 00:00:00,0,"",603,8,Western Europe,Northern Ireland,Belfast,54.607712,-5.95621,1,0,The incident occurred on Malone road.,"09/10/2013: An explosive device was discovered and defused on Malone Road in Belfast city, Belfast district, Northern Ireland, United Kingdom. No group claimed responsibility for the incident.",1,1,1,0,"","",0,0,0,3,Bombing/Explosion,"","","","",20,Unknown,"","",Unknown,Unknown,233,Northern Ireland,"","","","","","","","","","","","","","","","",Unknown,"","","","","","",0,"","",0,-99,0,0,"","","","","","","","","",6,Explosives,31,Pipe Bomb,"","","","","","","","","","","","","",0,0,0,0,0,0,0,"","","","",0,"","","","","","","","","","","","","","","","","\"\"\"Viable pipe bomb at Belfast TA base","\"\" UTV",September 10,"2013.\"","\"\"\"Army tackles Belfast pipe bomb","\"\" Farming Life",September 10,"2013.\"","\"\"\"Lo condemns those behind South Belfast pipe bomb"
