200809270013,2008,9,27,"",0,"",603,8,Western Europe,England,London,51.504387,-0.140041,1,0,"The attack took place at the Gibson Square book publishing headquarters and residence in London, England, United Kingdom.","09/27/2008: On Saturday, at 0230, suspected Islamic extremists detonated a firebomb at the Gibson Square book publishing headquarters and residence in London, England, United Kingdom. The arson attack caused an unknown amount of damage to the building but caused no casualties. The attack was in response to the book publishing company buying the rights to an American book about the prophet Mohammad. No claim of responsibility was made for the incident but three men were arrested.",1,1,1,0,"","",0,1,0,7,Facility/Infrastructure Attack,"","","","",1,Business,7,Retail/Grocery/Bakery,Gibson Square Book Publishing,"The Gibson Square book publishing headquarters, which also serves as a residence,",216,Great Britain,"","","","","","","","","","","","","","","","",Unknown,"","","","","",The attack was in response to the book publishing company buying the rights to an American book about the prophet Mohammad.,0,"","",0,3,3,0,"","","","","","","","","",8,Incendiary,18,Arson/Fire,"","","","","","","","","","","","",A fire bomb was used in the attack.,0,0,0,0,0,0,1,4,Unknown,"",An unknown amount of damage was done to the building.,0,"","","","","","","","","","","","","","","","","\"National Counterterrorism Center, \"\"One Business Damaged in Firebombing by Suspected Islamic Extremists in London",England,United Kingdom,"\"\" Worldwide Incidents Tracking System",September 3,"2009.\"","\"John Bingham, \"\"Publisher's Home Firebombed","\"\" Daily Telegraph",September 29
200811060006,2008,11,6,"",0,"",603,8,Western Europe,England,Suffolk,52.187252,0.970768,1,0,The incident occured at a rail station in Suffolk.,"11/06/2008: On Thursday, a suspected Nazi bomb maker was accused of planning terror attacks after being found with two explosive devices at a rail station. Neil Lewington, 43, traveled to the station intending to commit terrorist acts. He was stopped after allegedly abusing rail staff in Lowestoft, Suffolk.",1,1,1,0,"","",0,0,0,3,Bombing/Explosion,"","","","",19,Transportation,100,Train/Train Tracks/Trolley,"",The target was a rail station.,216,Great Britain,"","","","","","","","","","","","","","","","",Neo-Nazi extremists,"","","","","",The specific motive for the attack is unknown.,0,"","",0,1,1,0,"","","","","","","","","",6,Explosives,16,Unknown Explosive Type,"","","","","","","","","","","","",Two explosive devices were used in the attack.,0,0,0,0,0,0,0,4,Unknown,"","",0,"","","","","","","","","","","","","","","","","\"The Sun, \"\"'Bombs Nazi' on Terror Rap","\"\" Lexis Nexis",The Sun,November 7th,"2008.\"","\"The Evening Standard, \"\"Man Charged Over Rail Station Bombs; News In Brief","\"\" Lexis Nexis",The Evening Standard,November 7th
200811140025,2008,11,14,"",0,"",603,8,Western Europe,Northern Ireland,Belfast,54.607712,-5.95621,1,0,The incident occurred on Antrim road.,"11/14/2008: On Friday, in Belfast, Northern Ireland, Great Britain, assailants detonated an improvised explosive device damaging a car on Antrim Road, but causing no injuries. No group claimed responsibility.",1,1,1,0,"","",0,0,0,3,Bombing/Explosion,"","","","",20,Unknown,"","","",The target of the attack was not reported.,96,Ireland,"","","","","","","","","","","","","","","","",Unknown,"","","","","",The specific motive for the attack is unknown.,0,"","",0,-99,0,0,"","","","","","","","","",6,Explosives,16,Unknown Explosive Type,"","","","","","","","","","","","",An improvised explosive device was used in the attack.,0,0,0,0,0,0,1,4,Unknown,"",The bridge was destroyed.,0,"","","","","","","","","","","","","","","","","\"The Mirror, \"\"Cops: Pipe Bomb Could Have Killed; Terror","\"\" The Mirror",November 14th,"2008.\"","\"Worldwide Incidents Tracking System - NCTC, \"\"One Vehicle Damaged in IED Attack in Belfast",Northern Ireland,United Kingdom,"\"\" Worldwide Incidents Tracking System - NCTC",November 17th
200812190020,2008,12,19,"",0,"",603,8,Western Europe,Northern Ireland,Newtownbutler,54.184008,-7.360209,1,0,Northern Ireland. The incident took place in Newtown Butler.,"12/19/2008: On Friday, in Newtown Butler, Northern Ireland, Great Britain, assailants threw a grenade at a group of police officers. No casualties or damage was reported.  No group claimed responsibility, but it was believed that dissident Republicans were responsible.",1,1,1,0,"","",0,1,0,3,Bombing/Explosion,"","","","",3,Police,25,Police Security Forces/Officers,"",A group of police officers.,96,Ireland,"","","","","","","","","","","","","","","","",Unknown,"","","","","",The specific motive for the attack is unknown.,0,"","",0,-99,-99,0,"","","","","","","","","",6,Explosives,7,Grenade,"","","","","","","","","","","","",A grenade was used in the attack.,0,0,0,0,0,0,-9,4,Unknown,"","",0,"","","","","","",-9,"","","","","","","","","","\"Natioanl Counterterrorism Center, \"\"Police Officers Targeted in Grenade Attack by Suspected Dissident Republicans in Newton Butler",Northern,Ireland,United Kingdom,"\"\" World Incident Tracking System",December 19,"2008.\"","\"Press Association Media Point, \"\"Warning After Explosive Device Found On Wasteland","\"\" Press Assocation"
200901040009,2009,1,4,"",0,"",603,8,Western Europe,England,Brondesbury,51.504387,-0.140041,1,0,The attack took place in Brondesbury.,"01/04/2009: On Sunday night, in Brondesbury, London, England, a synagogue suffered an arson attack. The attackers attempted to smash a window, but were prevented from doing so, as shown on the security film. They, then attempted to set the front door alight with petrol, causing some damage to the exterior of the premises. No casualties or motive were reported. No group claimed responsibility.",1,1,1,0,"","",0,1,0,7,Facility/Infrastructure Attack,"","","","",15,Religious Figures/Institutions,86,Place of Worship,"",A synagogue was the target.,216,Great Britain,"","","","","","","","","","","","","","","","",Unknown,"","","","","",The specific motive for the attack is unknown.,0,"","",0,-99,0,0,"","","","","","","","","",8,Incendiary,20,Gasoline or Alcohol,"","","","","","","","","","","","",Petrol was used in the attack.,0,0,"",0,0,"",1,3,Minor (likely < $1 million),"",The attack caused an unknown amount of property damage.,0,"","","","","","","","","","","","","","","","","\"Israel National News, \"\"Flaming Vehicle Rammed into Synagogue","\"\"  http://www.israelnationalnews.com/News/News.aspx/129250 (January 06","2009).\"","\"Times Online, \"\"Security Stepped up After Attack on Synagogue","\"\" http://www.timesonline.co.uk/tol/news/uk/article5455450.ece (January 06","2009).\"","",ISVG,-9
200901270026,2009,1,27,"",0,"",603,8,Western Europe,Northern Ireland,Castlewellan,54.255696,-5.948804,1,0,County Down. Near a primary school,"1/27/2009: A 300 lb explosive device in a Volkswagen Bora was abandoned on the Dublin near a primary school in the village of Castlewellan, County Down, Northern Ireland. Authorities discovered the device after phone call warning to the media, and disarmed it using several controlled explosions during a five-day security operation. The dissident group Oglaigh na hEireann claimed responsibility for the bomb, which they explained was initially intended to target Ballykinlar army base.",1,1,1,0,"","",0,0,0,3,Bombing/Explosion,"","","","",14,Private Citizens & Property,70,Student,Private Citizens,"A road frequented by students, teachers, and parents",233,Northern Ireland,"","","","","","","","","","","","","","","","",Oglaigh na hEireann,"","","","","",Unknown,0,"","",0,-99,0,1,2,Call (post-incident),"","","","","","",0,6,Explosives,15,Vehicle,"","","","","","","","","","","","",300 lb car bomb,0,0,0,0,0,0,0,"","","","No damage, the device was disarmed",0,"","","","","","","","","","","","","","","","\"In their statement, the perpetrators noted \"\"ONH take this opportunity to distance ourselves from people purporting to be republican actively engaged in the drug trade either directly or otherwise. We also ask the republican community to distance themselves from black propaganda emanating from Sinn Fein and the Provisional movement.\"\"\"","","\"\"\"Car bomb left by school; Rebel bomb left","\"\" The Sunday Times (London)",February 1,"2009.\"","\"\"\"Dissident group claims car bomb","\"\" Irish News",February 6,"2009.\""
200903080013,2009,3,7,"",0,"",603,8,Western Europe,Northern Ireland,Antrim,54.713382,-6.216761,1,0,County Antrim,"03/07/2009: On Saturday night, at a Massereene barracks, northwest of Belfast, Ireland two gunmen with automatic rifles killed two soldiers and wounded 4 more. The gunmen entered the base as pizza was being delivered to the Royal Engineers base and fired up to 40 shots in two long bursts and fired additional shots at people who were on the ground. The other person involved drove the getaway car. No damage or motive were reported and The Real IRA has claimed responsibility for the attack.",1,1,1,0,"","",0,1,0,2,Armed Assault,"","","","",4,Military,27,Military Barracks/Base/Headquarters/Checkpost,British Army,British soldiers at the British Army base,233,Northern Ireland,14,Private Citizens & Property,77,Laborer (General)/Occupation Identified,"",Pizza delivery boy,96,Ireland,"","","","","","","","",Real Irish Republican Army (RIRA),"","","","","",The specific motive for the attack is unknown.,0,"","",0,2,0,1,10,Unknown,"","","","","","","",5,Firearms,2,Automatic or Semi-Automatic Rifle,"","","","","","","","","","","","",Automatic weapons were used in the attack.,2,0,0,4,0,0,-9,"","","",It is unknown if the attack caused any property damage.,0,"","","","","","","","","","","","","","","","","\"Agence France-Presse, \"\"Police Say N Ireland Attack Was 'Mass Murder' Attempt by 'Terrorists'","\"\" Agence Fracne-Presse",March 08,"2009.\"","\"Agence France-Presse, \"\"Police Say N Ireland Attack Was 'Mass Murder' Attempt by 'Terrorists'","\"\" Agence Fracne-Presse",March 08,"2009.\"","\"Press TV, \"\"N Ireland: Fear of Violence Grows"
200903090001,2009,3,9,"",0,"",603,8,Western Europe,Northern Ireland,Craigavon,54.446968,-6.39292,1,0,Northern Ireland. The attack took place in County Armagh.,"03/09/2009: On Tuesday night at 2145, in the Craigavon area of County Armagh, Northern Ireland, United Kingdom, Constable Stephen Carroll, a British police officer, was shot in the head at close range through his rear window of his police car after responding to an emergency call from a woman whose home was being attacked by stone-throwing youth. No damage was reported. On 03/10/2009, The Continuity Irish Republican Army has claimed responsibility for the attack and says they will continue doing so until the British leave Ireland. A 17-year-old boy and a 37-year-old man have been arrested in connection to the murder.",1,1,1,0,"","",0,1,0,2,Armed Assault,"","","","",3,Police,25,Police Security Forces/Officers,British Police,Constable Carroll,233,Northern Ireland,"","","","","","","","","","","","","","","","",Continuity Irish Republican Army (CIRA),"","","","","",The specific motive for the attack is due to the group wanting the British out of Ireland.,0,"","",0,-99,2,1,10,Unknown,"","","","","","","",5,Firearms,5,Unknown Gun Type,"","","","","","","","","","","","",Unknown firearms were used in the attack.,1,0,0,0,0,0,-9,"","","",It is unknown if the attack caused any property damage.,0,"","","","","","","","","","","","","","","","","\"Press TV, \"\"Two Arrested over Northern Ireland Murder","\"\" http://www.presstv.ir/Detail.aspx?id=88202&sectionid=351020606 (March 11","2009).\"","\"Press TV, \"\"Two Arrested over Northern Ireland Murder","\"\" http://www.presstv.ir/Detail.aspx?id=88202&sectionid=351020606 (March 11","2009).\"","\"Press TV, \"\"IRA Dissidents Behind Officer Murder","\"\" http://www.presstv.ir/Detail.aspx?id=88145&sectionid=351020606 (March 10","2009).\""
200903300001,2009,3,30,"",0,"",603,8,Western Europe,Northern Ireland,Belfast,54.607712,-5.95621,1,0,Northern Ireland. The vehicle was hijacked on Whiteroad Road. The exact location is unknown.,"03/30/2009: On Monday, around 1600, assailants hijacked a vehicle on Whiterock Road, pulled the driver from his vehicle, doused him and the vehicle in gasoline and set the vehicle on fire, wounding the driver and causing damage to the vehicle. No group claimed responsibility, although it was widely believed that republican dissidents were responsible.",1,1,1,0,"","",0,1,0,4,Hijacking,"","","","",14,Private Citizens & Property,73,Vehicles/Transportation,"",The vehicle,233,Northern Ireland,"","","","","","","","","","","","","","","","",Irish Republican Extremists,"","","","","",The specific motive for the attack is unknown.,0,"","",0,-99,-99,0,"","","","","","","","","",5,Firearms,5,Unknown Gun Type,"","","","","","","","","","","","","",0,0,0,1,0,0,-9,"","","","",0,"","","","","","","","","","","","","","","","","","","",ISVG,0,0,1,1,""
200903300002,2009,3,30,"",0,"",603,8,Western Europe,Northern Ireland,Belfast,54.607712,-5.95621,1,0,Near North Queen Street.,"03/30/2009: On Monday, assailants hijacked five vehicles, stole the wallets of two of the drivers, and abandoned the vehicles near police stations near North Queen Street, Tennant Street, Kings Way, Blacks Road, and near the Stormont Parliamentary building as if they were vehicle-borne improvised explosive devices (VBIED).  All five vehicles were determined not to be VBIEDs by authorities. No group claimed responsibility, although it was widely believed that republican dissidents were responsible.",1,1,1,0,"","",0,1,0,4,Hijacking,"","","","",14,Private Citizens & Property,73,Vehicles/Transportation,"",The vehicles were the targets of the attack.,233,Northern Ireland,"","","","","","","","","","","","","","","","",Irish Republican Extremists,"","","","","",The specific motive for the attack is unknown.,0,"","",0,-99,-99,0,"","","","","","","","","",5,Firearms,5,Unknown Gun Type,"","","","","","","","","","","","","",0,0,0,0,0,0,-9,"","","","",0,"","","","","","","","","","","","","","","","","","","",ISVG,0,0,1,1,""
200903300003,2009,3,30,"",0,"",603,8,Western Europe,Northern Ireland,Belfast,54.607712,-5.95621,1,0,Northern Ireland. The vehicle was hijacked and abandoned in the middle of the M1 motorway. The exact location is unknown.,"03/30/2009: On Monday, assailants hijacked a vehicle on the M1 motorway and abandoned it in the middle of the motorway to block traffic. No group claimed responsibility, although it was widely believed that republican dissidents were responsible.",1,1,1,0,"","",0,1,0,4,Hijacking,"","","","",14,Private Citizens & Property,73,Vehicles/Transportation,"",The vehicle,233,Northern Ireland,"","","","","","","","","","","","","","","","",Irish Republican Extremists,"","","","","",The specific motive for the attack is unknown.,0,"","",0,-99,-99,0,"","","","","","","","","",5,Firearms,5,Unknown Gun Type,"","","","","","","","","","","","","",0,0,0,0,0,0,-9,"","","","",0,"","","","","","","","","","","","","","","","","","","",ISVG,0,0,1,1,""
200903300029,2009,3,30,"",0,"",603,8,Western Europe,Northern Ireland,Belfast,54.607712,-5.95621,1,0,"Northern Ireland. A truck was hijacked on Upper Springfield Road, the exact location is unknown.","03/30/2009: On Monday, a truck was hijacked and set on fire on Upper Springfield Road in Belfast.",1,1,1,0,"","",0,1,0,4,Hijacking,"","","","",20,Unknown,"","","",The truck,95,Iraq,"","","","","","","","","","","","","","","","",Unknown,"","","","","",The specific motive for the attack is unknown.,0,"","",0,-99,-99,0,"","","","","","","","","",5,Firearms,5,Unknown Gun Type,"","","","","","","","","","","","","",0,"","",0,"","",-9,"","","","",1,-99,0,"",-99,"","",-9,"","","","","",7,Unknown,0,"","","","",ISVG,-9,-9,1,1,""
200903300030,2009,3,30,"",0,"",603,8,Western Europe,Northern Ireland,Belfast,54.463367,-6.328597,1,0,"Northern Ireland. A vehicle was hijacked in Kilwilkie, Lurgan, Belfast. The exact area is unknown. Another vehicle was hijacked in Kilwilkie, Lurgan, Belfast. The exact area is unknown. A vehicle was hijacked in Kilwilkie, Lurgan, Belfast. The exact area is unknown. A vehicle was hijacked in Kilwilkie, Lurgan, Belfast. The exact area is unknown. A vehicle was hijacked in Kilwilkie, Lurgan, Belfast. The exact area is unknown.","03/30/2009: On Monday, five cars have been hijacked and set on fire in Kilwilkie, Lurgan. This is related to police advising people to avoid the area. No group claimed responsibility, although it was widely believed that republican dissidents were responsible.",1,1,1,0,"","",0,1,0,4,Hijacking,"","","","",20,Unknown,"","","",The car,233,Northern Ireland,"","","","","","","","","","","","","","","","",Irish Republican Extremists,"","","","","",The specific motive for the attack is unknown.,0,"","",0,-99,-99,0,"","","","","","","","","",5,Firearms,5,Unknown Gun Type,"","","","","","","","","","","","","",0,0,0,0,0,0,-9,"","","","",0,"","","","","","","","","","","","","","","","","","","",ISVG,0,0,1,1,""
200904090020,2009,4,9,"",0,"",603,8,Western Europe,Northern Ireland,Belfast,54.607712,-5.95621,1,0,"Northern Ireland. The attack occurred in a vehicle in the Brookfield Place area of Ardoyne, Belfast, Northern Ireland.","04/09/2009: On Thursday evening at approximately 2130in the Brookfield Place area of Ardoyne, Northern Ireland, assailants fired upon civilians who were sitting in a parked vehicle, wounding two civilians.No group claimed responsibility, although it was widely believed republican dissidents were responsible.",1,1,1,0,"","",0,1,0,2,Armed Assault,"","","","",14,Private Citizens & Property,67,Unnamed Civilian/Unspecified,"",The civilians were the target in the attack.,233,Northern Ireland,"","","","","","","","","","","","","","","","",Unknown,"","","","","",The specific motive for the attack is unknown.,0,"","",0,-99,0,0,"","","","","","","","","",5,Firearms,5,Unknown Gun Type,"","","","","","","","","","","","",Unknown firearms were used in the attack.,0,0,0,2,0,0,-9,4,Unknown,"",It is unknown if the attack caused any property damage.,0,"","","","","","","","","","","","","","","","","\"Belfast Newsletter, \"\"Man Injured in Shooting","\"\" LexisNexis Academic",Belfast Newsletter,March 22,"2010.\"","","",ISVG,-9
200904120015,2009,4,12,"",0,"",603,8,Western Europe,Northern Ireland,Londonderry,55.011562,-7.312045,1,0,"The incident occurred at a Sinn Fein office at the Rath Mor Centre in Derry, Northern Ireland.","04/12/2009: On Sunday morning in Derry, Northern Ireland, assailants poured a flammable liquid into a Sinn Fein office at the Rath Mor Centre and set it alight, causing minor damage to the building but no casualties.No group claimed responsibility, although it was widely believed republican dissidents were responsible.",1,1,1,0,"","",0,1,0,7,Facility/Infrastructure Attack,"","","","",2,Government (General),15,Politician or Political Party Movement/Meeting/Rally,Northern Irish Government,A political party office building was the target in the attack.,233,Northern Ireland,"","","","","","","","","","","","","","","","",Unknown,"","","","","",The specific motive for the attack is unknown.,0,"","",0,-99,0,0,"","","","","","","","","",8,Incendiary,18,Arson/Fire,"","","","","","","","","","","","",An unknown incendiary device was used in the attack.,0,0,0,0,0,0,1,3,Minor (likely < $1 million),"",The attack caused minor damage to a building.,0,"","","","","","","","","","","","","","","","","\"Michael McHuge, Belfast Telegraph, \"\"SF Blame Dissidents for Arson Attack\"\"",LexisNexis Academic,Belfast Telegraph,March 22,"2010.\"","","",ISVG,-9
200905050003,2009,5,5,"",0,"",603,8,Western Europe,England,Luton,51.879652,-0.417558,1,0,"The attack took place in Luton, England, Great Britain.","05/05/2009: On Tuesday in Luton, England, Great Britain, an Islamic Center was targeted by an unknown group. The center was completely gutted by the fire, but there were no casualties. No group claimed responsibility.",1,1,1,0,"","",0,1,0,7,Facility/Infrastructure Attack,"","","","",15,Religious Figures/Institutions,87,Affiliated Institution,"",The attack targeted an Islamic Center.,"","","","","","","","","","","","","","","","","","",Unknown,"","","","","",The specific motive for the attack is unknown.,0,"","",0,-99,0,0,"","","","","","","","","",8,Incendiary,18,Arson/Fire,"","","","","","","","","","","","",An unknown incendiary device was used in the attack.,0,0,0,0,0,0,1,4,Unknown,"",The attack completely destroyed the Islamic Center.,0,"","","","","","","","","","","","","","","","","\"BBC Monitoring, \"\"Islamic Centre Arson Poster Plea","\"\" http://news.bbc.co.uk/1/hi/england/beds/bucks/herts/8063316.stm",BBC Monitoring,May 22,"2009.\"","\"Press Association, \"\"Arson Probe After Blaze Ravages Islamic Centre","\"\" LexisNexis Academic",Press Association,May 05
200905100020,2009,5,10,"",0,"",603,8,Western Europe,Northern Ireland,Londonderry,55.011562,-7.312045,1,0,"Northern Ireland. The attack took place in Derry, Northern Ireland.","05/10/2009: On Sunday evening in Derry, Northern Ireland, assailants threw gasoline bombs at the residence belonging to a Member of Legislative Assembly (MLA), causing minor damage to the residence but no casualties. No group claimed responsibility, although it was widely believed dissident republicans were responsible.",1,1,1,0,"","",0,1,0,7,Facility/Infrastructure Attack,"","","","",2,Government (General),18,"Government Personnel (excluding police, military)",Member of Legislative Assembly,The attack targeted the residence belonging to a Member of Legislative Assembly (MLA).,216,Great Britain,"","","","","","","","","","","","","","","","",Irish Republican Extremists,"","","","","",The specific motive for the attack is unknown.,1,"","",0,-99,0,0,"","","","","","","","","",8,Incendiary,20,Gasoline or Alcohol,"","","","","","","","","","","","",Gasoline bombs were used in the attack.,0,0,0,0,0,0,1,3,Minor (likely < $1 million),"",The attack caused minor damage to a residence.,0,"","","","","","","","","","","","","","","","","\"National Counterterrorism Center, \"\"One Residence Damaged in Firebombing by Suspected Dissident Republicans in Derry",Northern Ireland,United Kingdom,"\"\" Worldwide Incidents Tracking System",January 04,"2010.\"","\"George Jackson & Trevor McBride, Irish Times, \"\"Bogside Petrol Bomb Attack on Mitchell Mclaughlin's Home","\"\" LexisNexis Academic",Irish Times
200905280010,2009,5,28,"",0,"",603,8,Western Europe,Northern Ireland,Belfast,54.607712,-5.95621,1,0,"Northern Ireland. The attack took place in Victoria Parade, Belfast, Northern Ireland.","05/28/2009: On Thursday night at 0440 in Victoria Parade, Belfast, Northern Ireland, assailants threw a pipe bomb at a house causing no casualties. No group claimed responsibility.",0,1,1,1,2,Other Crime Type,0,1,0,3,Bombing/Explosion,"","","","",14,Private Citizens & Property,67,Unnamed Civilian/Unspecified,"",The attack targeted civilians.,96,Ireland,"","","","","","","","","","","","","","","","",Unknown,"","","","","",The specific motive for the attack is unknown.,0,"","",0,-99,0,0,"","","","","","","","","",6,Explosives,31,Pipe Bomb,"","","","","","","","","","","","","",0,0,0,0,0,0,-9,4,Unknown,"",It is unknown if the attack caused any property damage.,0,"","","","","","","","","","","","","","","","","\"BBC Monitoring, \"\"Pipe Bomb Thrown at House in City","\"\" http://news.bbc.co.uk/1/hi/northern_ireland/8072466.stm",BBC Monitoring,May 28,"2009.\"","\"Emily Moulton, Belfast Telegraph, \"\"Teenage Heroes Prevent Petrol Bombing Tragedy","\"\" LexisNexis Academic",Belfast Telegraph,May 29
200906040011,2009,6,4,"",0,"",603,8,Western Europe,Northern Ireland,Camlough,54.179379,-6.400562,1,0,"Northern Ireland. The attack took place in the Church Rock area of Camlough, Armagh.","06/04/2009: On Thursday night at about 0100, in the Church Rock area of Camlough, Armagh, Northern Ireland, assailants set fire to two vehicles belonging to Sinn Fein Regional Development Minister Conor Murphy, which were both destroyed. No group claimed responsibility, although it was widely believed dissident republicans were responsible.",1,1,1,0,"","",0,1,0,7,Facility/Infrastructure Attack,"","","","",2,Government (General),18,"Government Personnel (excluding police, military)","","Two vehicles, belonging to Sinn Fein Regional Development Minister Conor Murphy,",233,Northern Ireland,"","","","","","","","","","","","","","","","",Unknown,"","","","","",The specific motive for the attack is unknown.,0,"","",0,-99,0,0,"","","","","","","","","",8,Incendiary,18,Arson/Fire,11,Sabotage Equipment,"","","","","","","","","","",An unknown incendiary device and sabotage equipment were used in the attack.,0,0,0,0,0,0,1,4,Unknown,"",Two vehicles were destroyed in the attack.,0,"","","","","","","","","","","","","","","","","\"National Counterterrorism Center, \"\"Two Vehicles Destroyed",One Residence Damaged in Arson and Vandalism by Suspected Dissident Republicans in Camlough,Northern Ireland,United Kingdom,"\"\" Worldwide Incidents Tracking System",December 3,"2009.\"","\"Steven McCaffery, Press Trust of India, \"\"Dissident Republicans Blamed for Arson Attack","\"\" LexisNexis Academic"
