201212010009,2012,12,1,"",0,"",603,8,Western Europe,Northern Ireland,Larne,54.855103,-5.811254,1,0,"","12/01/2012: A pipe bomb was discovered near a police station in Larne town, Larne district, Northern Ireland, United Kingdom. Army ammunitions technical officers removed the pipe bomb for further investigation. No group claimed responsibility for the incident.",1,1,1,0,"","",0,0,0,3,Bombing/Explosion,"","","","",3,Police,22,"Police Building (headquarters, station, school)",Police Service of Northern Ireland (PSNI),Police Station,233,Northern Ireland,"","","","","","","","","","","","","","","","",Unknown,"","","","","","",0,"","",0,-99,0,0,"","","","","","","","","",6,Explosives,31,Pipe Bomb,"","","","","","","","","","","","","",0,0,0,0,0,0,0,"","","","",0,"","","","","","","","","","","","","","","","","\"\"\"Pipe   bomb discovered   near police station","\"\" The Irish News",December 3,"2012.\"","\"\"\"Pipe bomb at police station","\"\" Sunday Life",December 2,"2012.\"","\"\"\"Device found close to police station was viable'"
201212060005,2012,12,6,"",0,"",603,8,Western Europe,Northern Ireland,Unknown,54.787715,-6.492314,4,0,"","12/06/2012: A letter bomb was discovered in a postbox the night before the arrival of United States (US) Secretary of State Hillary Clinton to Down district, Northern Ireland, United Kingdom. This was one of two bombs discovered in the area on the same night. No group claimed responsibility for the attack.",1,1,1,0,"","",1,0,0,3,Bombing/Explosion,"","","","",14,Private Citizens & Property,79,"Public Area (garden, parking lot, garage, beach, public building, camp)",Not Applicable,Postbox,233,Northern Ireland,"","","","","","","","","","","","","","","","",Unknown,"","","","","","The specific motive is unknown; however, sources noted that the bomb was discovered 24 hours before the arrival of United States (US) Secretary of State Hillary Clinton to Northern Ireland.",0,"","",0,-99,0,0,"","","","","","","","","",6,Explosives,9,Letter Bomb,"","","","","","","","","","","","","",0,0,0,0,0,0,0,"","","","",0,"","","","","","","","","","","","","","","","","\"\"\"Bombs found as Clinton flies into Belfast","\"\" thetimes.co.uk",December 7,"2012.\"","\"\"\"Clinton visit greeted by two bombs","\"\" Belfast Telegraph Online",December 7,"2012.\"","\"\"\"Letter   bomb discovered   in postbox"
201212060006,2012,12,6,"",0,"",603,8,Western Europe,Northern Ireland,Londonderry,55.011562,-7.312045,1,0,The incident occurred in the Creggan neighborhood.,"12/06/2012: After stopping a vehicle and its passengers, police discovered and defused a large explosive device in Cregan city, Londonderry district, Northern Ireland, United Kingdom. The three people in the vehicle were subsequently arrested. This was one of two bombs discovered in the area on the same night; the incidents occurred hours before the arrival of United States (US) Secretary of State Hillary Clinton to the country. No group claimed responsibility for the incident; however, sources suspected that the New Irish Republican Army was involved.",1,1,1,0,"","",1,0,0,3,Bombing/Explosion,"","","","",3,Police,23,Police Patrol (including vehicles and convoys),Police Service of Northern Ireland (PSNI),Patrol,233,Northern Ireland,"","","","","","","","","","","","","","","","",The New Irish Republican Army,"","","","","","The specific motive is unknown; however, sources noted that the bomb was discovered 24 hours before the arrival of United States (US) Secretary of State Hillary Clinton to Northern Ireland.",1,"","",0,3,3,0,"","","","","","","","","",6,Explosives,15,Vehicle,"","","","","","","","","","","","","",0,0,0,0,0,0,0,"","","","",0,"","","","","","","","","","","","","","","","","\"\"\"Bomb found in car 'meant for attack on PSNI'","\"\" The Irish News",December 8,"2012.\"","\"\"\"Clinton car bomb danger averted","\"\" The Advertiser (Australia)",December 8,"2012.\"","\"\"\"Derry device designed to kill"
201212100013,2012,12,10,"",0,"",603,8,Western Europe,Northern Ireland,Belfast,54.607712,-5.95621,1,0,"","12/10/2012: Assailants threw a petrol bomb at a police vehicle outside the office of Naomi Long, a member of parliament (MP), in Belfast city, Belfast district, Northern Ireland, United Kingdom. There were no reported casualties. No group claimed responsibility for the incident; however, sources attributed the attack to Loyalists.",1,1,1,0,"","",0,1,0,2,Armed Assault,"","","","",2,Government (General),15,Politician or Political Party Movement/Meeting/Rally,Northern Ireland Assembly,Offices of Member: Naomi Long,233,Northern Ireland,"","","","","","","","","","","","","","","","",Loyalists,"","","","","","",0,"","",0,-99,0,0,"","","","","","","","","",8,Incendiary,19,Molotov Cocktail/Petrol Bomb,"","","","","","","","","","","","",Petrol bombs were used in the attack.,0,0,0,0,0,0,-9,"","","",It is unknown if any property was damaged in this attack.,0,"","","","","","","","","","","","","","","","","\"\"\"N.Ireland rioters petrol bomb police","\"\" Agence France Presse",December 10,"2012.\"","\"\"\"Petrol bombs thrown at police","\"\" The Herald (Glasgow)",December 11,"2012.\"","\"\"\"Police attacked with petrol bombs"
201212140008,2012,12,14,"",0,"",603,8,Western Europe,Northern Ireland,Mayobridge,54.180913,-6.229722,1,0,"","12/14/2012: An explosive device was discovered and defused on a the doorstep of a press photographer in the Mayobridge town, Down district, Northern Ireland, United Kingdom. No group claimed responsibility for the incident.",1,1,1,0,"","",0,0,0,3,Bombing/Explosion,"","","","",10,Journalists & Media,56,Other (including online news agencies),Unknown,Photographer: Mark Pearce,233,Northern Ireland,"","","","","","","","","","","","","","","","",Unknown,"","","","","","The specific motive is unknown; however, the victim speculated that he may have been targeted due to his work as a press photographer and noted that he had received death threats in the past.",0,"","",0,-99,0,0,"","","","","","","","","",6,Explosives,31,Pipe Bomb,"","","","","","","","","","","","","",0,0,0,0,0,0,0,"","","","",0,"","","","","","","","","","","","","","","","","\"\"\"Photographer Mark Pearce: I'll do my job",despite bombers,"\"\" Belfast Telegraph Online",December 15,"2012.\"","\"\"\"Pipe bomb found at photographer's home","\"\" The Irish News",December 15,"2012.\""
201212260017,2012,12,26,"",0,"",603,8,Western Europe,Northern Ireland,Lurgan,54.463367,-6.328597,1,0,"","12/26/2012: A pipe bomb was discovered and defused at Toberhewny Hall in Lurgan town, Craigavon district, Northern Ireland, United Kingdom. No group claimed responsibility for the incident.",1,1,1,0,"","",0,0,0,3,Bombing/Explosion,"","","","",14,Private Citizens & Property,79,"Public Area (garden, parking lot, garage, beach, public building, camp)",Unknown,Toberhewny Hall,233,Northern Ireland,"","","","","","","","","","","","","","","","",Unknown,"","","","","","",0,"","",0,-99,0,0,"","","","","","","","","",6,Explosives,31,Pipe Bomb,"","","","","","","","","","","","","",0,0,0,0,0,0,0,"","","","",0,"","","","","","","","","","","","","","","","","\"\"\"Pipe   bomb discovered   in Co Armagh","\"\" Belfast Telegraph Online",December 26,"2012.\"","\"\"\"Residents flee after pipe-  bomb discovery","\"\" Belfast Telegraph",December 27,"2012.\"","\"\"\"SECTION:   NEWS; Pg. 14"
201212300008,2012,12,30,"",0,"",603,8,Western Europe,Northern Ireland,Belfast,54.607712,-5.95621,1,0,"","12/30/2012: An explosive device was discovered attached to the vehicle of a police officer in Belfast city, Belfast district, Northern Ireland, United Kingdom. The device was successfully defused. The New Irish Republican Army claimed responsibility for the incident.",1,1,1,0,"","",0,0,0,3,Bombing/Explosion,"","","","",3,Police,25,Police Security Forces/Officers,Police Service of Northern Ireland (PSNI),Officer,233,Northern Ireland,"","","","","","","","","","","","","","","","",The New Irish Republican Army,"","","","","","",0,"","",0,-99,0,1,10,Unknown,"","","","","","","",6,Explosives,29,Sticky Bomb,"","","","","","","","","","","","",A pipe bomb attached underneath a police vehicle was used in the attack.,0,0,0,0,0,0,0,"","","","",0,"","","","","","","","","","","","","","","","","\"\"\"Third arrested over bomb under N. Ireland policeman's car","\"\" Agence France Presse",January 1,"2013.\"","\"\"\"Car bomb arrests","\"\" The Times (London)",January 1,"2013.\"","\"\"\"'Viable bomb' drops from N. Ireland police officer's car"
201212300010,2012,12,31,"",0,"",603,8,Western Europe,Northern Ireland,Tandragee,54.35334,-6.41366,1,0,"","12/31/2012: An explosive device was discovered and defused near a police station in Tandragee town, Armagh district, Northern Ireland, United Kingdom. No group claimed responsibility for the incident.",1,1,1,0,"","",0,0,0,3,Bombing/Explosion,"","","","",3,Police,22,"Police Building (headquarters, station, school)",Police Service of Northern Ireland (PSNI),Police Station,233,Northern Ireland,"","","","","","","","","","","","","","","","",Unknown,"","","","","","",0,"","",0,-99,0,0,"","","","","","","","","",6,Explosives,31,Pipe Bomb,"","","","","","","","","","","","","",0,0,0,0,0,0,0,"","","","",0,"","","","","","","","","","","","","","","","","\"\"\"Forty families evacuated after bomb is left outside station","\"\" Portadown Times",January 3,"2013.\"","\"\"\"New alert as bomb is left near police station","\"\" Belfast Telegraph",January 1,"2013.\"","\"\"\"PSNI on high alert following double dissident bomb threat"
201212310038,2012,12,31,"",0,"",603,8,Western Europe,Northern Ireland,Belfast,54.607712,-5.95621,1,0,The incident occurred at Glenalina Park in the Ballymurphy area of the city.,"12/31/2012: Assailants hurled a pipe bomb at a civilian home in Ballymurphy area, Belfast city, Belfast district, Northern Ireland, United Kingdom. The device failed to detonate and security forces were able to remove it. No group claimed responsibility for the incident.",1,1,1,0,"","",0,0,0,3,Bombing/Explosion,"","","","",14,Private Citizens & Property,76,House/Apartment/Residence,Not Applicable,Residences,233,Northern Ireland,"","","","","","","","","","","","","","","","",Unknown,"","","","","","",0,"","",0,-99,0,0,"","","","","","","","","",6,Explosives,31,Pipe Bomb,"","","","","","","","","","","","","",0,0,0,0,0,0,0,"","","","",0,"","","","","","","","","","","","","","","","","\"\"\"Homes evacuated over pipe bomb","\"\" BBC",January 1,"2013.\"","\"\"\"Bomb thrown at house in Belfast","\"\" BBC",January 1,"2013.\"","\"\"\"Dozens of families were forced to leave their homes on New Year's Eve after a suspected pipe bomb attack."
201301030026,2013,1,3,"",0,"",603,8,Western Europe,England,Bathampton,51.393949,-2.319144,1,0,"","01/03/2013: An assailant set fire to a communications mast in Bathampton town, South West region, England, United Kingdom. There were no injuries in the attack; however, television, radio, and mobile services were disrupted for approximately 80,000 residents. Police arrested one individual in connection with the attack. The Informal Anarchist Federation claimed responsibility for the incident in a post online.",1,1,1,0,"","",0,1,0,7,Facility/Infrastructure Attack,"","","","",16,Telecommunication,"","",Arqiva,Communications Mast,216,Great Britain,"","","","","","","","","","","","","","","","",Informal Anarchist Federation,"","","","","","",0,"","",0,1,1,1,7,"Posted to website, blog, etc.","","","","","","","",8,Incendiary,20,Gasoline or Alcohol,"","","","","","","","","","","","","",0,0,0,0,0,0,1,4,Unknown,-99,A communications mast was damaged in this attack.,0,"","","","","","","","","","","","","","","","","\"\"\"Man arrested over Bath mast 'arson'","\"\" BBC",July 25,"2014.\"","\"\"\"Bath transmitter is fixed after arson attack","\"\" BBC",January 3,"2013.\"","\"\"\"Man arrested over \"\"anarchist\"\" arson attacks on cars in St George"
201301080029,2013,1,8,"",0,"",603,8,Western Europe,Northern Ireland,Belfast,54.554345,-6.025275,1,0,The incident occurred in the Jasmine End Area.,"01/08/2013: A pipe bomb was discovered on a public street in Belfast city, Belfast district, Northern Ireland, United Kingdom. The device was brought to a Restorative Justice center, where it was safely defused without causing injury. No group claimed responsibility for the unsuccessful incident.",1,1,1,0,"","",0,0,0,3,Bombing/Explosion,"","","","",14,Private Citizens & Property,76,House/Apartment/Residence,Not Applicable,Twinbrook Estate,233,Northern Ireland,"","","","","","","","","","","","","","","","",Unknown,"","","","","","",0,"","",0,-99,0,0,"","","","","","","","","",6,Explosives,31,Pipe Bomb,"","","","","","","","","","","","","",0,0,0,0,0,0,0,"","","","",0,"","","","","","","","","","","","","","","","","\"\"\"Man brings viable bomb to office","\"\" BBC",January 9,"2013.\"","\"\"\"Pipe-bomb find in west Belfast","\"\" Belfast Telegraph Online",January 9,"2013.\"","\"\"\"Pipe   bomb discovered"
201301110028,2013,1,11,"",0,"",603,8,Western Europe,Northern Ireland,Belfast,54.607712,-5.95621,1,0,The incident occurred on Westlink between Broadway and Grosvenor roads.,"01/11/2013: A pipe bomb was discovered and defused in Belfast city, Belfast district, Northern Ireland, United Kingdom. No group claimed responsibility for the unsuccessful incident.",1,1,1,0,"","",0,0,0,3,Bombing/Explosion,"","","","",20,Unknown,"","",Unknown,Unknown,233,Northern Ireland,"","","","","","","","","","","","","","","","",Unknown,"","","","","","",0,"","",0,-99,0,0,"","","","","","","","","",6,Explosives,31,Pipe Bomb,"","","","","","","","","","","","","",0,0,0,0,0,0,0,"","","","",0,"","","","","","","","","","","","","","","","","\"\"\"Pipe bomb found in Westlink alert","\"\" UTV",January 11,"2013.\"","","",START Primary Collection,-9,-9
201301120013,2013,1,12,"",0,"",603,8,Western Europe,Northern Ireland,Belfast,54.607712,-5.95621,1,0,The incident occurred in the Donegall Avenue area.,"01/12/2013: An explosive device was discovered and defused in Belfast city, Belfast district, Northern Ireland, United Kingdom. No group claimed responsibility for the unsuccessful incident.",1,1,1,0,"","",0,0,0,3,Bombing/Explosion,"","","","",20,Unknown,"","",Unknown,Unknown,233,Northern Ireland,"","","","","","","","","","","","","","","","",Unknown,"","","","","","",0,"","",0,-99,0,0,"","","","","","","","","",6,Explosives,16,Unknown Explosive Type,"","","","","","","","","","","","","",0,0,0,0,0,0,0,"","","","",0,"","","","","","","","","","","","","","","","","\"\"\"Evacuations after device found;  news digestq","\"\" Belfast Telegraph",January 14,"2013.\"","\"\"\"Flags Crisis - Homes evacuated over bomb alert","\"\" The Irish News",January 14,"2013.\"",""
201301180010,2013,1,18,"",0,"",603,8,Western Europe,Northern Ireland,Strabane,54.819164,-7.467909,1,0,The inicident occurred in a residence in the city.,"01/18/2013: A letter bomb addressed to police Chief Inspector Andy Lemon was discovered and defused in Strabane city, Strabane, Northern Ireland, United Kingdom. No group claimed responsibility for the incident; however, police suspect dissident republicans.",1,1,1,0,"","",0,0,0,1,Assassination,"","","","",3,Police,25,Police Security Forces/Officers,Police Service of Northern Ireland (PSNI),Senior Officer: Andy Lemon,233,Northern Ireland,"","","","","","","","","","","","","","","","",Dissident Republicans,"","","","","","",1,"","",0,-99,0,0,"","","","","","","","","",6,Explosives,9,Letter Bomb,"","","","","","","","","","","","",A bomb concealed within a brown envelope and consisting of a battery pack and accelerant was to be used in the attack.,0,0,0,0,0,0,0,"","","","",0,"","","","","","","","","","","","","","","","","\"\"\"Letter bomb sent to Northern Ireland policeman","\"\" Associated Press Online",January 18,"2013.\"","\"\"\"Letter bomb sent to Northern Ireland policeman","\"\" FOXNews.com",January 18,"2013.\"","\"\"\"Letter bomb sent to PSNI chief"
201301250005,2013,1,25,"",0,"",603,8,Western Europe,Northern Ireland,Omagh,54.600305,-7.298402,1,0,The incident occurred near Kevlin Road In The Coolnagard Area,"01/25/2013: A police officer opened fire on two masked men attempting to attack him as he repaired his house in Coolnagard neighborhood, Omagh city, Omagh, Northern Ireland, United Kingdom. The next day, police officers found a viable pipe bomb that the attackers had left at the house. No group claimed responsibility for the incident; however, police suspect dissident republicans.",1,1,1,0,"","",0,0,0,3,Bombing/Explosion,"","","","",3,Police,25,Police Security Forces/Officers,Police Service of Northern Ireland (PSNI),Police Officer,233,Northern Ireland,"","","","","","","","","","","","","","","","",Dissident Republicans,"","","","","","",1,"","",0,-99,0,0,"","","","","","","","","",6,Explosives,31,Pipe Bomb,"","","","","","","","","","","","","",0,0,0,0,0,0,0,"","","","",0,"","","","","","","","","","","","","","","","","\"\"\"Police officer was 'targeted'","\"\" BBC",January 28,"2013.\"","\"\"\"PSNI looks for dissident link to   bomb attack","\"\" The Irish Times",January 28,"2013.\"","\"\"\"Police in the North search for gang who threw bomb at officers home"
201301260012,2013,1,26,"",0,"",603,8,Western Europe,Northern Ireland,Londonderry,55.011562,-7.312045,1,0,The incident occurred in the Bogside area,"01/26/2013: An Omega company van tasked with removing graffiti from walls was set on fire in Bogside neighborhood, Londonderry city, Londonderry district, Northern Ireland, United Kingdom. This was one of two Omega vans burned on January 26th in Derry, and one of three total. No group claimed responsibility for the incident; however, dissident republicans have been blamed.",1,1,1,0,"","",1,1,0,7,Facility/Infrastructure Attack,"","","","",1,Business,3,Bank/Commerce,Omega Property Maintenance,Omega Van,233,Northern Ireland,"","","","","","","","","","","","","","","","",Dissident Republicans,"","","","","","The specific motive is unknown; however, sources speculate that the attack, which targeted a van belonging to a company charged with graffiti removal, was due to the company's removal of graffiti supporting Dissidents.  Sources note the employees of the company had previously received threats for removing graffiti supporting Dissidents.",0,"","",0,-99,0,0,"","","","","","","","","",8,Incendiary,18,Arson/Fire,"","","","","","","","","","","","","",0,0,0,0,0,0,1,3,Minor (likely < $1 million),-99,A van was damaged in this attack.,0,"","","","","","","","","","","","","","","","","\"\"\"Northern News roundup: Tyrone arrests over Monaghan murder and threat against maintenance firm workers in Derry","\"\" Inside Ireland",January 30,"2013.\"","\"\"\"Arson attacks   on Omega vans condemned","\"\" Derry Journal",January 29,"2013.\"","\"\"\"Dissidents blamed for burning firm's vans"
201301260013,2013,1,26,"",0,"",603,8,Western Europe,Northern Ireland,Londonderry,55.011562,-7.312045,1,0,The incident occurred in the Ballymagroarty area.,"01/26/2013: An Omega company van tasked with removing graffiti from walls was set on fire in Ballymagroarty neighborhood, Londonderry city, Londonderry district, Northern Ireland, United Kingdom. This was one of two Omega vans burned on January 26th in Derry, and one of three total. No group claimed responsibility for the incident; however, dissident republicans have been blamed.",1,1,1,0,"","",1,1,0,7,Facility/Infrastructure Attack,"","","","",1,Business,3,Bank/Commerce,Omega Property Maintenance,Omega Van,233,Northern Ireland,"","","","","","","","","","","","","","","","",Dissident Republicans,"","","","","","The specific motive is unknown; however, sources speculate that the attack, which targeted a van belonging to a company charged with graffiti removal, was due to the company's removal of graffiti supporting Dissidents.  Sources note the employees of the company had previously received threats for removing graffiti supporting Dissidents.",0,"","",0,-99,0,0,"","","","","","","","","",8,Incendiary,18,Arson/Fire,"","","","","","","","","","","","","",0,0,0,0,0,0,1,3,Minor (likely < $1 million),-99,A van was damaged in this attack.,0,"","","","","","","","","","","","","","","","","\"\"\"Northern News roundup: Tyrone arrests over Monaghan murder and threat against maintenance firm workers in Derry","\"\" Inside Ireland",January 30,"2013.\"","\"\"\"Arson attacks   on Omega vans condemned","\"\" Derry Journal",January 29,"2013.\"","\"\"\"Dissidents blamed for burning firm's vans"
201301270015,2013,1,27,"",0,"",603,8,Western Europe,Northern Ireland,Londonderry,55.011562,-7.312045,1,0,The incident occurred in the Foyle Springs area,"01/27/2013: Assailants set an Omega Property Maintenance van on fire in the Foyle Springs neighborhood, Londonderry city, Londonderry district, Northern Ireland, United Kingdom. The Omega staff had been threatened when they attempted to remove political graffiti. There was no claim of responsibility for this attack; however, sources attribute the incident to dissident republicans.",1,1,1,0,"","",0,1,0,7,Facility/Infrastructure Attack,"","","","",1,Business,3,Bank/Commerce,Omega Property Maintenance,Omega Van,233,Northern Ireland,"","","","","","","","","","","","","","","","",Dissident Republicans,"","","","","","The specific motive is unknown; however, sources speculate that the attack, which targeted a van belonging to a company charged with graffiti removal, was due to the company's removal of graffiti supporting Dissidents.  Sources note that employees of the company had previously received threats for removing graffiti supporting Dissidents.",0,"","",0,-99,0,0,"","","","","","","","","",8,Incendiary,18,Arson/Fire,"","","","","","","","","","","","","",0,0,0,0,0,0,1,3,Minor (likely < $1 million),-99,A van was damaged in this attack.,0,"","","","","","","","","","","","","","","",This was the third of three such attacks. The other incidents are 201301260012 and 201301260013.,"\"\"\"Northern News roundup: Tyrone arrests over Monaghan murder and threat against maintenance firm workers in Derry","\"\" Inside Ireland",January 30,"2013.\"","\"\"\"Arson attacks   on Omega vans condemned","\"\" Derry Journal",January 29,"2013.\"","\"\"\"Dissidents blamed for burning firm's vans"
201301290001,2013,1,29,"",0,"",603,8,Western Europe,Northern Ireland,Belfast,54.607712,-5.95621,1,0,The incident occurred near a community centre in the Greater Whitewell Road area.,"01/29/2013: An explosive device was discovered near the Greater Whitewell Community Surgery in Belfast city, Belfast district, Northern Ireland, United Kingdom. The device was successfully defused by an Army bomb disposal unit. Oglaigh na hEireann claimed responsibility for the attack.",1,1,1,0,"","",0,0,0,3,Bombing/Explosion,"","","","",14,Private Citizens & Property,79,"Public Area (garden, parking lot, garage, beach, public building, camp)",Greater Whitewell Community Surgery,Community Center,233,Northern Ireland,"","","","","","","","","","","","","","","","",Oglaigh na hEireann,"","","","","","",0,"","",0,-99,0,1,10,Unknown,"","","","","","","",6,Explosives,31,Pipe Bomb,"","","","","","","","","","","","","",0,0,0,0,0,0,0,"","","","",0,"","","","","","","","","","","","","","","","","\"\"\"Pipe bomb 'bid to murder police'","\"\" Belfast Telegraph Online",January 31,"2013.\"","\"\"\"Evacuations after pipe bomb alert","\"\" Irish Independent",January 29,"2013.\"","\"\"\"Viable Pipe Bomb Removed In North Belfast"
201301300001,2013,1,30,"",0,"",603,8,Western Europe,Northern Ireland,Larne,54.855103,-5.811254,1,0,The incident occurred at a residence on Church Way,"01/30/2013: Assailants threw an explosive device into a civilian residence in Larne town, Larne district, Northern Ireland, United Kingdom. A man was in the residence at the time, but he was unhurt. There was no claim of responsibility for this attack.",1,1,1,0,"","",0,1,0,7,Facility/Infrastructure Attack,"","","","",14,Private Citizens & Property,76,House/Apartment/Residence,Not Applicable,Residence,233,Northern Ireland,"","","","","","","","","","","","","","","","",Unknown,"","","","","","",0,"","",0,-99,0,0,"","","","","","","","","",8,Incendiary,19,Molotov Cocktail/Petrol Bomb,"","","","","","","","","","","","",A petrol bomb was used in the attack.,0,0,0,0,0,0,1,3,Minor (likely < $1 million),-99,The windows to a home and a mirror were damaged in this attack.,0,"","","","","","","","","","","","","","","","","\"\"\"House petrol bombed in Larne attack","\"\" BBC",January 31,"2013.\"","\"\"\"Petrol-  bomb attack   on house","\"\" The Irish News",February 1,"2013.\"","\"\"\"Dickson condemns Larne petrol bomb attack"
201301300002,2013,1,30,"",0,"",603,8,Western Europe,Northern Ireland,Belfast,54.607712,-5.95621,1,0,The incident occurred at the intersection of Oldpark road and Rosapenna street.,"01/30/2013: Assailants threw an explosive device at a Police Service of Northern Ireland (PSNI) vehicle in Belfast city, Belfast district, Northern Ireland, United Kingdom. The device did not detonate and was successfully defused by PSNI officers the next day. There was no claim of responsibility for this attack; however, sources indicate that dissident republicans were involved.",1,1,1,0,"","",0,0,0,3,Bombing/Explosion,"","","","",3,Police,23,Police Patrol (including vehicles and convoys),Police Service of Northern Ireland (PSNI),Armored Patrol,233,Northern Ireland,"","","","","","","","","","","","","","","","",Dissident Republicans,"","","","","","",0,"","",0,-99,0,0,"","","","","","","","","",6,Explosives,31,Pipe Bomb,"","","","","","","","","","","","","",0,0,0,0,0,0,0,"","","","",0,"","","","","","","","","","","","","","","","","\"\"\"Bomb 'reckless bid to kill police'","\"\" BBC",January 31,"2013.\"","\"\"\"Pipe bomb 'was police murder bid' - Video","\"\" UTV",January 31,"2013.\"","\"\"\"Pipe bomb 'bid to murder police'"
