201304150058,2013,4,15,"",0,"",110,10,Middle East & North Africa,South,Sidon,33.550434,35.370964,1,1,Incident occurred at Ain Hilweh Palestinian refugee camp,"04/15/2013: An explosive device detonated at the Ain el-Hilweh Palestinian refugee camp near Sidon city, South governorate, Lebanon. No one was injured in the blast. No group claimed responsibility for the incident.",1,1,1,0,"","",0,1,0,3,Bombing/Explosion,"","","","",14,Private Citizens & Property,65,Refugee (including Camps/IDP/Asylum Seekers),Ain al-Hilweh Camp,Refugee Camp,155,West Bank and Gaza Strip,"","","","","","","","","","","","","","","","",Unknown,"","","","","","",0,"","",0,-99,0,0,"","","","","","","","","",6,Explosives,16,Unknown Explosive Type,"","","","","","","","","","","","",A small unspecified bomb was used in the attack.,0,0,0,0,0,0,0,"","","","",0,"","","","","","","","","","","","","","","","","\"\"\"Blast at Palestinian refugee camp",no casualties,"\"\" Lebanon Daily Star",April 15,"2013.\"","","",START Primary Collection,-9
201304180027,2013,4,18,"",0,"",110,10,Middle East & North Africa,North,Qalamoun,34.386194,35.782764,1,1,"","04/18/2013: Three bombs were discovered and defused on a highway in Qalamoun area, North governorate, Lebanon. Initial reports suggested the devices were intended for the Lebanese Prime Minister, Najib Miqati; however, this notion was later refuted. No group claimed responsibility for the incident.",1,1,1,0,"","",0,0,0,3,Bombing/Explosion,"","","","",20,Unknown,"","",Unknown,Unknown,110,Lebanon,"","","","","","","","","","","","","","","","",Unknown,"","","","","","",0,"","",0,-99,0,0,"","","","","","","","","",6,Explosives,16,Unknown Explosive Type,"","","","","","","","","","","","",Three bombs without detonators were found in a plastic container at a construction site.,0,0,0,0,0,0,0,"","","","",0,"","","","","","","","","","","","","","","","","\"\"\"Lebanon closes northern highway after finding bomb","\"\" Xinhua News Agency",April 18,"2013.\"","\"\"\"Aide says bombs found along highway did not target Lebanese premier","\"\" BBC Monitoring Middle East - Political Supplied by BBC Worldwide Monitoring",April 19,"2013.\"",""
201304200013,2013,4,20,"",0,"",110,10,Middle East & North Africa,Beqaa,Hermel,34.397052,36.387171,1,0,The incident occurred in the Dawra area.,"04/20/2013: Two rockets were launched by assailants into the Dawra neighborhood of Hermel town, Beqaa governorate, Lebanon. No injuries were reported. No group claimed responsibility for the incident.",1,1,1,1,5,State Actors,0,1,0,3,Bombing/Explosion,"","","","",14,Private Citizens & Property,75,Village/City/Town/Suburb,Not Applicable,Dawra Neighborhood,110,Lebanon,"","","","","","","","","","","","","","","","",Unknown,"","","","","","",0,"","",0,-99,0,0,"","","","","","","","","",6,Explosives,11,"Projectile (rockets, mortars, RPGs, etc.)","","","","","","","","","","","","",Two 107-mm rockets were used in the attack.,0,0,0,0,0,0,0,"","","","",0,"","","","","","","","","","","","","","","",There is doubt that this incident meets terrorism-related criteria. Sources suspected that the rocket attack may have been carried out by the Syrian Army.,"\"\"\"Shells from Syria violence crash in Lebanon: watchdog","\"\" Agence France Presse -- English",April 20,"2013.\"","\"\"\"Schools shut as tension rises in Hermel","\"\" Lebanon Daily Star",April 22,"2013.\"","\"\"\"Rockets from Syria hit Lebanon's Al-Qasr"
201304210016,2013,4,21,"",0,"",110,10,Middle East & North Africa,Beqaa,Qusair,34.480383,36.43939,1,0,"","04/21/2013: A rocket fired from Syria landed near Imam Zainul Abideen Orphanage in al-Qusair town, Beqaa governorate, Lebanon. No injuries or casualties were reported. A Syrian rebel took responsibility for the incident in a YouTube video.",1,1,1,0,"","",0,1,0,3,Bombing/Explosion,"","","","",14,Private Citizens & Property,76,House/Apartment/Residence,Imam Zainul Abideen Orphanage,Orphanage,110,Lebanon,"","","","","","","","","","","","","","","","",Unknown,"","","","","","",0,"","",0,-99,0,1,7,"Posted to website, blog, etc.","","","","","","","",6,Explosives,11,"Projectile (rockets, mortars, RPGs, etc.)","","","","","","","","","","","","",A rocket was used in the attack.,0,0,0,0,0,0,1,4,Unknown,-99,The orphanage was damaged in this attack.,0,"","","","","","","","","","","","","","","","","\"\"\"Rockets target town of Hermel for first time","\"\" The Daily Star Online",April 21,"2013.\"","\"\"\"Syrian rebels step up rocket attacks",two hit Hermel,"\"\" The Daily Star Online",April 21,"2013.\""
201304220011,2013,4,22,"",1,"",110,10,Middle East & North Africa,North,Tripoli,34.437213,35.830479,1,0,"","04/22/2013: Assailants abducted an Alawite man in Tripoli city, North governorate, Lebanon. The assailants stripped the man to the waist, tied a rope to his neck, and paraded him through the city. No group claimed responsibility for the incident.",1,1,1,0,"","",0,1,0,6,Hostage Taking (Kidnapping),"","","","",14,Private Citizens & Property,69,Religion Identified,Not Applicable,Alawite Civilian,110,Lebanon,"","","","","","","","","","","","","","","","",Unknown,"","","","","","\"The specific motive is unknown; however, sources indicate that the assailants wrote on the victim's chest, \"\"I am an Alawite shabiha.\"\" Moreover",sources speculate that the incident is part of a larger trend of communal violence in Lebanon,"which stems from the civil conflict in neighboring Syria.\"",0,"","",0,-99,0,0,"","","","","","","","","",9,Melee,24,Rope or Other Strangling Device,"","","","","","","","","","","","","","",0,0,"",0,0,0,"","","","",1,1,0,"",-99,"","",0,"","","","","",7,Unknown,-99,"","\"\"\"Syrian rockets again fall on Lebanese territory","\"\" Chambersburg Public Opinion",April 23,"2013.\"","","",START Primary Collection
201304230019,2013,4,23,"",0,"",110,10,Middle East & North Africa,Beqaa,Hermel,34.397052,36.387171,1,0,"","04/23/2013: A rocket fell near a hospital in the city of Hermel, Beqaa governorate, Lebanon. This was one of two rockets that fell in Hermel on this day. There were no casualties reported, and no group claimed responsibility for this attack.",1,1,1,0,"","",1,1,0,3,Bombing/Explosion,"","","","",1,Business,6,Medical/Pharmaceutical,Assi Hospital,Hospital,110,Lebanon,14,Private Citizens & Property,76,House/Apartment/Residence,Not Applicable,Residence,110,Lebanon,"","","","","","","","",Unknown,"","","","","","The specific motive is unknown; however, sources speculate that the incident is part of a larger trend of sectarian violence between Sunni and Shiite Muslims in Lebanon as result of the civil war in neighboring Syria. Moreover, sources indicate that, prior to the incident, two Lebanese Salafi clerics called for jihad in Syria and urged their followers to protect Sunni Muslim communities from pro-government Shiite forces, such as Hezbollah.",0,"","",0,-99,0,0,"","","","","","","","","",6,Explosives,11,"Projectile (rockets, mortars, RPGs, etc.)","","","","","","","","","","","","",A rocket was used in the attack.,0,0,0,0,0,0,0,"","","","",0,"","","","","","","","","","","","","","","","","\"\"\"Syrian rockets hit Lebanon as tensions rise","\"\" The Hindu",April 23,"2013.\"","\"\"\"Rockets fired from Syria hit Lebanon's Hermel","\"\" Lebanon Daily Star",April 23,"2013.\"","\"\"\"Syrian rockets hit Bekaa valley city in Lebanon"
201304230056,2013,4,23,"",0,"",110,10,Middle East & North Africa,Beqaa,Hermel,34.397052,36.387171,1,0,"","04/23/2013: A rocket fired from Syria struck an under-construction house belonging to a police officer in Hermel city, Beqaa governorate, Lebanon. There were no reported casualties resulting from the attack. This was one of two similar rocket attacks in the city within a short period of time. No group claimed responsibility for the incidents.",1,1,1,0,"","",1,1,0,3,Bombing/Explosion,"","","","",3,Police,25,Police Security Forces/Officers,Internal Security Force (ISF),Officer: Mehdi Shamas,110,Lebanon,"","","","","","","","","","","","","","","","",Unknown,"","","","","","",0,"","",0,-99,0,0,"","","","","","","","","",6,Explosives,11,"Projectile (rockets, mortars, RPGs, etc.)","","","","","","","","","","","","",A rocket was used in the attack.,0,0,0,0,0,0,1,3,Minor (likely < $1 million),-99,An under-construction house was damaged in this attack.,0,"","","","","","","","","","","","","","","","","\"\"\"Rockets fired from Syria hit Lebanon's Hermel","\"\" Lebanon Daily Star",April 23,"2013.\"","","",START Primary Collection,-9,-9
201305020004,2013,5,2,"",0,"",110,10,Middle East & North Africa,South,Ain al-Hilweh,33.542004,35.381153,1,0,The incident occurred in the Ain al-Hilweh refugee camp.,"05/02/2013: A grenade was thrown into the Ain al-Hilweh Palestinian refugee camp in Sidon city, South governorate, Lebanon. Four people, including two children, were injured in the attack. No group claimed responsibility for the incident.",1,1,1,0,"","",0,1,0,3,Bombing/Explosion,"","","","",14,Private Citizens & Property,65,Refugee (including Camps/IDP/Asylum Seekers),Ain al-Hilweh Camp,Refugees,110,Lebanon,"","","","","","","","","","","","","","","","",Unknown,"","","","","","",0,"","",0,-99,0,0,"","","","","","","","","",6,Explosives,7,Grenade,"","","","","","","","","","","","","",0,0,0,4,0,0,0,"","","","",0,"","","","","","","","","","","","","","","","","\"\"\"Grenade explosion   wounds four at Lebanese refugee camp","\"\" BBC Monitoring Middle East - Political Supplied by BBC Worldwide Monitoring",May 3,"2013.\"","\"\"\"'4 injured in grenade attack in S Lebanon'","\"\" IRIB World Service",May 3,"2013.\"",""
201305020017,2013,5,1,"",0,"",110,10,Middle East & North Africa,North,Tripoli,34.437921,35.831296,1,0,"","05/01/2013: Assailants fired shots into the office of Khaled al-Mustafa, the director of the Office of Syrian Refugee Affairs, in Tripoli city, North governorate, Lebanon. Al-Mustafa was not injured in the attack, although his office was damaged in the shooting. No group claimed responsibility for the attack; however, al-Mustafa claimed he was attacked due to his opposition to the Syrian government.",1,1,1,0,"","",0,1,0,2,Armed Assault,"","","","",2,Government (General),15,Politician or Political Party Movement/Meeting/Rally,Office of Syrian Refugee Affairs,Office of Director: Khaled al-Mustafa,110,Lebanon,"","","","","","","","","","","","","","","","",Unknown,"","","","","","",0,"","",0,-99,0,0,"","","","","","","","","",5,Firearms,3,Handgun,"","","","","","","","","","","","",A pistol equipped with a silencer was used in the attack.,0,0,0,0,0,0,1,3,Minor (likely < $1 million),-99,An office was damaged in this attack.,0,"","","","","","","","","","","","","","","","","\"\"\"Syrian activist in Lebanon says survived murder attempt","\"\" BBC Monitoring Middle East - Political Supplied by BBC Worldwide Monitoring",May 3,"2013.\"","","",START Primary Collection,-9,-9
201305190050,2013,5,19,"",0,"",110,10,Middle East & North Africa,Beqaa,Hermel,34.397052,36.387171,1,0,"","05/19/2013: A rocket launched from Syrian territory hit a cement factory in Hermel town, Beqaa governorate, Lebanon. No injuries were reported. No group claimed responsibility for the incident.",1,1,1,0,"","",0,1,0,3,Bombing/Explosion,"","","","",1,Business,5,Industrial/Textiles/Factory,Unknown,Cement Factory,110,Lebanon,"","","","","","","","","","","","","","","","",Unknown,"","","","","","The specific motive is unknown; however, sources speculated that the incident may have been in response to Hezbollah's intervention in Syria.",0,"","",0,-99,0,0,"","","","","","","","","",6,Explosives,11,"Projectile (rockets, mortars, RPGs, etc.)","","","","","","","","","","","","",Rockets were used in the attack.,0,0,0,0,0,0,1,3,Minor (likely < $1 million),-99,A cement factory was damaged in this attack.,0,"","","","","","","","","","","","","","","","","\"\"\"Rockets from Syria strike Hermel","\"\" Lebanon Daily Star",May 19,"2013.\"","","",START Primary Collection,-9,-9
201305200051,2013,5,20,"",0,"",110,10,Middle East & North Africa,North,Tripoli,34.437956,35.83113,1,0,"","05/20/2013: Assailants opened fire on a military force in Tripoli city, North governorate, Lebanon. One soldier was killed and four others were wounded in the attack. No group claimed responsibility for the incident.",1,1,0,1,1,Insurgency/Guerilla Action,0,1,0,2,Armed Assault,"","","","",4,Military,27,Military Barracks/Base/Headquarters/Checkpost,Lebanese Army,Base,110,Lebanon,"","","","","","","","","","","","","","","","",Unknown,"","","","","","The specific motive is unknown; however, sources speculated that the incident may have been in response to Hezbollah's intervention in Syria.",0,"","",0,-99,0,0,"","","","","","","","","",5,Firearms,5,Unknown Gun Type,"","","","","","","","","","","","","",1,0,0,4,0,0,0,"","","","",0,"","","","","","","","","","","","","","","","","\"\"\"North Lebanon death toll rises","\"\" Lebanon Daily Star",May 20,"2013.\"","\"\"\"Clashes renew in n. Lebanon",soldier killed,"\"\" Lebanon Daily Star",May 20,"2013.\""
201305240018,2013,5,24,2013-05-24 00:00:00,0,"",110,10,Middle East & North Africa,North,Tripoli,34.437956,35.83113,1,0,"","05/24/2013: Assailants launched a rocket and opened fire at the Naji Center in Tripoli city, North governorate, Lebanon. No injuries were reported in the attack, but property was damaged. No group claimed responsibility for the attack.",1,1,1,0,"","",0,1,0,2,Armed Assault,"","","","",14,Private Citizens & Property,75,Village/City/Town/Suburb,Not Applicable,Naji Center,110,Lebanon,"","","","","","","","","","","","","","","","",Unknown,"","","","","","",0,"","",0,-99,0,0,"","","","","","","","","",6,Explosives,11,"Projectile (rockets, mortars, RPGs, etc.)",5,Firearms,4,Rifle/Shotgun (non-automatic),"","","","","","","","",A rocket and a rifle was used in the attack.,0,0,0,0,0,0,1,4,Unknown,-99,Unknown property was damaged in this attack.,0,"","","","","","","","","","","","","","","","","\"\"\"Xinhua Middle East news summary at 2200 GMT",May 24,"\"\" CHINAdaily",May 24,"2013.\"","","",START Primary Collection,-9
201305260014,2013,5,26,"",0,"",110,10,Middle East & North Africa,Mount Lebanon,Mount Lebanon,33.857969,35.519713,1,1,"The incident occurred in the Shiyah district, on the outskirts of Beirut.","05/26/2013: A rocket hit a car dealership near Mar Mikhael church in Beirut city, Beirut governorate, Lebanon. Four Syrian workers were wounded in the explosion. This was one of two rockets to land in the area at the same time. No group has claimed responsibility for the incident.",1,1,1,0,"","",1,1,0,3,Bombing/Explosion,"","","","",1,Business,7,Retail/Grocery/Bakery,Unknown,Car Dealership,110,Lebanon,"","","","","","","","","","","","","","","","",Unknown,"","","","","","The specific motive is unknown; however, sources speculated that the attack was in response to a speech one day earlier by Hezbollah leader Hassan Nasrallah on the group's participation in the current conflict in Syria.",0,"","",0,-99,0,0,"","","","","","","","","",6,Explosives,11,"Projectile (rockets, mortars, RPGs, etc.)","","","","","","","","","","","","",A rocket was used in the attack.,0,0,0,4,0,0,-9,"","","",It is unknown if any property was damaged in this attack.,0,"","","","","","","","","","","","","","","","","\"\"\"Charbel says authorities have 'some leads' in Beirut rocket attack","\"\" The Daily Star Online",May 28,"2013.\"","\"\"\"Rockets in Lebanon capital signal Syrian spillover","\"\" Richmond Times Dispatch",May 27,"2013.\"","\"\"\"Shiyah residents try to make sense of attacks"
201305260015,2013,5,26,"",0,"",110,10,Middle East & North Africa,Mount Lebanon,Chiayah,33.856289,35.497362,1,0,The incident occurred in the Maroun Misk area.,"05/26/2013: A rocket hit a residential building in Maroun Misk neighborhood, Chiayah area, Mount Lebanon governorate, Lebanon. This was the second of two rockets to land in the area at the same time. No group has claimed responsibility for the incident.",1,1,1,0,"","",1,1,0,3,Bombing/Explosion,"","","","",14,Private Citizens & Property,76,House/Apartment/Residence,Not Applicable,Residential Building,110,Lebanon,"","","","","","","","","","","","","","","","",Unknown,"","","","","","The specific motive is unknown; however, sources speculated that the attack was in response to a speech one day earlier by Hezbollah leader Hassan Nasrallah on the group's participation in the current conflict in Syria.",0,"","",0,-99,0,0,"","","","","","","","","",6,Explosives,11,"Projectile (rockets, mortars, RPGs, etc.)","","","","","","","","","","","","",A rocket was used in the attack.,0,0,0,0,0,0,1,3,Minor (likely < $1 million),-99,An apartment building was damaged in this attack.,0,"","","","","","","","","","","","","","","","Casualty numbers for this incident conflict across sources. Following GTD protocol, the majority estimates are reported here.","\"\"\"Charbel says authorities have 'some leads' in Beirut rocket attack","\"\" The Daily Star Online",May 28,"2013.\"","\"\"\"Shiyah residents try to make sense of attacks","\"\" Lebanon Daily Star",May 26,"2013.\"","\"\"\"Rockets hit south Beirut after Hezbollah vows Syria victory"
201305260016,2013,5,26,"",0,"",110,10,Middle East & North Africa,Beqaa,Hermel,34.397052,36.387171,1,0,"","05/26/2013: Two rockets landed in a residential area in Hermel town, Beqaa governorate, Lebanon. Property was damaged but no casualties were reported in the attack. No group has claimed responsibility for the incident.",1,1,1,0,"","",0,1,0,3,Bombing/Explosion,"","","","",14,Private Citizens & Property,75,Village/City/Town/Suburb,Not Applicable,Private Property,110,Lebanon,"","","","","","","","","","","","","","","","",Unknown,"","","","","","",0,"","",0,-99,0,0,"","","","","","","","","",6,Explosives,11,"Projectile (rockets, mortars, RPGs, etc.)","","","","","","","","","","","","",Two rockets were used in the attack.,0,0,0,0,0,0,1,4,Unknown,-99,Unspecified property was damaged in this attack.,0,"","","","","","","","","","","","","","","","","\"\"\"Hezbollah Beirut heartland hit as Syria war rages","\"\" Financial Express Bangladesh",May 26,"2013.\"","","",START Primary Collection,-9,-9
201305270012,2013,5,27,"",0,"",110,10,Middle East & North Africa,Beqaa,Hermel,34.397052,36.387171,1,0,"","05/27/2013: A rocket launched from Syria hit a residential house in Hermel village, Beqaa governorate, Lebanon. One person was killed and another person was wounded in the attack. No group claimed responsibility for the incident.",1,1,1,0,"","",0,1,0,3,Bombing/Explosion,"","","","",14,Private Citizens & Property,76,House/Apartment/Residence,Not Applicable,Residence,110,Lebanon,"","","","","","","","","","","","","","","","",Unknown,"","","","","","The specific motive is unknown; however, local witnesses stated that they believed they were targeted because of Hezbollah's presence in and around the village.",0,"","",0,-99,0,0,"","","","","","","","","",6,Explosives,11,"Projectile (rockets, mortars, RPGs, etc.)","","","","","","","","","","","","",A rocket was used in the attack.,1,0,0,1,0,0,1,3,Minor (likely < $1 million),-99,A civilian home was damaged in this attack.,0,"","","","","","","","","","","","","","","","","\"\"\"Syria rockets hit Hermel",four wounded,"\"\" Lebanon Daily Star",May 28,"2013.\"","\"\"\"Four rockets hit village near the Syrian border","\"\" Sydney Morning Herald",May 28,"2013.\""
201305270046,2013,5,27,"",1,"",110,10,Middle East & North Africa,Beqaa,Arsal,34.184605,36.424011,1,1,"","05/27/2013: Assailants abducted a Syrian man from a Red Cross ambulance in Arsal village, Beqaa governorate, Lebanon. The Red Cross had been receiving demands that they halt transportation of Syrian citizens to Lebanese villages for treatment.The outcome of the kidnapping is unknown. No group claimed responsibility for the incident.",1,1,1,0,"","",0,1,0,6,Hostage Taking (Kidnapping),"","","","",12,NGO,62,International NGO,International Committee of the Red Cross (ICRC),Ambulance,422,International,14,Private Citizens & Property,68,Named Civilian,Not Applicable,Civilian: Adnan Alsalkini,200,Syria,"","","","","","","","",Unknown,"","","","","","",0,"","",0,-99,0,0,"","","","","","","","","",5,Firearms,5,Unknown Gun Type,"","","","","","","","","","","","",Unspecified weapons and are dark rimmed Jeep Grand Cherokee were used in the attack.,"",0,0,"",0,0,0,"","","","",1,1,0,"",-99,"","",0,"","","","","",7,Unknown,-99,Assailants were members of the Jaafar clan.,"\"\"\"Injured Syrian abducted by members of Jaafar clan","\"\" Lebanon Daily Star",May 28,"2013.\"","","",START Primary Collection,-9,-9
201305280009,2013,5,28,"",0,"",110,10,Middle East & North Africa,Beqaa,Arsal,34.184605,36.424011,1,1,Incident occurred in Bekaa Valley near the Syrian border,"05/28/2013: Gunmen attacked a Lebanese army checkpoint in Arsal town, Beqaa governorate, Lebanon. Three soldiers were killed in the attack. No group claimed responsibility for the incident; however, authorities claimed that the assailants had retreated to Syria.",1,1,0,1,1,Insurgency/Guerilla Action,0,1,0,2,Armed Assault,"","","","",4,Military,36,Military Checkpoint,Lebanese Armed Forces (LAF),Checkpoint,110,Lebanon,"","","","","","","","","","","","","","","","",Unknown,"","","","","","",0,"","",0,-99,0,0,"","","","","","","","","",5,Firearms,5,Unknown Gun Type,"","","","","","","","","","","","","",3,0,0,0,0,0,0,"","","","",0,"","","","","","","","","","","","","","","","","\"\"\"Three Lebanese soldiers killed by gunmen -military source","\"\" Reuters",May 28,"2013.\"","\"\"\"3 Lebanese soldiers killed near border with Syria","\"\" Xinhua News Agency",May 28,"2013.\"","\"\"\"Attack on Lebanese Army checkpoint in Arsal kills 3 soldiers"
201305280011,2013,5,28,"",0,"",110,10,Middle East & North Africa,Beqaa,Hermel,34.397052,36.387171,1,1,"","05/28/2013: A rocket hit a residential area on the outskirts on Hermel town, Beqaa governorate, Lebanon. Three Lebanese citizens were injured in the attack. No group claimed responsibility for the incident.",1,1,1,0,"","",0,1,0,3,Bombing/Explosion,"","","","",14,Private Citizens & Property,76,House/Apartment/Residence,Not Applicable,Residential Area,110,Lebanon,"","","","","","","","","","","","","","","","",Unknown,"","","","","","",0,"","",0,-99,0,0,"","","","","","","","","",6,Explosives,11,"Projectile (rockets, mortars, RPGs, etc.)","","","","","","","","","","","","",A rocket was used in the attack.,0,0,0,3,0,0,1,3,Minor (likely < $1 million),-99,A civilian home was damaged in this attack.,0,"","","","","","","","","","","","","","","","","\"\"\"3 injured by Syrian rockets in eastern Lebanon","\"\" Xinhua News Agency",May 28,"2013.\"","\"\"\"Syria rockets slam into Hermel","\"\" NOW News",May 28,"2013.\"","\"\"\"Several injured in Syrian rocket attacks on Lebanon"
201305290031,2013,5,29,"",0,"",110,10,Middle East & North Africa,Beqaa,Hermel,34.397052,36.387171,1,0,The incident occurred in the Dawra area.,"05/29/2013: Assailants launched rockets at Dora neighborhood, Hermel city, Beqaa governorate, Lebanon. The targeted location was a stronghold of Hezbollah. No casualties were reported. This was one of two coordinated rocket attacks on the city. No group claimed responsibility for the incident.",1,1,1,0,"","",1,1,0,3,Bombing/Explosion,"","","","",17,Terrorists/Non-State Militia,93,Terrorist,Hizballah,Stronghold,110,Lebanon,"","","","","","","","","","","","","","","","",Unknown,"","","","","","The specific motive is unknown; however, sources stated that Hermel city was targeted by Syrian rebels in response to Hezbollah's involvement in the Syrian civil war.",0,"","",0,-99,0,0,"","","","","","","","","",6,Explosives,11,"Projectile (rockets, mortars, RPGs, etc.)","","","","","","","","","","","","",Two rockets were used in the attack.,0,0,0,0,0,0,1,3,Minor (likely < $1 million),-99,An unknown number of vehicles and shops were damaged in this attack.,0,"","","","","","","","","","","","","","","","","\"\"\"Rockets from Syria hit north-east Lebanon","\"\" Lebanon Daily Star",May 29,"2013.\"","\"\"\"Rocket barrage hits north as Sleiman tours Arsal","\"\" The Daily Star Online",May 29,"2013.\"","\"\"\"Three   rockets   hit north-eastern Lebanon from Syria"
201305290032,2013,5,29,"",0,"",110,10,Middle East & North Africa,Beqaa,Hermel,34.397052,36.387171,1,0,The incident occurred in the Moroh district.,"05/29/2013: Assailants launched rockets at Moroh district, Hermel city, Beqaa governorate, Lebanon. The targeted location is a stronghold of Hezbollah. One person was wounded in this attack. This was one of two coordinated rocket attacks on the city. No group claimed responsibility for the incident.",1,1,1,0,"","",1,1,0,3,Bombing/Explosion,"","","","",17,Terrorists/Non-State Militia,93,Terrorist,Hizballah,Stronghold,110,Lebanon,"","","","","","","","","","","","","","","","",Unknown,"","","","","","The specific motive is unknown; however, sources stated that Hermel city was targeted by Syrian rebels in response to Hezbollah's involvement in the Syrian civil war.",0,"","",0,-99,0,0,"","","","","","","","","",6,Explosives,11,"Projectile (rockets, mortars, RPGs, etc.)","","","","","","","","","","","","",A rocket was used in the attack.,0,0,0,1,0,0,0,"","","","",0,"","","","","","","","","","","","","","","","","\"\"\"Rockets from Syria hit north-east Lebanon","\"\" Lebanon Daily Star",May 29,"2013.\"","\"\"\"Rocket barrage hits north as Sleiman tours Arsal","\"\" The Daily Star Online",May 29,"2013.\"","\"\"\"Three   rockets   hit north-eastern Lebanon from Syria"
