201310280032,2013,10,28,"",0,"",110,10,Middle East & North Africa,North,Tripoli,34.438094,35.830837,1,0,"","10/28/2013: Assailants opened fire on a Lebanese Army patrol in Tripoli city, North governorate, Lebanon. At least three soldiers were injured in the blast. No group claimed responsibility for the attack.",1,1,0,1,1,Insurgency/Guerilla Action,0,1,0,2,Armed Assault,"","","","",4,Military,29,Military Unit/Patrol/Convoy,Lebanese Army,Patrol,110,Lebanon,"","","","","","","","","","","","","","","","",Unknown,"","","","","","The specific motive is unknown; however, sources suspected that the attack on the army was designed to deter a planned deployment into the city.",0,"","",0,-99,0,0,"","","","","","","","","",5,Firearms,5,Unknown Gun Type,"","","","","","","","","","","","",Firearms were used in the attack.,0,0,0,3,0,0,0,"","","","",0,"","","","","","","","","","","","","","","","","\"\"\"Xinhua: Gunmen Attack Lebanon Army Deployment In Tripoli",3 Wounded,"\"\" Xinhua",October 28,"2013.\"","","",START Primary Collection,-9
201310310011,2013,10,31,"",0,"",110,10,Middle East & North Africa,Beqaa,Jlala,33.816079,35.860327,1,1,"","10/31/2013: An explosive device planted near an Lebanese Army Intelligence checkpost detonated on the Chtaura-Jlala highway in Bekaa governorate, Lebanon. There were no reported casualties and one vehicle was slightly damaged. No group claimed responsibility; however, authorities arrested two individuals.",1,1,0,1,1,Insurgency/Guerilla Action,0,1,0,3,Bombing/Explosion,"","","","",4,Military,27,Military Barracks/Base/Headquarters/Checkpost,Lebanese Army,Intelligence Checkpost,110,Lebanon,"","","","","","","","","","","","","","","","",Unknown,"","","","","","",0,"","",0,-99,0,0,"","","","","","","","","",6,Explosives,12,Remote Trigger,"","","","","","","","","","","","",A remote detonated roadside bomb weighing about 300 grams was used in the attack.,0,0,0,0,0,0,1,3,Minor (likely < $1 million),-99,A vehicle was damaged in this attack.,0,"","","","","","","","","","","","","","","","","\"\"\"Blast near army post in Lebanon",two Syrians detained,"\"\" Agence France Presse -- English",October 31,"2013.\"","\"\"\"Blast near army post in Lebanon...","\"\" Qatar Peninsula",November 1,"2013.\""
201311020033,2013,11,2,"",0,"",110,10,Middle East & North Africa,North,Tripoli,34.439258,35.831683,1,0,The incident occurred in the Jabal Mohsen neighborhood of the city.,"11/02/2013: Assailants attacked Alawite citizens in Zahriyeh neighborhood in Tripoli city, North governorate, Lebanon. The gunmen forced the victims off of the bus and proceeded to beat and shoot them. At least six people were injured in the attack. No group claimed responsibility for the incident; however, police arrested one Syrian national in connection with the attack.",1,1,1,0,"","",0,1,0,2,Armed Assault,"","","","",14,Private Citizens & Property,69,Religion Identified,Not Applicable,Alawite Civilians,110,Lebanon,"","","","","","","","","","","","","","","","",Unknown,"","","","","","The specific motive is unknown; however, sources speculated that the victims, who were Alawite citizens, may have been targeted as part of a larger trend of sectarian violence between Lebanon's Sunni and Shiite communities.",0,"","",0,1,1,0,"","","","","","","","","",5,Firearms,5,Unknown Gun Type,9,Melee,22,"Hands, Feet, Fists","","","","","","","","","",0,0,0,6,0,0,0,"","","","",1,6,0,1,"","","",0,"","","","","",2,Hostage(s) released by perpetrators,6,"Casualty numbers for this attack vary across sources. Follow GTD protocol, the most recent estimates are reported here.","\"\"\"19 Alawites wounded in wave of north Lebanon attacks","\"\" Agence France Presse -- English",November 2,"2013.\"","\"\"\"Four arrested over sectarian attack in north Lebanon","\"\" Lebanon Daily Star",November 3,"2013.\"","\"\"\"Alawites in n. Lebanon assaulted in sectarian attack"
201311120002,2013,11,12,"",0,"",110,10,Middle East & North Africa,North,Tripoli,34.439089,35.830829,1,0,"","11/12/2013: Two gunmen attacked a Sunni sheikh and member of Islamic Action Front with ties to Hezbollah in Tripoli city, North governorate, Lebanon. Sheikh Saad Al-Deen Giyyeh, also a prominent Bashar Assad supporter, was killed in the attack. No group claimed responsibility for the incident.",1,1,1,0,"","",0,1,0,1,Assassination,"","","","",15,Religious Figures/Institutions,85,Religious Figure,Unknown,Pro-Hezbollah Sunni Sheikh: Saad Al-Deen Giyyeh,110,Lebanon,"","","","","","","","","","","","","","","","",Unknown,"","","","","","",0,"","",0,2,0,0,"","","","","","","","","",5,Firearms,5,Unknown Gun Type,"","","","","","","","","","","","","",1,0,0,0,0,0,0,"","","","",0,"","","","","","","","","","","","","","","","","\"\"\"Pro-Hezbollah shaikh killed in Lebanon","\"\" Gulf News",November 12,"2013.\"","\"\"\"Sunni cleric assassinated in northern Lebanon","\"\" Kazakhstan News",November 12,"2013.\"","\"\"\"Xinhua: Sunni Cleric Assassinated In Northern Lebanon"
201311190001,2013,11,19,"",0,"",110,10,Middle East & North Africa,Mount Lebanon,Bir Hassan,33.861984,35.489986,1,1,The incident occurred at the Iranian Embassy.,"11/19/2013: A suicide bomber detonated outside of the Iranian embassy in Beirut city, Mount Lebanon governorate, Lebanon. This was one of two explosions outside the Iranian Embassy on this day; this first attack was intended to draw a crowd. In addition to the two bombers, at least 26 people were killed, including an Iranian cultural attache, and 151 people were injured across both blasts. Abdullah Azzam Brigades claimed responsibility for the incidents, stating that there would be more attacks unless Iran ceased operations in Syria.",1,1,1,0,"","",1,1,1,3,Bombing/Explosion,"","","","",7,Government (Diplomatic),46,Embassy/Consulate,Iranian Ministry of Foreign Affairs,Embassy,94,Iran,14,Private Citizens & Property,67,Unnamed Civilian/Unspecified,Not Applicable,Civilians,110,Lebanon,"","","","","","","","",Abdullah Azzam Brigades,"","","","","","In a statement claiming responsibility for the attack, the Abdullah Azzam Brigades, stated attacks would continue unless Iran withdraws its forces from Syria.",0,"","",0,2,0,1,7,"Posted to website, blog, etc.","","","","","","","",6,Explosives,13,Suicide (carried bodily by human being),"","","","","","","","","","","","",An explosive belt was used in the attack.,14,0,1,76,0,0,1,3,Minor (likely < $1 million),-99,Unspecified property was damaged in this attack.,0,"","","","","","","","","","","","","","","","Casualty numbers for this attack represent an equal division of a cumulative total of killed and wounded across incidents 201311190001 and 201311190002. Casualty numbers for this incident conflict across sources. Following GTD protocol, the most recent reliable estimates are reported here.","\"\"\"Explosions target Iran embassy in Beirut","\"\" Al Jazeera",November 19,"2013.\"","\"\"\"Two blasts near Iranian embassy in Beirut","\"\" Reuters",November 19,"2013.\"","\"\"\"Iran lauds Lebanon in dealing with terror attack"
201311190002,2013,11,19,"",0,"",110,10,Middle East & North Africa,Mount Lebanon,Bir Hassan,33.861984,35.489986,1,1,The incident occurred at the Iranian Embassy.,"11/19/2013: An suicide bomber in an explosives-laden vehicle detonated outside of the Iranian embassy in Beirut city, Beirut governorate, Lebanon. This was one of two explosions outside the Iranian Embassy on this day; this second attack targeted responders to an earlier bombing. In addition to the two bombers, at least 26 people were killed, including an Iranian cultural attache, and 151 people were injured across both blasts. Abdullah Azzam Brigades claimed responsibility for the incidents, stating that there would be more attacks unless Iran ceased operations in Syria.",1,1,1,0,"","",1,1,1,3,Bombing/Explosion,"","","","",7,Government (Diplomatic),46,Embassy/Consulate,Iranian Ministry of Foreign Affairs,Embassy,94,Iran,14,Private Citizens & Property,67,Unnamed Civilian/Unspecified,Not Applicable,Civilians,110,Lebanon,"","","","","","","","",Abdullah Azzam Brigades,"","","","","","In a statement claiming responsibility for the attack, the Abdullah Azzam Brigades, stated attacks would continue unless Iran withdraws its forces from Syria.",0,"","",0,2,0,1,7,"Posted to website, blog, etc.","","","","","","","",6,Explosives,15,Vehicle,"","","","","","","","","","","","",An explosives- laden vehicle was detonated by its driver in the attack.,14,0,1,75,0,0,1,3,Minor (likely < $1 million),-99,Unspecified property was damaged in this attack.,0,"","","","","","","","","","","","","","","","Casualty numbers for this attack represent an equal division of a cumulative total of killed and wounded across incidents 201311190001 and 201311190002. Casualty numbers for this incident conflict across sources. Following GTD protocol, the most recent reliable estimates are reported here.","\"\"\"Explosions target Iran embassy in Beirut","\"\" Al Jazeera",November 19,"2013.\"","\"\"\"Two blasts near Iranian embassy in Beirut","\"\" Reuters",November 19,"2013.\"","\"\"\"Iran lauds Lebanon in dealing with terror attack"
201311220001,2013,11,22,"",0,"",110,10,Middle East & North Africa,Beqaa,Maqna,34.076828,36.207649,1,1,The incident took place between Maqna and Younin towns.,"11/22/2013: Security forces discovered and defused an explosives-laden vehicle near Maqna town, Beqaa governorate, Lebanon. No group claimed responsibility for the incident.",1,1,1,1,4,Lack of Intentionality,0,0,0,3,Bombing/Explosion,"","","","",20,Unknown,"","",Unknown,Unknown,110,Lebanon,"","","","","","","","","","","","","","","","",Unknown,"","","","","","The specific motive is unknown; however, sources speculated that the attack, which targeted a stronghold of the Shiite group Hezbollah, is part of a larger trend of sectarian violence between Lebanon's minority Sunni and Shiite communities.",0,"","",0,-99,0,0,"","","","","","","","","",6,Explosives,15,Vehicle,"","","","","","","","","","","","","An explosives- laden vehicle containing 500kg of TNT, C4, and two remote controlled mortar rounds were used in the attack.",0,0,0,0,0,0,0,"","","","",0,"","","","","","","","","","","","","","","",There is doubt that this incident meets terrorism-related criteria. Sources were unsure whether the car carrying explosives was transporting the goods or if it was intended to detonate as a car bomb.,"\"\"\"Lebanon army   defuses   car   bomb   in Hezbollah bastion","\"\" Agence France Presse -- English",November 22,"2013.\"","\"\"\"Lebanese authorities   defuse   771 pounds of   explosives",mortars in car,"\"\" UPI",November 22,"2013.\""
201311230009,2013,11,23,"",0,"",110,10,Middle East & North Africa,North,Tripoli,34.436654,35.850851,1,0,Incident occurred in the Qobbe neighborhood of the city.,"11/23/2013: Assailants threw three grenades at the Hmaydan Abu Younes Coffee Shop in Qobbe neighborhood, Tripoli city, North governorate, Lebanon. At least four people were injured in the blasts. No group claimed responsibility for the incident.",1,1,1,0,"","",0,1,0,3,Bombing/Explosion,"","","","",1,Business,2,Restaurant/Bar/Caf�,Hmaydan Abu Younes Coffee Shop,Coffee Shop,110,Lebanon,"","","","","","","","","","","","","","","","",Unknown,"","","","","","",0,"","",0,-99,0,0,"","","","","","","","","",6,Explosives,7,Grenade,"","","","","","","","","","","","",Three grenades were used in the attack.,0,0,0,4,0,0,1,3,Minor (likely < $1 million),-99,The coffee shop was damaged in this attack.,0,"","","","","","","","","","","","","","","","","\"\"\"Tripoli attacks leave several wounded","\"\" Lebanon Daily Star",November 24,"2013.\"","\"\"\"Four Lebanese wounded in   grenade attack","\"\" Kuwait News Agency (KUNA)",November 24,"2013.\"","\"\"\"Four men injured by grenade explosion in Tripoli"
201311230063,2013,11,23,"",0,"",110,10,Middle East & North Africa,North,Tripoli,34.43789,35.832915,1,0,The incident occurred in the Tripoli Souks neighborhood of the city.,"11/23/2013: Assailants opened fire on Shia merchants in Old Serail neighborhood, Tripoli city, North governorate, Lebanon. At least two people were wounded in the assault. No group claimed responsibility for the incident.",1,1,1,0,"","",0,1,0,2,Armed Assault,"","","","",14,Private Citizens & Property,77,Laborer (General)/Occupation Identified,Not Applicable,"Merchants: Ali Anan, Naim Ragda",110,Lebanon,"","","","","","","","","","","","","","","","",Unknown,"","","","","","",0,"","",0,2,0,0,"","","","","","","","","",5,Firearms,5,Unknown Gun Type,"","","","","","","","","","","","",Unknown firearms were used in the attack.,0,0,0,2,0,0,0,"","","","",0,"","","","","","","","","","","","","","","","","\"\"\"Six people wounded in Tripoli attacks over weekend; Six people wounded in Tripoli attacks","\"\" Daily Star",November 25,"2013.\"","\"\"\"Several Injured in Separate Tripoli Attacks",Miqati Calls for 'Strictly' Prosecuting the Perpetrators,"\"\" Naharnet",November 23,"2013.\""
201311290030,2013,11,29,"",0,"",110,10,Middle East & North Africa,Beqaa,Zahle,33.844769,35.902874,1,0,"","11/29/2013: An explosive device was discovered and defused near the Kadri hotel in Zahle city, Beqaa governorate, Lebanon. No group claimed responsibility for the incident.",1,1,1,0,"","",0,0,0,3,Bombing/Explosion,"","","","",1,Business,8,Hotel/Resort,Kadri Hotel,Hotel,110,Lebanon,"","","","","","","","","","","","","","","","",Unknown,"","","","","","",0,"","",0,-99,0,0,"","","","","","","","","",6,Explosives,7,Grenade,"","","","","","","","","","","","",A grenade was used in the attack.,0,0,0,0,0,0,0,"","","","",0,"","","","","","","","","","","","","","","","","\"\"\"Lebanese Army defuses grenade on Zahle highway","\"\" Lebanon Daily Star",November 29,"2013.\"","\"\"\"Lebanese army   defuses bomb   in eastern town","\"\" BBC Monitoring Middle East - Political Supplied by BBC Worldwide Monitoring",November 29,"2013.\"","\"\"\"Lebanese army defuses bomb in eastern town"
201312010039,2013,12,1,"",0,"",110,10,Middle East & North Africa,South,Ain al-Hilweh,33.542004,35.381153,1,0,The incident occurred in the Ain al-Hilweh refugee camp.,"12/01/2013: A gunman fired on Fatah members in Ain Al-Hilweh Palestinian refugee camp, Sidon city, South governorate, Lebanon. One member was killed and one other was wounded in the attack. No group has claimed responsibility for the incident; however, sources attributed the attack to Jund al-Sham for Tawhid and Jihad.",1,1,1,0,"","",0,1,0,2,Armed Assault,"","","","",22,Violent Political Party,109,Party Official/Candidate/Other Personnel,Fatah,Members,155,West Bank and Gaza Strip,"","","","","","","","","","","","","","","","",Jund al-Sham for Tawhid and Jihad,"","","","","","The specific motive is unknown; however, sources speculated that the incident was an attempt to stir conflict in the largest Palestinian refugee camp in Lebanon. Sources also noted that the attack came just a few days after a clash between Fatah and Jund al-Sham for Tawhid and Jihad at the camp.",0,"","",0,-99,0,0,"","","","","","","","","",5,Firearms,5,Unknown Gun Type,"","","","","","","","","","","","","",1,0,0,1,0,0,0,"","","","",0,"","","","","","","","","","","","","","","","Casualty numbers for this incident conflict across sources. Following GTD protocol, the most recent reliable estimates are reported here.","\"\"\"Ain al-Hilweh reels from killing of Fatah member","\"\" Lebanon Daily Star",December 2,"2013.\"","\"\"\"Fatah member dead in Ain al-Hilweh attack","\"\" Lebanon Daily Star",December 1,"2013.\"","\"\"\"Ain al-Hilweh tensions high after shooting"
201312030048,2013,12,3,"",0,"",110,10,Middle East & North Africa,South,Ain al-Hilweh,33.542004,35.381153,1,0,The incident occurred in the Ain al-Hilweh refugee camp.,"12/03/2013: An explosive device detonated by the funeral procession of a Fatah member in Ain el-Hilweh camp, Sidon district, South governorate, Lebanon. Five people were injured in the explosion. No group claimed responsibility for the attack.",1,1,1,0,"","",0,1,0,3,Bombing/Explosion,"","","","",14,Private Citizens & Property,78,"Procession/Gathering (funeral, wedding, birthday, religious)",Not Applicable,Funeral Convoy,422,International,"","","","","","","","","","","","","","","","",Unknown,"","","","","","",0,"","",0,-99,0,0,"","","","","","","","","",6,Explosives,12,Remote Trigger,"","","","","","","","","","","","",A 120-mm remote-controlled mortar bomb was used in the attack.,0,0,0,5,0,0,-9,"","","",It is unknown if any property was damaged in this attack.,0,"","","","","","","","","","","","","","","","Casualty numbers for this incident conflict across sources. Following GTD protocol, the most recent reliable estimates are reported here.","\"\"\"Ain al-Hilweh camp at a standstill after attacks","\"\" Lebanon Daily Star",December 4,"2013.\"","\"\"\"Four wounded in Lebanon refugee camp blast","\"\" Lebanon Daily Star",December 3,"2013.\"","\"\"\"Al-Lino"
201312060054,2013,12,6,"",0,"",110,10,Middle East & North Africa,North,Tripoli,34.438094,35.830837,1,0,"","12/06/2013: Assailants attacked a pro-Syrian television crew in Tripoli city, North governorate, Lebanon. The military responded to the attack; at least one soldier was killed and six people were injured in the ensuing clash. No group claimed responsibility for the incident.",1,1,1,0,"","",0,1,0,2,Armed Assault,"","","","",10,Journalists & Media,55,Television Journalist/Staff/Facility,Unknown,Television Crew,110,Lebanon,"","","","","","","","","","","","","","","","",Unknown,"","","","","","",0,"","",0,-99,0,0,"","","","","","","","","",5,Firearms,5,Unknown Gun Type,"","","","","","","","","","","","",Unknown firearms were used in the attack.,1,0,"",6,0,"",0,"","","","",0,"","","","","","","","","","","","","","","","","\"\"\"Soldier killed in northern Lebanon clashes",six wounded,"\"\" Trend News Agency",December 6,"2013.\"","","",START Primary Collection,-9
201312150051,2013,12,15,"",0,"",110,10,Middle East & North Africa,South,Sidon,33.550434,35.370964,1,0,The incident occurred in the Awwali neighborhood of the city.,"12/15/2013: A suicide bomber detonated a hand grenade at a Lebanese Army checkpoint in the Awwali area of Sidon city, South governorate, Lebanon. The assailant was killed and at least two soldiers were wounded as a result of the blast. This was one of two suicide attacks on checkpoints in or near Sidon on this date. No group claimed responsibility for the incidents.",1,1,0,1,1,Insurgency/Guerilla Action,1,1,1,3,Bombing/Explosion,"","","","",4,Military,36,Military Checkpoint,Lebanese Army,Checkpoint,110,Lebanon,"","","","","","","","","","","","","","","","",Unknown,"","","","","","",0,"","",0,3,0,0,"","","","","","","","","",6,Explosives,13,Suicide (carried bodily by human being),"","","","","","","","","","","","",A hand grenade was used in the attack.,1,0,1,2,0,0,0,"","","","",0,"","","","","","","","","","","","","","","","Casualty numbers for this incident conflict across sources. Following GTD protocol, the most recent reliable estimates are reported here.","\"\"\"Lebanon: Army attacked by suicide bombers for first time","\"\" Lebanon Wire",December 18,"2013.\"","\"\"\"Phalange Party Warns of 'Culture of Suicide Bombers",' Urges Controlling Border,Refugee Camps' Entrances,"\"\" Naharnet",December 16
201312150052,2013,12,15,"",0,"",110,10,Middle East & North Africa,South,Majdelyoun,33.561429,35.410688,1,0,"The incident occurred in the city, which is 5km from Sidon.","12/15/2013: Three suicide bombers detonated at a Lebanese Army checkpoint in the Majdelyoun suburb of Sidon city, South governorate, Lebanon. The assailants and one soldier were killed as a result of the blast. This was one of two suicide attacks on checkpoints in or near Sidon on this date. No group claimed responsibility for the incidents.",1,1,0,1,1,Insurgency/Guerilla Action,1,1,1,3,Bombing/Explosion,"","","","",4,Military,36,Military Checkpoint,Lebanese Army,Checkpoint,110,Lebanon,"","","","","","","","","","","","","","","","",Unknown,"","","","","","",0,"","",0,3,0,0,"","","","","","","","","",6,Explosives,13,Suicide (carried bodily by human being),"","","","","","","","","","","","",A suicide bomber carrying a hand grenade was used in the attack.,4,0,3,0,0,0,0,"","","","",0,"","","","","","","","","","","","","","","","","\"\"\"Lebanon: Army attacked by suicide bombers for first time","\"\" Lebanon Wire",December 18,"2013.\"","\"\"\"Phalange Party Warns of 'Culture of Suicide Bombers",' Urges Controlling Border,Refugee Camps' Entrances,"\"\" Naharnet",December 16
