201409300018,2014,9,30,2014-09-30 00:00:00,0,"",107,7,Central Asia,Issyk Kul,Balykchy,42.460422,76.176146,1,0,"","09/30/2014: An explosive device was discovered and defused in Balykchy town, Issyk Kul province, Kyrgyzstan. No group claimed responsibility for the incident.",1,1,1,0,"","",0,0,0,3,Bombing/Explosion,"","","","",20,Unknown,"","",Unknown,Unknown,107,Kyrgyzstan,"","","","","","","","","","","","","","","","",Unknown,"","","","","","",0,"","",0,-99,0,0,"","","","","","","","","",6,Explosives,8,Landmine,"","","","","","","","","","","","",A roadside mine (defused) was used in the attack.,0,0,0,0,0,0,0,"","","","",0,"","","","","","","","","","","","","","","","","\"\"\"Explosive device discovered in Issyk-Kul province","\"\" 24.kg",September 30,"2014.\"","","",START Primary Collection,-9,-9
201504030084,2015,4,3,"",0,"",107,7,Central Asia,Bishkek,Bishkek,42.874722,74.612222,1,0,"","04/03/2015: Assailants threw three incendiary devices at the office of Labrys, a Lesbian, Gay, Bisexual, Transgender, and Queer (LGBTQ) rights organization, in Bishkek city, Bishkek oblast, Kyrgyzstan. The office failed to catch on fire and no one was injured in the attack. No group claimed responsibility for the incident.",1,1,1,0,"","",0,0,0,7,Facility/Infrastructure Attack,"","","","",12,NGO,61,Domestic NGO,Labrys,Office,107,Kyrgyzstan,"","","","","","","","","","","","","","","","",Unknown,"","","","","","The specific motive is unknown; however, sources suspected that the attack was related to a recent bill on homosexual activity.",0,"","",0,-99,0,0,"","","","","","","","","",8,Incendiary,19,Molotov Cocktail/Petrol Bomb,"","","","","","","","","","","","",Three Molotov cocktails were used in the attack.,0,0,0,0,0,0,0,"","","","",0,"","","","","","","","","","","","","","","","","\"\"\"Unknown people throw Molotov cocktails at Kyrgyz gay rights organization","\"\" 24.kg",April 10,"2015.\"","\"\"\"Kyrgyzstan: Arson attack on the office of LGBTI organisation Labrys","\"\" AWID",April 27,"2015.\"",""
201511190055,2015,11,19,"",0,"",107,7,Central Asia,Bishkek,Bishkek,42.872324,74.585796,1,0,"","11/19/2015: Assailants opened fire on Aktilek Abduvaliyev in Bishkek, Kyrgyzstan. Abduvaliyev, a police officer, was killed in the attack. No group claimed responsibility for the incident; however, authorities attributed the attack to Muslim fundamentalists.",1,1,1,0,"","",0,1,0,2,Armed Assault,"","","","",3,Police,25,Police Security Forces/Officers,Kyrgyzsta National Police,Officer: Aktilek Abduvaliyev,107,Kyrgyzstan,"","","","","","","","","","","","","","","","",Muslim extremists,"","","","","","",0,"","",0,2,0,0,"","","","","","","","","",5,Firearms,3,Handgun,"","","","","","","","","","","","",A 9-mm Makarov pistol was used in the attack.,1,0,0,0,0,0,0,"","","","",0,"","","","","","","","","","","","","","","","","\"\"\"Kyrgyzstan Says It Has Been Hit by \"\"Wave of Terrorism\"\"","\"\" EurasiaNet",December 11,"2015.\"","","",START Primary Collection,-9,-9
201511260057,2015,11,26,"",0,"",107,7,Central Asia,Bishkek,Bishkek,42.816259,74.63668,1,0,The incident occurred in the 12th Microdistrict of the city,"11/26/2015: Assailants stabbed Kadyr Malikov in the 12th Microdistrict of Bishkek, Kyrgyzstan. Malikov, a renowned theologian and vocal opponent of extremism, was injured in the assault. No group claimed responsibility for the incident; however, sources attributed the attack to Jihadi-Inspired extremists.",1,1,1,0,"","",0,1,0,2,Armed Assault,"","","","",15,Religious Figures/Institutions,85,Religious Figure,Unknown,Theologian: Kadyr Malikov,107,Kyrgyzstan,"","","","","","","","","","","","","","","","",Jihadi-inspired extremists,"","","","","","The specific motive is unknown; however, sources noted that the assailants supported the ideology of the Islamic State of Iraq and the Levant (ISIL).",0,"","",1,2,2,0,"","","","","","","","","",9,Melee,23,Knife or Other Sharp Object,9,Melee,27,Unknown Weapon Type,"","","","","","","","",A knife and a taser were used in the attack.,0,0,0,1,0,0,0,"","","","",0,"","","","","","","","","","","","","","","","","\"\"\"Islamist Jailed For Life Over Attack On Kyrgyz Theologian","\"\" Radio Free Europe / Radio Liberty",June 9,"2016.\"","\"\"\"Kyrgyz Religion Expert Gets Knifed",Cries Islamic State,"\"\" EurasiaNet",November 26,"2015.\""
201602190072,2016,2,19,"",0,"",107,7,Central Asia,Bishkek,Bishkek,42.881778,74.522733,1,0,The incident occurred in the Kudaybergen market area of Bishkek.,"02/19/2016: An assailant attacked Turat Akimov in Kudaybergen market area, Bishkek city, Bishkek region, Kyrgyzstan. Akimov, a journalist, was injured in the attack. No group claimed responsibility for the incident.",1,1,1,1,5,State Actors,0,0,0,1,Assassination,"","","","",10,Journalists & Media,53,Newspaper Journalist/Staff/Facility,Dengi i Vlast,Editor: Turat Akimov,107,Kyrgyzstan,"","","","","","","","","","","","","","","","",Unknown,"","","","","","The specific motive is unknown; however, sources suspected that the attack was related to the victim's work as a journalist.",0,"","",0,1,0,0,"","","","","","","","","",9,Melee,21,Blunt Object,"","","","","","","","","","","","",An armature was used in the attack.,0,0,0,1,0,0,0,"","","","",0,"","","","","","","","","","","","","","","",There is doubt that this incident meets terrorism-related criteria. A source suspected that the Interior Minister of Kyrgyzstan may have carried out the attack.,"\"\"\"Editor of local magazine attacked",victim suspects Interior Minister of assassination attempt,"\"\" Trend News Agency",February 22,"2016.\"","\"\"\"Chief Editor of \"\"Money and Power\"\" newspaper Turat Akimov assaulted","\"\" 24.kg",February 20,"2016.\""
201607290051,2016,7,29,"",0,"",107,7,Central Asia,Chuy,Orto Sai,42.805036,74.591735,1,0,"","07/29/2016: An explosive device attached to the vehicle of a prosecution officer detonated in Orto Sai, Chuy, Kyrgyzstan. The victim was wounded in the blast. No group claimed responsibility for the incident.",1,1,1,0,"","",0,1,0,3,Bombing/Explosion,"","","","",2,Government (General),14,Judge/Attorney/Court,Government of Kyrgyzstan,Vehicle of Prosecutor,107,Kyrgyzstan,"","","","","","","","","","","","","","","","",Unknown,"","","","","","",0,"","",0,-99,0,0,"","","","","","","","","",6,Explosives,16,Unknown Explosive Type,"","","","","","","","","","","","","",0,0,0,1,0,0,1,3,Minor (likely < $1 million),-99,A vehicle and other unspecified property were damaged in this attack.,0,"","","","","","","","","","","","","","","","","\"\"\"Car of presumably prosecutorial worker exploded outside Bishkek","\"\" Trend News Agency",July 29,"2016.\"","","",START Primary Collection,-9,-9
201608300004,2016,8,30,"",0,"",107,7,Central Asia,Bishkek,Bishkek,42.874621,74.569762,1,0,"","08/30/2016: A suicide bomber detonated an explosives-laden vehicle at the front gate of the Ministry of Foreign Affairs of the People's Republic of China (MOFA) Embassy in Bishkek, Kyrgyzstan. Aside from the death of the bomber, at least three other people were wounded in the blast. No group claimed responsibility; however, sources attributed the attack to the Turkestan Islamic Party.",1,1,1,0,"","",0,1,1,3,Bombing/Explosion,"","","","",7,Government (Diplomatic),46,Embassy/Consulate,Chinese Ministry of Foreign Affairs,Embassy,44,China,"","","","","","","","","","","","","","","","",Turkestan Islamic Party,"","","","","","The specific motive is unknown; however, sources noted that the attack occurred on the eve of Kyrgyzstan's 25th anniversary of the country's independence.",0,"","",0,1,0,0,"","","","","","","","","",6,Explosives,15,Vehicle,"","","","","","","","","","","","",An explosives-laden Mitsubishi Delica van with power equivalent to 100 kilograms of TNT was used in the attack.,1,0,1,3,0,0,1,3,Minor (likely < $1 million),-99,"A gate, one embassy building, and an unspecified number of buildings and houses were damaged in this attack.",0,"","","","","","","","","","","","","","","","Casualty numbers for this incident conflict across sources. Following GTD protocol, the most recent reliable estimates are reported here.","\"\"\"Bishkek - Three wounded in suicide blast at Chinese embassy in Kyrgyzstan: official","\"\" AFP (North European Service)",August 30,"2016.\"","\"\"\"Suicide bomber targets Chinese embassy in Kyrgyzstan","\"\" CNN",August 30,"2016.\"","\"\"\"1ST LEAD"
201609200037,2016,9,20,"",0,"",107,7,Central Asia,Bishkek,Bishkek,42.874722,74.612222,1,0,"","09/20/2016: Security forces discovered and defused explosive devices at an intersection in Bishkek, Kyrgyzstan. No group claimed responsibility for the attempted attack.",0,1,1,1,2,Other Crime Type,0,0,0,3,Bombing/Explosion,"","","","",20,Unknown,"","",Unknown,Unknown,107,Kyrgyzstan,"","","","","","","","","","","","","","","","",Unknown,"","","","","","",0,"","",0,-99,0,0,"","","","","","","","","",6,Explosives,16,Unknown Explosive Type,"","","","","","","","","","","","",Two explosive devices hidden in black plastic bags were used in the attack.,0,0,0,0,0,0,0,"","","","",0,"","","","","","","","","","","","","","","","There is doubt that this incident meets terrorism-related criteria. Given the context of Kyrgyzstan, it is possible that the attack was carried out by an organized crime group.","\"\"\"Bomb technicians disarm improvised explosive devices in Bishkek","\"\" Trend News Agency",September 21,"2016.\"","","",START Primary Collection,-9,-9
201701040045,2017,1,4,"",0,"",107,7,Central Asia,Bishkek,Bishkek,42.874722,74.612222,1,0,The incident occurred at Ataturk park.,"01/04/2017: An explosive device detonated at Ataturk Amusement Park in Bishkek, Kyrgyzstan. There were no reported casualties in the blast. No group claimed responsibility for the attack.",1,1,1,0,"","",0,1,0,3,Bombing/Explosion,"","","","",1,Business,11,Entertainment/Cultural/Stadium/Casino,Ataturk Amusement Park,Amusement Park,107,Kyrgyzstan,"","","","","","","","","","","","","","","","",Unknown,"","","","","","",0,"","",0,3,1,0,"","","","","","","","","",6,Explosives,16,Unknown Explosive Type,"","","","","","","","","","","","","",0,0,0,0,0,0,0,"","","","",0,"","","","","","","","","","","","","","","","","\"\"\"Suspected Ataturk park bomber detained",manhunt for 2 other suspected bombers underway,"\"\" Trend News Agency",January 12,"2017.\"","","",START Primary Collection,-9
201705150037,2017,5,15,"",0,"",107,7,Central Asia,Jalal-Abad,Jalal-Abad,40.933154,72.981488,1,0,"","05/15/2017: Assailants set fire to the Mekenim Kyrgyzstan political party office in Jalal-Abad, Kyrgyzstan. There were no reported casualties. No group claimed responsibility for the incident.",1,1,1,0,"","",0,1,0,7,Facility/Infrastructure Attack,"","","","",14,Private Citizens & Property,84,Political Party Member/Rally,Mekenim Kyrgyzstan,Political Party Office,107,Kyrgyzstan,"","","","","","","","","","","","","","","","",Unknown,"","","","","","The specific motive is unknown; however, sources noted that Dzhalal-Abad city council elections were scheduled for May 28, 2017.",0,"","",0,-99,0,0,"","","","","","","","","",8,Incendiary,18,Arson/Fire,"","","","","","","","","","","","","",0,0,0,0,0,0,1,3,Minor (likely < $1 million),-99,An office was damaged in this attack.,0,"","","","","","","","","","","","","","","","","\"\"\"Kyrgyz party office set on fire ahead of local elections","\"\" 24.kg",May 16,"2017.\"","","",START Primary Collection,-9,-9
