201708080013,2017,8,8,"",0,"",183,11,Sub-Saharan Africa,KwaZulu-Natal,Umdoni,-30.323135,30.689139,2,0,"","08/08/2017: Assailants opened fire on Ntokozo Maphumulo in Umdoni, KwaZulu-Natal, South Africa. Maphumulo, a former African National Congress (ANC) councilor, was killed in the assault. No group claimed responsibility for the attack.",1,1,1,0,"","",0,1,0,1,Assassination,"","","","",2,Government (General),15,Politician or Political Party Movement/Meeting/Rally,African National Congress (ANC),Former Councillor: Ntokozo Maphumulo,183,South Africa,"","","","","","","","","","","","","","","","",Unknown,"","","","","","",0,"","",0,-99,0,0,"","","","","","","","","",5,Firearms,5,Unknown Gun Type,"","","","","","","","","","","","","",1,0,0,0,0,0,0,"","","","",0,"","","","","","","","","","","","","","","","","\"\"\"Family of slain former ANC councillor unsure of shooting motive","\"\" Eye Witness News",August 10,"2017.\"","\"\"\"Former Umdoni ANC councillor murdered in driveway","\"\" South Coast Herald",August 17,"2017.\"",""
201708220025,2017,8,22,"",0,"",183,11,Sub-Saharan Africa,KwaZulu-Natal,Mooi River,-29.209447,30.002762,1,0,"","08/22/2017: Assailants attempted to set fire to Mayor Xolani Duma's house in Mooi River, KwaZulu-Natal, South Africa. An unknown number of people, including Duma, were injured in the attack. No group claimed responsibility for the incident.",1,1,1,0,"","",0,0,0,1,Assassination,"","","","",2,Government (General),15,Politician or Political Party Movement/Meeting/Rally,Mpofana Municipality,Home of Mayor: Xolani Duma,183,South Africa,"","","","","","","","","","","","","","","","",Unknown,"","","","","","",0,"","",0,-99,0,0,"","","","","","","","","",8,Incendiary,18,Arson/Fire,"","","","","","","","","","","","","",0,0,0,"",0,0,1,3,Minor (likely < $1 million),-99,A house was damaged in this attack.,0,"","","","","","","","","","","","","","","","","\"\"\"Councillor shot in back; Fourth ANC official killed this year","\"\" Daily News (South Africa)",August 31,"2017.\"","\"\"\"KwaZulu-Natal mayor's house torched","\"\" Times LIVE South Africa",August 22,"2017.\"","\"\"\"KZN mayor fears for life following arson attack"
201708300021,2017,8,30,"",0,"",183,11,Sub-Saharan Africa,KwaZulu-Natal,Wentworth,-29.926938,30.996278,1,0,The incident occurred in the Durban district.,"08/30/2017: Security forces discovered and safely detonated a parcel bomb at a post office in Wentworth, KwaZulu-Natal, South Africa. No group claimed responsibility for the incident.",1,1,1,0,"","",0,0,0,3,Bombing/Explosion,"","","","",2,Government (General),18,"Government Personnel (excluding police, military)",Austerville Post Office,Post Office Workers,183,South Africa,"","","","","","","","","","","","","","","","",Unknown,"","","","","","",0,"","",0,-99,0,0,"","","","","","","","","",6,Explosives,9,Letter Bomb,"","","","","","","","","","","","",A remote-controlled explosives-laden parcel utilizing a mobile phone as a triggering mechanism was used in the attack.,0,0,0,0,0,0,0,"","","","",0,"","","","","","","","","","","","","","","","","\"\"\"JUST IN: Bomb scare rattles Wentworth post office","\"\" Southlands Sun",August 31,"2017.\"","\"\"\"Bomb squad blows up suspicious package at Wentworth post office","\"\" IOL",August 31,"2017.\"",""
201708300024,2017,8,30,"",0,"",183,11,Sub-Saharan Africa,KwaZulu-Natal,Camperdown,-29.728017,30.532154,1,0,The incident occurred in the Mkhambathini district.,"08/30/2017: Assailants opened fire on Kwazi Mkhize in Camperdown, Mkhambathini, KwaZulu-Natal, South Africa. Mkhize, an African National Congress (ANC) councilor, was killed in the attack. No group claimed responsibility for the incident.",1,1,1,0,"","",0,1,0,1,Assassination,"","","","",2,Government (General),15,Politician or Political Party Movement/Meeting/Rally,African National Congress (ANC),Councilor: Kwazi Mkhize,183,South Africa,"","","","","","","","","","","","","","","","",Unknown,"","","","","","",0,"","",0,1,0,0,"","","","","","","","","",5,Firearms,5,Unknown Gun Type,"","","","","","","","","","","","","",1,0,0,0,0,0,0,"","","","",0,"","","","","","","","","","","","","","","","","\"\"\"ANC councillor gunned down in KZN in latest political killing","\"\" Mail & Guardian Online",August 31,"2017.\"","\"\"\"Councillor shot in back; Fourth ANC official killed this year","\"\" Daily News (South Africa)",August 31,"2017.\"","\"\"\"ANC mourns death of councillor in uMkhambathini"
201709120016,2017,9,12,"",0,"",183,11,Sub-Saharan Africa,North West,Rustenburg,-25.666667,27.25,1,1,"","09/12/2017: Assailants shot and killed an Association of Mineworkers and Construction Union (AMCU) branch treasurer outside a mine near Rustenburg, North West, South Africa. No group claimed responsibility for the attack.",1,1,1,0,"","",0,1,0,2,Armed Assault,"","","","",14,Private Citizens & Property,82,Labor Union Related,Association of Mineworkers and Construction Union (AMCU),Branch Treasurer,183,South Africa,"","","","","","","","","","","","","","","","",Unknown,"","","","","","",0,"","",0,-99,0,0,"","","","","","","","","",5,Firearms,5,Unknown Gun Type,"","","","","","","","","","","","","",1,0,0,0,0,0,0,"","","","",0,"","","","","","","","","","","","","","","","","\"\"\"AMCU official shot dead near Rustenburg mine","\"\" Metro Tell.co.za",September 12,"2017.\"","\"\"\"AMCU official shot dead near Rustenburg mine","\"\" ZoBo.co.za",September 12,"2017.\"",""
201709240036,2017,9,24,"",0,"",183,11,Sub-Saharan Africa,KwaZulu-Natal,Ulundi,-28.309097,31.420501,1,0,The incident occurred in the Zululand district.,"09/24/2017: Assailants threw a petrol bomb at the house of Wilson Ntshangase in Ulundi, Zululand, KwaZulu-Natal, South Africa. Ntshangase, the mayor of Ulundi, was not harmed in the attack. No group claimed responsibility for the incident.",1,1,1,0,"","",0,0,0,1,Assassination,"","","","",2,Government (General),15,Politician or Political Party Movement/Meeting/Rally,Governmorent of Ulundi,Residence of Mayor: Wilson Ntshangase,183,South Africa,"","","","","","","","","","","","","","","","",Unknown,"","","","","","",0,"","",0,-99,0,0,"","","","","","","","","",8,Incendiary,19,Molotov Cocktail/Petrol Bomb,"","","","","","","","","","","","",A petrol bomb was used in the attack.,0,0,0,0,0,0,1,3,Minor (likely < $1 million),-99,A window was damaged in this attack.,0,"","","","","","","","","","","","","","","","","\"\"\"Mystery surrounds Ulundi mayor�s attack","\"\" Zululand Observer",September 28,"2017.\"","","",START Primary Collection,-9,-9
201710010032,2017,10,1,"",0,"",183,11,Sub-Saharan Africa,KwaZulu-Natal,Mtubatuba,-28.418457,32.185218,1,0,"","10/01/2017: Assailants opened fire on Bongani Msomi at a Maskandi music festival in Mtubatuba, KwaZulu-Natal, South Africa. Msomi, a former Mtubatuba councilor and African National Congress (ANC) member, was killed in the assault. No group claimed responsibility for the attack.",1,1,1,0,"","",0,1,0,1,Assassination,"","","","",2,Government (General),15,Politician or Political Party Movement/Meeting/Rally,Government of Mtubatuba,Former Councillor: Bongani Msomi,183,South Africa,"","","","","","","","","","","","","","","","",Unknown,"","","","","","",0,"","",0,1,0,0,"","","","","","","","","",5,Firearms,5,Unknown Gun Type,"","","","","","","","","","","","","",1,0,0,0,0,0,0,"","","","",0,"","","","","","","","","","","","","","","","","\"\"\"Motive for former councillor's murder unknown","\"\" The Times (South Africa)",October 3,"2017.\"","\"\"\"Former ANC councillor shot dead in KZN","\"\" Mail & Guardian Online",October 2,"2017.\"",""
201710020039,2017,10,2,"",0,"",183,11,Sub-Saharan Africa,KwaZulu-Natal,Harry Gwala district,-30.154457,30.069105,3,0,The incident occurred in the Hlanganani area.,"10/02/2017: Assailants opened fire on Nkosinathi Ngcobo in Hlanganani, Harry Gwala district, KwaZulu-Natal, South Africa. Ngcobo, a local municipal official and former African National Congress (ANC) branch chairperson, was killed in the assault. No group claimed responsibility for the attack.",1,1,1,0,"","",0,1,0,1,Assassination,"","","","",2,Government (General),18,"Government Personnel (excluding police, military)",Government of Dr Nkosazana Dlamini-Zuma Municipality,Municipal Official: Nkosinathi Ngcobo,183,South Africa,"","","","","","","","","","","","","","","","",Unknown,"","","","","","",0,"","",0,3,0,0,"","","","","","","","","",5,Firearms,5,Unknown Gun Type,"","","","","","","","","","","","","",1,0,0,0,0,0,-9,"","","","",0,"","","","","","","","","","","","","","","","","\"\"\"[ALERT] Another ANC municipal official gunned down in KZN","\"\" Eye Witness News",October 3,"2017.\"","\"\"\"ANC KZN sends condolences after Ngcobo�s murder","\"\" Eye Witness News",October 3,"2017.\"","\"\"\"ANOTHER KZN ANC LEADER KILLED!"
201711200021,2017,11,20,"",0,"",183,11,Sub-Saharan Africa,KwaZulu-Natal,Enkanyazeni,-28.575323,30.561802,2,0,The incident occurred in the Umkambathini municipality.,"11/20/2017: Assailants shot and killed Lungisani Mnguni, a former African National Congress (ANC) KwaZulu-Natal branch chairperson, while he was delivering groceries to a local school in Enkanyazeni, Umkambathini, KwaZulu-Natal, South Africa. There were no other reported casualties. No group claimed responsibility for the attack.",1,1,1,0,"","",0,1,0,1,Assassination,"","","","",14,Private Citizens & Property,84,Political Party Member/Rally,African National Congress (ANC),Vehicle of Former KwaZulu-Natal Branch Chairperson: Lungisani Mnguni,183,South Africa,"","","","","","","","","","","","","","","","",Unknown,"","","","","","",0,"","",0,-99,0,0,"","","","","","","","","",5,Firearms,5,Unknown Gun Type,"","","","","","","","","","","","","",1,0,0,0,0,0,0,"","","","",0,"","","","","","","","","","","","","","","","","\"\"\"Third ANC offical gunned down in KZN region","\"\" Mail & Guardian Online",November 20,"2017.\"","\"\"\"ANC KwaZulu-Natal member killed in Camperdown area","\"\" Citizen.co.za",November 20,"2017.\"",""
201711230018,2017,11,23,"",0,"",183,11,Sub-Saharan Africa,KwaZulu-Natal,Mpophomeni,-29.566387,30.180759,1,0,"","11/23/2017: Assailants pretending to be police officers opened fire on Sthe Mhlongo at his residence in Mpophomeni, KwaZulu-Natal, South Africa. Mhlongo, an ANC Youth League deputy regional secretary, was killed in the attack. No group claimed responsibility for the incident.",1,1,1,0,"","",0,1,0,1,Assassination,"","","","",14,Private Citizens & Property,84,Political Party Member/Rally,African National Congress Youth League (ANCYL),Deputy Regional Secretary: Sthe Mhlongo,183,South Africa,"","","","","","","","","","","","","","","","",Unknown,"","","","","","",0,"","",0,2,0,0,"","","","","","","","","",5,Firearms,5,Unknown Gun Type,"","","","","","","","","","","","","",1,0,0,0,0,0,0,"","","","",0,"","","","","","","","","","","","","","","","","\"\"\"Third ANC cadre shot in Pietermaritzburg area","\"\" The Herald (South Africa)",November 24,"2017.\"","\"\"\"Fake cops gun down KZN regional ANC Youth League leader","\"\" Citizen.co.za",November 23,"2017.\"","\"\"\"ANC youth league executive killed in pre-dawn attack"
