201612010108,2016,12,1,"",0,"",183,11,Sub-Saharan Africa,KwaZulu-Natal,Harding,-30.57692,29.89309,1,0,"","12/01/2016: Assailants opened fire on Alwin Houston in Harding, KwaZulu-Natal, South Africa. Houston, a local ward councilor and African National Congress (ANC) member, was killed in the assault. No group claimed responsibility for the attack.",1,1,1,0,"","",0,1,0,1,Assassination,"","","","",2,Government (General),15,Politician or Political Party Movement/Meeting/Rally,Government of Umuziwabantu,Ward Councilor: Alwin Houston,183,South Africa,"","","","","","","","","","","","","","","","",Unknown,"","","","","","",0,"","",0,-99,0,0,"","","","","","","","","",5,Firearms,5,Unknown Gun Type,"","","","","","","","","","","","","",1,0,0,0,0,0,0,"","","","",0,"","","","","","","","","","","","","","","","","\"\"\"ANC councillor gunned down at meeting","\"\" Times Live South Africa",December 2,"2016.\"","\"\"\"ANC councillor gunned down at meeting","\"\" Suid Kaap Forum",December 2,"2016.\"",""
201612050029,2016,12,5,"",0,"",183,11,Sub-Saharan Africa,KwaZulu-Natal,Sundumbili,-29.134747,31.398471,1,0,The incident occurred in the Chappies area.,"12/05/2016: Assailants opened fire on Linda Mathonsi in Chappies neighborhood, Sundumbili, KwaZulu-Natal, South Africa. Mathonsi, a local chief, was killed and his daughter was injured in the assault. No group claimed responsibility for the attack.",1,1,1,0,"","",0,1,0,1,Assassination,"","","","",14,Private Citizens & Property,77,Laborer (General)/Occupation Identified,Not Applicable,KwaZulu-Natal Chief: Linda Mathonsi,183,South Africa,"","","","","","","","","","","","","","","","",Unknown,"","","","","","",0,"","",0,-99,0,0,"","","","","","","","","",5,Firearms,5,Unknown Gun Type,"","","","","","","","","","","","","",1,0,0,1,0,0,1,3,Minor (likely < $1 million),-99,A vehicle was damaged in this attack.,0,"","","","","","","","","","","","","","","","","\"\"\"KZN chief shot and killed in front of daughter","\"\" News24",December 5,"2016.\"","\"\"\"BREAKING NEWS: Chief shot dead� daughter wounded in attack","\"\" Times Live South Africa",December 5,"2016.\"",""
201612170037,2016,12,17,"",0,"",183,11,Sub-Saharan Africa,KwaZulu-Natal,Kwalubisi,-30.143628,30.627129,1,0,"","12/17/2016: Assailants opened fire on Mbhekiseni Khumalo in Kwalubisi, KwaZulu-Natal, South Africa. Khumalo, a local councilor and African National Congress (ANC) member, was killed in the assault. No group claimed responsibility for the attack.",1,1,1,0,"","",0,1,0,1,Assassination,"","","","",2,Government (General),15,Politician or Political Party Movement/Meeting/Rally,Government of Uphongolo,Councilor: Mbhekiseni Khumalo,183,South Africa,"","","","","","","","","","","","","","","","",Unknown,"","","","","","",0,"","",0,1,0,0,"","","","","","","","","",5,Firearms,5,Unknown Gun Type,"","","","","","","","","","","","","",1,0,0,0,0,0,0,"","","","",0,"","","","","","","","","","","","","","","","","\"\"\"Slaying of ANC councillors in KZN condemned by MEC","\"\" Pretoria News (South Africa)/Pretoria News Weekend (South Africa)",December 19,"2016.\"","\"\"\"A 'killing spree of public  officials'","\"\" The Mercury (South Africa)",December 19,"2016.\"","\"\"\"Another KZN councillor slain"
201612260033,2016,12,26,"",0,"",183,11,Sub-Saharan Africa,KwaZulu-Natal,Nongoma,-27.894289,31.645422,1,1,The incident occurred near Nongoma in the KwaLuphonjwana area.,"12/26/2016: Assailants opened fire on Mzokhona 'Sibotho' Dlane in KwaLuphonjwana, KwaZulu-Natal, South Africa. Dlane, a former African National Congress (ANC) candidate, was killed in the assault. No group claimed responsibility for the attack.",1,1,1,0,"","",0,1,0,1,Assassination,"","","","",14,Private Citizens & Property,84,Political Party Member/Rally,African National Congress (ANC),Candidate: Mzokhona 'Sibotho' Dlane,183,South Africa,"","","","","","","","","","","","","","","","",Unknown,"","","","","","",0,"","",0,-99,0,0,"","","","","","","","","",5,Firearms,2,Automatic or Semi-Automatic Rifle,"","","","","","","","","","","","","",1,0,0,0,0,0,0,"","","","",0,"","","","","","","","","","","","","","","","","\"\"\"Activist gunned down outside Nongoma","\"\" Zululand Observer",December 30,"2016.\"","\"\"\"ANC councillor",IFP leader gunned down,"\"\" Zululand Observer",December 25,"2016.\""
201701120056,2017,1,12,"",0,"",183,11,Sub-Saharan Africa,Western Cape,Cape Town,-34.015365,18.649458,1,0,The incident occurred in the Site C area of the Khayelitsha neighborhood.,"01/12/2017: Assailants shot and killed a Somali shopkeeper in Khayelitsha neighborhood, Cape Town, Western Cape, South Africa. No group claimed responsibility for the attack.",1,1,1,0,"","",0,1,0,2,Armed Assault,7,Facility/Infrastructure Attack,"","",14,Private Citizens & Property,77,Laborer (General)/Occupation Identified,Not Applicable,Shopkeeper,182,Somalia,"","","","","","","","","","","","","","","","",Unknown,"","","","","","",0,"","",0,-99,0,0,"","","","","","","","","",5,Firearms,5,Unknown Gun Type,"","","","","","","","","","","","","",1,0,0,0,0,0,1,3,Minor (likely < $1 million),-99,Unspecified goods were stolen in this attack.,0,"","","","","","","","","","","","","","","","","\"\"\"SOMALIS PLEAD FOR AN END TO KILLINGS IN KHAYELITSHA","\"\" WardheerNews",March 6,"2017.\"","\"\"\"South Africa: Government official takes aim at foreigners","\"\" Panapress.com",February 7,"2017.\"","\"\"\"Highlights: Somalia Daily Media Highlights 7 February 2017"
201701150018,2017,1,15,"",0,"",183,11,Sub-Saharan Africa,Unknown,Unknown,"","",5,0,"","01/15/2017: An assailant opened fire on a South African Broadcasting Corporation (SABC) journalist with a pellet gun in an unknown location in South Africa. The journalist, identified as Suna Venter, was injured in the attack. No group claimed responsibility for the incident.",1,1,1,0,"","",0,1,0,2,Armed Assault,"","","","",10,Journalists & Media,54,Radio Journalist/Staff/Facility,South African Broadcasting Corporation (SABC),Journalist: Suna Venter,183,South Africa,"","","","","","","","","","","","","","","","",Unknown,"","","","","","",0,"","",0,1,0,0,"","","","","","","","","",5,Firearms,6,Other Gun Type,"","","","","","","","","","","","",A pellet gun was used in the attack.,0,0,0,1,0,0,0,"","","","",0,"","","","","","","","","","","","","","","","","\"\"\"SABC 8 Journalist Shot In Face With Pellet Gun","\"\" News24",January 27,"2017.\"","\"\"\"SABC INQUIRY HEARS JOURNALIST SUNA VENTER WAS SHOT IN FACE WITH AIR RIFLE","\"\" Eye Witness News",January 27,"2017.\"",""
201701240031,2017,1,24,"",0,"",183,11,Sub-Saharan Africa,Western Cape,Cape Town,-34.015365,18.649458,1,0,The incident occurred in the Site C area of the Khayelitsha neighborhood.,"01/24/2017: Assailants shot and killed a Somali shopkeeper in Cape Town, Western Cape, South Africa. No group claimed responsibility for the incident.",1,1,1,0,"","",0,1,0,2,Armed Assault,"","","","",1,Business,7,Retail/Grocery/Bakery,Unknown,Shopkeeper,182,Somalia,"","","","","","","","","","","","","","","","",Unknown,"","","","","","",0,"","",0,-99,0,0,"","","","","","","","","",5,Firearms,5,Unknown Gun Type,"","","","","","","","","","","","","",1,0,0,0,0,0,0,"","","","",0,"","","","","","","","","","","","","","","","","\"\"\"SOMALIS PLEAD FOR AN END TO KILLINGS IN KHAYELITSHA","\"\" WardheerNews",March 6,"2017.\"","\"\"\"South Africa: Government official takes aim at foreigners","\"\" Panapress.com",February 7,"2017.\"","\"\"\"Highlights: Somalia Daily Media Highlights 7 February 2017"
201702020020,2017,2,2,"",0,"",183,11,Sub-Saharan Africa,Western Cape,Cape Town,-34.015365,18.649458,1,0,The incident occurred in the Site C area of the Khayelitsha neighborhood.,"02/02/2017: Assailants shot and killed a Somali shopkeeper in Khayelitsha neighborhood, Cape Town, South Africa. This was one of three attacks targeting Somali shopkeepers in Khayelitsha on the same day. No group claimed responsibility for the incidents.",1,1,1,0,"","",1,1,0,2,Armed Assault,"","","","",1,Business,7,Retail/Grocery/Bakery,Unknown,Shopkeeper,182,Somalia,"","","","","","","","","","","","","","","","",Unknown,"","","","","","",0,"","",0,-99,0,0,"","","","","","","","","",5,Firearms,5,Unknown Gun Type,"","","","","","","","","","","","","",1,0,0,0,0,0,0,"","","","",0,"","","","","","","","","","","","","","","","","\"\"\"South Africa: Government official takes aim at foreigners","\"\" Panapress.com",February 7,"2017.\"","\"\"\"Somali nationals shot dead in Khayelitsha","\"\" ENCA",February 3,"2017.\"","\"\"\"Highlights: Somalia Daily Media Highlights 7 February 2017"
201702020021,2017,2,2,"",0,"",183,11,Sub-Saharan Africa,Western Cape,Cape Town,-34.015365,18.649458,1,0,The incident occurred in the Site C area of the Khayelitsha neighborhood.,"02/02/2017: Assailants shot and killed a Somali shopkeeper in Khayelitsha neighborhood, Cape Town, South Africa. This was one of three attacks targeting Somali shopkeepers in Khayelitsha on the same day. No group claimed responsibility for the incidents.",1,1,1,0,"","",1,1,0,2,Armed Assault,"","","","",1,Business,7,Retail/Grocery/Bakery,Unknown,Shopkeeper,182,Somalia,"","","","","","","","","","","","","","","","",Unknown,"","","","","","",0,"","",0,-99,0,0,"","","","","","","","","",5,Firearms,5,Unknown Gun Type,"","","","","","","","","","","","","",1,0,0,0,0,0,0,"","","","",0,"","","","","","","","","","","","","","","","","\"\"\"South Africa: Government official takes aim at foreigners","\"\" Panapress.com",February 7,"2017.\"","\"\"\"Somali nationals shot dead in Khayelitsha","\"\" ENCA",February 3,"2017.\"","\"\"\"Highlights: Somalia Daily Media Highlights 7 February 2017"
201702020022,2017,2,2,"",0,"",183,11,Sub-Saharan Africa,Western Cape,Cape Town,-34.015365,18.649458,1,0,The incident occurred in the Site C area of the Khayelitsha neighborhood.,"02/02/2017: Assailants shot and killed a Somali shopkeeper in Khayelitsha neighborhood, Cape Town, South Africa. This was one of three attacks targeting Somali shopkeepers in Khayelitsha on the same day. No group claimed responsibility for the incidents.",1,1,1,0,"","",1,1,0,2,Armed Assault,"","","","",1,Business,7,Retail/Grocery/Bakery,Unknown,Shopkeeper,182,Somalia,"","","","","","","","","","","","","","","","",Unknown,"","","","","","",0,"","",0,-99,0,0,"","","","","","","","","",5,Firearms,5,Unknown Gun Type,"","","","","","","","","","","","","",1,0,0,0,0,0,0,"","","","",0,"","","","","","","","","","","","","","","","","\"\"\"South Africa: Government official takes aim at foreigners","\"\" Panapress.com",February 7,"2017.\"","\"\"\"Somali nationals shot dead in Khayelitsha","\"\" ENCA",February 3,"2017.\"","\"\"\"Highlights: Somalia Daily Media Highlights 7 February 2017"
201703060036,2017,3,6,"",0,"",183,11,Sub-Saharan Africa,KwaZulu-Natal,Richmond,-29.873981,30.272784,1,0,The incident occurred on Victoria Road.,"03/06/2017: Assailants opened fire on Sibusiso Sithole in Richmond, KwaZulu-Natal, South Africa. Sithole, a local municipal manager, was killed in the assault. No group claimed responsibility for the attack.",1,1,1,1,2,Other Crime Type,0,1,0,2,Armed Assault,"","","","",2,Government (General),18,"Government Personnel (excluding police, military)",Government of Richmond,Municipal Manager: Sibusiso Sithole,183,South Africa,"","","","","","","","","","","","","","","","",Unknown,"","","","","","",0,"","",0,2,0,0,"","","","","","","","","",5,Firearms,5,Unknown Gun Type,"","","","","","","","","","","","","",1,0,0,0,0,0,0,"","","","",0,"","","","","","","","","","","","","","","",There is doubt that this incident meets terrorism-related criteria. A source suspected that the victim may have been targeted because he fired or refused to hire corrupt officials.,"\"\"\"Richmond municipal manager gunned down","\"\" News24",March 6,"2017.\"","\"\"\"ANC members killed for anti-corruption stance","\"\" IAfrica.com",August 28,"2017.\"",""
201703150047,2017,3,15,"",0,"",183,11,Sub-Saharan Africa,Limpopo,Polokwane,-23.918839,29.443324,1,0,The incident occurred in the Ivy Park neighborhood.,"03/15/2017: Assailants attacked a Nigerian national and set fire to his house in Polokwane, Limpopo, South Africa. The civilian was injured in the attack. No group claimed responsibility for the incident.",1,1,1,0,"","",0,1,0,7,Facility/Infrastructure Attack,"","","","",14,Private Citizens & Property,67,Unnamed Civilian/Unspecified,Not Applicable,Civilian,147,Nigeria,"","","","","","","","","","","","","","","","",Unknown,"","","","","","The specific motive is unknown; however, sources noted that the attack was xenophobic.",0,"","",0,-99,0,0,"","","","","","","","","",8,Incendiary,18,Arson/Fire,13,Unknown,"","","","","","","","","","","",0,0,0,1,0,0,1,3,Minor (likely < $1 million),-99,A house was damaged in this attack.,0,"","","","","","","","","","","","","","","","","\"\"\"Xenophobia: Five Nigerians attacked in S/Africa again",three in critical conditions,"\"\" Naij.com",March 21,"2017.\"","","",START Primary Collection,-9
201703210026,2017,3,21,2017-03-21 00:00:00,0,"",183,11,Sub-Saharan Africa,Limpopo,Moledji,-23.896171,29.448626,2,0,"","03/21/2017: Assailants attacked a Nigerian civilian in Moledji, Limpopo, South Africa. The civilian was injured and a house was damaged in the assault. This was one of three related attacks targeting Nigerian nationals in the area on the same day. No group claimed responsibility for the incidents.",1,1,1,0,"","",1,1,0,7,Facility/Infrastructure Attack,"","","","",14,Private Citizens & Property,67,Unnamed Civilian/Unspecified,Not Applicable,Civilian,147,Nigeria,"","","","","","","","","","","","","","","","",Unknown,"","","","","","The specific motive is unknown; however, sources noted that the attack was xenophobic.",0,"","",0,-99,0,0,"","","","","","","","","",13,Unknown,"","","","","","","","","","","","","","","",0,0,0,1,0,0,1,3,Minor (likely < $1 million),-99,A house was looted and damaged during this attack.,0,"","","","","","","","","","","","","","","","","\"\"\"Xenophobia: Five Nigerians attacked in S/Africa again",three in critical conditions,"\"\" Naij.com",March 21,"2017.\"","","",START Primary Collection,-9
201703210027,2017,3,21,2017-03-21 00:00:00,0,"",183,11,Sub-Saharan Africa,Limpopo,Moledji,-23.896171,29.448626,2,0,"","03/21/2017: Assailants attacked a Nigerian civilian in Moledji, Limpopo, South Africa. The civilian was injured and a house was damaged in the assault. This was one of three related attacks targeting Nigerian nationals in the area on the same day. No group claimed responsibility for the incidents.",1,1,1,0,"","",1,1,0,7,Facility/Infrastructure Attack,"","","","",14,Private Citizens & Property,67,Unnamed Civilian/Unspecified,Not Applicable,Civilian,147,Nigeria,"","","","","","","","","","","","","","","","",Unknown,"","","","","","The specific motive is unknown; however, sources noted that the attack was xenophobic.",0,"","",0,-99,0,0,"","","","","","","","","",13,Unknown,"","","","","","","","","","","","","","","",0,0,0,1,0,0,1,3,Minor (likely < $1 million),-99,A house was looted and damaged during this attack,0,"","","","","","","","","","","","","","","","","\"\"\"Xenophobia: Five Nigerians attacked in S/Africa again",three in critical conditions,"\"\" Naij.com",March 21,"2017.\"","","",START Primary Collection,-9
201703210028,2017,3,21,2017-03-21 00:00:00,0,"",183,11,Sub-Saharan Africa,Limpopo,Moledji,-23.896171,29.448626,2,0,"","03/21/2017: Assailants attacked a Nigerian civilian in Moledji, Limpopo, South Africa. The civilian was injured and a house was damaged in the assault. This was one of three related attacks targeting Nigerian nationals in the area on the same day. No group claimed responsibility for the incidents.",1,1,1,0,"","",1,1,0,7,Facility/Infrastructure Attack,"","","","",14,Private Citizens & Property,67,Unnamed Civilian/Unspecified,Not Applicable,Civilian,147,Nigeria,"","","","","","","","","","","","","","","","",Unknown,"","","","","","The specific motive is unknown; however, sources noted that the attack was xenophobic.",0,"","",0,-99,0,0,"","","","","","","","","",13,Unknown,"","","","","","","","","","","","","","","",0,0,0,1,0,0,1,3,Minor (likely < $1 million),-99,A house was looted and damaged during this attack.,0,"","","","","","","","","","","","","","","","","\"\"\"Xenophobia: Five Nigerians attacked in S/Africa again",three in critical conditions,"\"\" Naij.com",March 21,"2017.\"","","",START Primary Collection,-9
201704200031,2017,4,20,"",0,"",183,11,Sub-Saharan Africa,KwaZulu-Natal,Mfundweni,-30.274507,29.920861,2,0,The incident occurred in the Umzimkhulu municipality of the Harry Gwala district.,"04/20/2017: Assailants opened fire on Khaya Thobela at his residence in Mfundweni, KwaZulu-Natal, South Africa. Thobela, an African National Congress (ANC) regional deputy secretary, was killed in the attack. No group claimed responsibility for the incident.",1,1,1,0,"","",0,1,0,1,Assassination,"","","","",14,Private Citizens & Property,84,Political Party Member/Rally,African National Congress (ANC),Regional Deputy Secretary: Khaya Thobela,183,South Africa,"","","","","","","","","","","","","","","","",Unknown,"","","","","","",0,"","",0,-99,0,0,"","","","","","","","","",5,Firearms,5,Unknown Gun Type,"","","","","","","","","","","","","",1,0,0,0,0,0,0,"","","","",0,"","","","","","","","","","","","","","","","","\"\"\"Three councillors gunned down in Dlamini-Zuma's region","\"\" Times LIVE South Africa",June 4,"2017.\"","","",START Primary Collection,-9,-9
201705110046,2017,5,11,"",0,"",183,11,Sub-Saharan Africa,KwaZulu-Natal,Umzimkhulu,-30.26335,29.938265,1,0,The incident occurred in the Harry Gwala district.,"05/11/2017: Assailants shot and killed Khaya Mgcwaba, a former African National Congress (ANC) councilor, in Umzimkhulu, KwaZulu-Natal, South Africa. No group claimed responsibility for the incident.",1,1,1,0,"","",0,1,0,1,Assassination,"","","","",2,Government (General),15,Politician or Political Party Movement/Meeting/Rally,Government of Umzimkhulu,Former Councilor: Khaya Mgcwaba,183,South Africa,"","","","","","","","","","","","","","","","",Unknown,"","","","","","",0,"","",0,-99,0,0,"","","","","","","","","",5,Firearms,5,Unknown Gun Type,"","","","","","","","","","","","","",1,0,0,0,0,0,0,"","","","",0,"","","","","","","","","","","","","","","","","\"\"\"Three councillors gunned down in Dlamini-Zuma's region","\"\" Times LIVE South Africa",June 4,"2017.\"","","",START Primary Collection,-9,-9
201705230050,2017,5,23,"",0,"",183,11,Sub-Saharan Africa,KwaZulu-Natal,Umzimkhulu,-30.26044,29.940006,1,0,The incident occurred in Ixopo district.,"05/23/2017: Assailants shot and killed Mduduzi Tshivase, an African National Congress (ANC) municipal councilor, in Umzimkhulu, KwaZulu-Natal, South Africa. No group claimed responsibility for the incident.",1,1,1,0,"","",0,1,0,1,Assassination,"","","","",2,Government (General),15,Politician or Political Party Movement/Meeting/Rally,Government of Umzimkhulu,Municipal Councilor,183,South Africa,"","","","","","","","","","","","","","","","",Unknown,"","","","","","",0,"","",0,-99,0,0,"","","","","","","","","",5,Firearms,5,Unknown Gun Type,"","","","","","","","","","","","","",1,0,0,0,0,0,0,"","","","",0,"","","","","","","","","","","","","","","","","\"\"\"Three councillors gunned down in Dlamini-Zuma's region","\"\" Times LIVE South Africa",June 4,"2017.\"","\"\"\"ANC councillor shot dead in a month after speaker�s murder","\"\" Africa News Hub",May 24,"2017.\"","\"\"\"ANC councillor gunned down in KZN"
201706210018,2017,6,21,"",0,"",183,11,Sub-Saharan Africa,Western Cape,Cape Town,-34.016667,18.55,1,0,The incident occurred in the Phillipi neighborhood.,"06/21/2017: An assailant shot and killed Xolile Gwangxu, a Democratic Alliance (DA) ward councilor, in Phillipi neighborhood, Cape Town, South Africa. No group claimed responsibility for the incident.",1,1,1,0,"","",0,1,0,1,Assassination,"","","","",2,Government (General),15,Politician or Political Party Movement/Meeting/Rally,Government of Cape Town,Ward Councilor: Xolile Gwangxu,183,South Africa,"","","","","","","","","","","","","","","","",Unknown,"","","","","","",0,"","",0,-99,0,0,"","","","","","","","","",5,Firearms,5,Unknown Gun Type,"","","","","","","","","","","","","",1,0,0,0,0,0,0,"","","","",0,"","","","","","","","","","","","","","","","","\"\"\"DA councillor shot dead in Cape Town","\"\" ENCA",June 22,"2017.\"","\"\"\"Tandeka Gqada left traumatized by  DA councillor�s murder","\"\" SA Breaking News",June 23,"2017.\"","\"\"\"DA councillor gunned down in Philippi"
201706290030,2017,6,29,"",0,"",183,11,Sub-Saharan Africa,KwaZulu-Natal,Richmond,-29.903343,30.239734,1,0,"","06/29/2017: Assailants opened fire on Sfiso Mkhize in Richmond, KwaZulu-Natal, South Africa. Mkhize, an African National Congress (ANC) ward council member, was killed in the assault. No group claimed responsibility for the attack.",1,1,1,0,"","",0,1,0,1,Assassination,"","","","",2,Government (General),15,Politician or Political Party Movement/Meeting/Rally,African National Congress (ANC),Ward Council Member: Sfiso Mkhize,183,South Africa,"","","","","","","","","","","","","","","","",Unknown,"","","","","","",0,"","",0,-99,0,0,"","","","","","","","","",5,Firearms,5,Unknown Gun Type,"","","","","","","","","","","","","",1,0,0,0,0,0,0,"","","","",0,"","","","","","","","","","","","","","","","","\"\"\"Councillor shot in back; Fourth ANC official killed this year","\"\" Daily News (South Africa)",August 31,"2017.\"","\"\"\"Spate Of Violence Against Councillors In KZN Continues With Three Shootings","\"\" HuffingtonPost.co.za",July 14,"2017.\"","\"\"\"Assassins kill third Richmond official"
201707130050,2017,7,13,"",0,"",183,11,Sub-Saharan Africa,KwaZulu-Natal,Umzimkhulu,-30.264216,29.919119,1,0,"","07/13/2017: Assailants opened fire on a vehicle carrying three African National Congress (ANC) municipal councilors in Umzimkhulu, KwaZulu-Natal, South Africa. Sindiso Magaqa was killed and two councilors were injured in the attack. No group claimed responsibility for the incident.",0,1,1,1,2,Other Crime Type,0,0,0,1,Assassination,"","","","",2,Government (General),15,Politician or Political Party Movement/Meeting/Rally,Government of Umzimkhulu,"Municipal Councilors: Sindiso Magaqa, Nonsikelelo Mafa, Jabu Mzizi",183,South Africa,"","","","","","","","","","","","","","","","",Unknown,"","","","","","",0,"","",0,-99,0,0,"","","","","","","","","",5,Firearms,2,Automatic or Semi-Automatic Rifle,5,Firearms,3,Handgun,"","","","","","","","",A high-powered rifle and a pistol were used in the attack.,1,0,0,2,0,0,1,3,Minor (likely < $1 million),-99,A vehicle was damaged in this attack.,0,"","","","","","","","","","","","","","","",There is doubt that this incident meets terrorism-related criteria. Family members stated that Magaqa was targeted because he was planning to expose corruption within the African National Congress (ANC).,"\"\"\"Ex-ANC Youth League leader's car peppered with at least a dozen bullets","\"\" Times LIVE South Africa",July 14,"2017.\"","\"\"\"BREAKING: Former ANCYL secretary-general shot in ambush","\"\" Times LIVE South Africa",July 13,"2017.\"","\"\"\"Sindiso Magaqa was killed because of ANC elective conference"
201707170035,2017,7,17,"",0,"",183,11,Sub-Saharan Africa,Eastern Cape,Fort Beaufort,-32.774242,26.63337,1,0,The incident occurred in the Newton neighborhood.,"07/17/2017: Assailants shot and killed Thozama Njobe, an African National Congress (ANC) municipal councilor, in Fort Beaufort, Eastern Cape, South Africa. No group claimed responsibility for the incident; however, sources stated that Njobe was likely targeted for her opposition to corruption.",1,1,1,0,"","",0,1,0,1,Assassination,"","","","",2,Government (General),15,Politician or Political Party Movement/Meeting/Rally,Government of Raymond Mhlaba Muncipality,Municipal Councilor: Thozama Njobe,183,South Africa,"","","","","","","","","","","","","","","","",Unknown,"","","","","","The specific motive is unknown; however, sources noted that Thozama Njobe advocated against corruption.",0,"","",0,1,0,0,"","","","","","","","","",5,Firearms,5,Unknown Gun Type,"","","","","","","","","","","","","",1,0,0,0,0,0,0,"","","","",0,"","","","","","","","","","","","","","","","","\"\"\"'Raymond Mhlaba Speaker killed because of anti-corruption stance'","\"\" Eye Witness News",July 19,"2017.\"","\"\"\"Speaker of EC municipality gunned down in suspected hit","\"\" Eye Witness News",July 18,"2017.\"","\"\"\"Has being an ANC politician become more dangerous by the day?"
201707310029,2017,7,31,"",0,"",183,11,Sub-Saharan Africa,Eastern Cape,Mthatha,-31.590654,28.783986,1,0,The incident occurred on Craister Street,"07/31/2017: Assailants opened fire on Thembinkosi Fandaleki as he was driving on Craister Street in Mthatha, Eastern Cape, South Africa. Fandaleki, a bishop, was killed in the assault. No group claimed responsibility for the incident.",1,1,1,0,"","",0,1,0,2,Armed Assault,"","","","",15,Religious Figures/Institutions,85,Religious Figure,Methodist Church South Africa,Bishop: Thembinkosi Fandaleki,183,South Africa,"","","","","","","","","","","","","","","","",Unknown,"","","","","","",0,"","",0,-99,0,0,"","","","","","","","","",5,Firearms,5,Unknown Gun Type,"","","","","","","","","","","","","",1,0,0,0,0,0,1,3,Minor (likely < $1 million),-99,A vehicle and a building were damaged in this attack.,0,"","","","","","","","","","","","","","","","","\"\"\"Methodist bishop shot in Mthatha","\"\" The Herald (South Africa)",August 2,"2017.\"","\"\"\"Third suspect in court over bishop's murder","\"\" Daily Dispatch (South Africa)",August 21,"2017.\"","\"\"\"Beloved bishop shot and killed in Mthatha"
