201702140013,2017,2,14,"",0,"",18,10,Middle East & North Africa,Central,Sitra,26.169081,50.614277,1,0,"","02/14/2017: An explosive device detonated targeting a civilian vehicle in Sitra, Central governorate, Bahrain. At least two people were injured in the blast. No group claimed responsibility for the incident.",1,1,1,0,"","",0,1,0,3,Bombing/Explosion,"","","","",14,Private Citizens & Property,67,Unnamed Civilian/Unspecified,Not Applicable,Civilians,18,Bahrain,"","","","","","","","","","","","","","","","",Unknown,"","","","","","",0,"","",0,-99,0,0,"","","","","","","","","",6,Explosives,16,Unknown Explosive Type,"","","","","","","","","","","","","",0,0,0,2,0,0,1,3,Minor (likely < $1 million),-99,A vehicle was damaged in this attack.,0,"","","","","","","","","","","","","","","","","\"\"\"'Terrorist blast' rocks Bahrain island","\"\" Gulf News",February 15,"2017.\"","\"\"\"Pakistan: Bahrain blast wounds two civilians on uprising anniversary","\"\" Pakistan Today Online",February 15,"2017.\"","\"\"\"Man and wife injured by 'terrorist explosion' in Bahrain"
201702230010,2017,2,23,"",0,"",18,10,Middle East & North Africa,Capital,Manama,26.226565,50.545907,1,0,The incident occurred in the Sanabis neighborhood.,"02/23/2017: An explosive device detonated targeting police personnel in Manama, Capital, Bahrain. One civilian was injured in the blast. No group claimed responsibility for the incident.",1,1,1,0,"","",0,1,0,3,Bombing/Explosion,"","","","",3,Police,25,Police Security Forces/Officers,Public Security Force (PSF),Officers,18,Bahrain,14,Private Citizens & Property,67,Unnamed Civilian/Unspecified,Not Applicable,Civilian,18,Bahrain,"","","","","","","","",Unknown,"","","","","","",0,"","",0,-99,0,0,"","","","","","","","","",6,Explosives,16,Unknown Explosive Type,"","","","","","","","","","","","","",0,0,0,1,0,0,0,"","","","",0,"","","","","","","","","","","","","","","","","\"\"\"Cop killed",five hurt in terror attack,"\"\" Daily Tribune",February 27,"2017.\"","\"\"\"Xinhua: Four Policemen Injured In Terrorist Blast In Bahrain","\"\" Xinhua",February 26,"2017.\""
201702240009,2017,2,24,"",0,"",18,10,Middle East & North Africa,Northern,Shakhurah,26.209757,50.505797,1,0,"","02/24/2017: An explosive device detonated in Shakhurah, Northern, Bahrain. There were no reported casualties, though police and civilian vehicles were damaged in the blast. No group claimed responsibility for the incident.",1,1,1,0,"","",0,1,0,3,Bombing/Explosion,"","","","",3,Police,23,Police Patrol (including vehicles and convoys),Public Security Force (PSF),Vehicle,18,Bahrain,14,Private Citizens & Property,73,Vehicles/Transportation,Not Applicable,Vehicles,18,Bahrain,"","","","","","","","",Unknown,"","","","","","",0,"","",0,-99,0,0,"","","","","","","","","",6,Explosives,16,Unknown Explosive Type,"","","","","","","","","","","","","",0,0,0,0,0,0,1,3,Minor (likely < $1 million),-99,A police vehicle and two civilian vehicles were damaged in this attack.,0,"","","","","","","","","","","","","","","","","\"\"\"Cop killed",five hurt in terror attack,"\"\" Daily Tribune",February 27,"2017.\"","\"\"\"Xinhua: Four Policemen Injured In Terrorist Blast In Bahrain","\"\" Xinhua",February 26,"2017.\""
201702260011,2017,2,26,"",0,"",18,10,Middle East & North Africa,Southern,Jaww,25.999999,50.616685,1,1,"","02/26/2017: An explosive device detonated targeting a police vehicle near Jaww, Southern, Bahrain. At least one police officer was killed and five officers were injured in the blast. No group claimed responsibility for the incident.",1,1,1,0,"","",0,1,0,3,Bombing/Explosion,"","","","",3,Police,23,Police Patrol (including vehicles and convoys),Public Security Force (PSF),Vehicle,18,Bahrain,"","","","","","","","","","","","","","","","",Unknown,"","","","","","",0,"","",0,-99,0,0,"","","","","","","","","",6,Explosives,12,Remote Trigger,"","","","","","","","","","","","","",1,0,0,5,0,0,1,3,Minor (likely < $1 million),-99,A police vehicle was damaged in this attack.,0,"","","","","","","","","","","","","","","","Casualty numbers conflict across sources. Following GTD protocol, the most recent reliable estimates are reported here.","\"\"\"Foreign-backed terror cell 'plotted to assassinate key figures'","\"\" Gulf Daily News",March 27,"2017.\"","\"\"\"Cop killed",five hurt in terror attack,"\"\" Daily Tribune",February 27,"2017.\""
201703020031,2017,3,2,"",0,"",18,10,Middle East & North Africa,Capital,Manama,26.217001,50.587414,1,0,"","03/02/2017: An explosive device detonated at Al Naeem Secondary Boys' School in Manama, Bahrain. There were no reported casualties in the blast. No group claimed responsibility for the attack.",1,1,1,0,"","",0,1,0,3,Bombing/Explosion,"","","","",8,Educational Institution,49,School/University/Educational Building,Al Naeem Secondary Boys' School,School,18,Bahrain,"","","","","","","","","","","","","","","","",Unknown,"","","","","","",0,"","",0,-99,0,0,"","","","","","","","","",6,Explosives,16,Unknown Explosive Type,"","","","","","","","","","","","","",0,0,0,0,0,0,1,3,Minor (likely < $1 million),-99,A school wall was damaged in this attack.,0,"","","","","","","","","","","","","","","","","\"\"\"Terrorist explosion damages school wall","\"\" DT News is Bahrain's",March 4,"2017.\"","","",START Primary Collection,-9,-9
201703150055,2017,3,15,2017-03-15 00:00:00,0,"",18,10,Middle East & North Africa,Central,Salmabad,26.185217,50.529086,1,0,"","03/15/2017: Assailants opened fire on a police patrol in Salmabad, Central governorate, Bahrain. There were no reported casualties. No group claimed responsibility for the incident.",1,1,1,0,"","",0,1,0,2,Armed Assault,"","","","",3,Police,23,Police Patrol (including vehicles and convoys),Public Security Force (PSF),Patrol,18,Bahrain,"","","","","","","","","","","","","","","","",Unknown,"","","","","","",0,"","",0,-99,0,0,"","","","","","","","","",5,Firearms,2,Automatic or Semi-Automatic Rifle,"","","","","","","","","","","","",Kalashnikovs were used in the attack.,0,0,0,0,0,0,1,3,Minor (likely < $1 million),-99,Unspecified police property was damaged in this attack.,0,"","","","","","","","","","","","","","","","","\"\"\"Police patrol forces sustain damage in Bahrain explosive attack","\"\" Xinhua News Agency",March 15,"2017.\"","","",START Primary Collection,-9,-9
201706180030,2017,6,18,"",0,"",18,10,Middle East & North Africa,Northern,Diraz,26.21912,50.464478,1,0,"","06/18/2017: An explosive device detonated targeting a police patrol in Diraz, Northern, Bahrain. One police officer was killed and two officers were injured in the blast. No group claimed responsibility for the attack.",1,1,1,0,"","",0,1,0,3,Bombing/Explosion,"","","","",3,Police,25,Police Security Forces/Officers,Public Security Force (PSF),Officers,18,Bahrain,"","","","","","","","","","","","","","","","",Unknown,"","","","","","",0,"","",0,-99,-99,0,"","","","","","","","","",6,Explosives,16,Unknown Explosive Type,"","","","","","","","","","","","","",1,0,0,2,0,0,0,"","","","",0,"","","","","","","","","","","","","","","",The victims included Abdul Samad Haji.,"\"\"\"Suspects arrested over Bahrain blast in village of Shi'ite cleric - ministry","\"\" Reuters Africa",June 20,"2017.\"","\"\"\"Bahrain: Explosion kills policeman",wounds two in Diraz,"\"\" Al Jazeera Online",June 18,"2017.\""
201706190012,2017,6,19,"",0,"",18,10,Middle East & North Africa,Northern,Hajar,26.21552,50.512394,1,0,"","06/19/2017: An explosive device detonated prematurely in Hajar, Northern, Bahrain. One assailant, identified as Nabeel Al Samee, was killed in the blast. No group claimed responsibility for the incident.",1,1,1,0,"","",0,1,0,3,Bombing/Explosion,"","","","",20,Unknown,"","",Unknown,Unknown,18,Bahrain,"","","","","","","","","","","","","","","","",Unknown,"","","","","","",0,"","",0,-99,0,0,"","","","","","","","","",6,Explosives,16,Unknown Explosive Type,"","","","","","","","","","","","","",1,0,1,0,0,0,0,"","","","",0,"","","","","","","","","","","","","","","","","\"\"\"Death of man in bomb blast bares nexus in IED-making","\"\" DT News is Bahrain's",August 2,"2017.\"","\"\"\"Man killed while planting bomb","\"\" DT News is Bahrain's",June 21,"2017.\"","\"\"\"Bomb blast in Bahrain"
201708300013,2017,8,29,"",0,"",18,10,Middle East & North Africa,Northern,Karzakan,26.111301,50.480589,1,0,"","08/29/2017: Assailants threw incendiary devices at security forces in Karzakan, Northern, Bahrain. There were no reported casualties in the incident. This was one of three attacks targeting security forces in Bahrain on the same evening. No group claimed responsibility for the incidents.",1,1,0,1,1,Insurgency/Guerilla Action,1,1,0,2,Armed Assault,"","","","",4,Military,34,"Military Personnel (soldiers, troops, officers, forces)",Bahrain Defense Force (BDF),Soldiers,18,Bahrain,"","","","","","","","","","","","","","","","",Unknown,"","","","","","",0,"","",0,-99,0,0,"","","","","","","","","",8,Incendiary,19,Molotov Cocktail/Petrol Bomb,"","","","","","","","","","","","",Molotov cocktails were used in the attack.,0,0,0,0,0,0,1,3,Minor (likely < $1 million),-99,"Unspecified property was damaged across attacks 201708300013, 201708300014, and 201708300015.",0,"","","","","","","","","","","","","","","","","\"\"\"Vandals attack security forces","\"\" DT News is Bahrain's",August 30,"2017.\"","","",START Primary Collection,-9,-9
201708300014,2017,8,29,"",0,"",18,10,Middle East & North Africa,Central,Eker,26.143757,50.604046,1,0,"","08/29/2017: Assailants threw incendiary devices at security forces in Eker, Central, Bahrain. There were no reported casualties in the incident. This was one of three attacks targeting security forces in Bahrain on the same evening. No group claimed responsibility for the incidents.",1,1,0,1,1,Insurgency/Guerilla Action,1,1,0,2,Armed Assault,"","","","",4,Military,34,"Military Personnel (soldiers, troops, officers, forces)",Bahrain Defense Force (BDF),Soldiers,18,Bahrain,"","","","","","","","","","","","","","","","",Unknown,"","","","","","",0,"","",0,-99,0,0,"","","","","","","","","",8,Incendiary,19,Molotov Cocktail/Petrol Bomb,"","","","","","","","","","","","",Molotov cocktails were used in the attack.,0,0,0,0,0,0,1,3,Minor (likely < $1 million),-99,"Unspecified property was damaged across attacks 201708300013, 201708300014, and 201708300015.",0,"","","","","","","","","","","","","","","","","\"\"\"Vandals attack security forces","\"\" DT News is Bahrain's",August 30,"2017.\"","","",START Primary Collection,-9,-9
201708300015,2017,8,29,"",0,"",18,10,Middle East & North Africa,Central,Maameer,26.135452,50.614212,1,0,"","08/29/2017: Assailants threw incendiary devices at security forces in Maameer, Central, Bahrain. There were no reported casualties in the incident. This was one of three attacks targeting security forces in Bahrain on the same evening. No group claimed responsibility for the incidents.",1,1,0,1,1,Insurgency/Guerilla Action,1,1,0,2,Armed Assault,"","","","",4,Military,34,"Military Personnel (soldiers, troops, officers, forces)",Bahrain Defense Force (BDF),Soldiers,18,Bahrain,"","","","","","","","","","","","","","","","",Unknown,"","","","","","",0,"","",0,-99,0,0,"","","","","","","","","",8,Incendiary,19,Molotov Cocktail/Petrol Bomb,"","","","","","","","","","","","",Molotov cocktails were used in the attack.,0,0,0,0,0,0,1,3,Minor (likely < $1 million),-99,"Unspecified property was damaged across attacks 201708300013, 201708300014, and 201708300015.",0,"","","","","","","","","","","","","","","","","\"\"\"Vandals attack security forces","\"\" DT News is Bahrain's",August 30,"2017.\"","","",START Primary Collection,-9,-9
201710020016,2017,10,2,"",0,"",18,10,Middle East & North Africa,Capital,Daih,26.223698,50.536629,1,0,The incident occurred along Budaiya Highway.,"10/02/2017: An explosive device detonated near Public Security Force (PSF) officers at an Ashura procession along Budaiya Highway in Daih, Capital governorate, Bahrain. At least five officers were injured in the blast. Saraya Waad Allah claimed responsibility for the attack.",1,1,1,0,"","",0,1,0,3,Bombing/Explosion,"","","","",3,Police,25,Police Security Forces/Officers,Public Security Force (PSF),Officers,18,Bahrain,14,Private Citizens & Property,78,"Procession/Gathering (funeral, wedding, birthday, religious)",Not Applicable,Ashura Procession,18,Bahrain,"","","","","","","","",Saraya Waad Allah,"","","","","","The specific motive is unknown; however, sources noted that the targeted police officers were providing security for an Ashura procession at the time of the attack.",0,"","",0,-99,0,1,10,Unknown,"","","","","","","",6,Explosives,17,Other Explosive Type,"","","","","","","","","","","","",An explosives-laden gas cylinder was used in the attack.,0,0,0,5,0,0,0,"","","","",0,"","","","","","","","","","","","","","","","","\"\"\"Homemade bomb used for attack","\"\" Gulf Daily News",October 28,"2017.\"","\"\"\"Five policemen injured in blast during Ashoora procession","\"\" DT News is Bahrain's",October 3,"2017.\"","\"\"\"BAHRAIN: 5 POLICEMEN INJURED IN PROCESSION ATTACK"
201710270015,2017,10,27,"",0,"",18,10,Middle East & North Africa,Northern,Jidhafs,26.214625,50.520413,1,1,The incident occurred along the Shaikh Khalifa bin Salman Highway.,"\"10/27/2017: A roadside bomb detonated targeting a police bus along the Shaikh Khalifa bin Salman Highway in Jidhafs, Northern, Bahrain. At least one police officer was killed and nine other officers were injured in the blast. Saraya Waad Allah claimed responsibility for the incident. Saraya Waad Allah claimed responsibility for the incident and stated that the attack was \"\"out of revenge for the guiltless blood and proud souls that were sacrificed.\"\"\"",1,1,1,0,"","",0,1,0,3,Bombing/Explosion,"","","","",3,Police,23,Police Patrol (including vehicles and convoys),Public Security Force (PSF),Vehicle,18,Bahrain,"","","","","","","","","","","","","","","","",Saraya Waad Allah,Martyr Commander Rida al-Ghasrah Company,"","","","","\"Saraya Waad Allah claimed responsibility for the incident and stated that the attack was \"\"out of revenge for the guiltless blood and proud souls that were sacrificed.\"\"\"",0,"","",0,-99,0,1,7,"Posted to website, blog, etc.","","","","","","","",6,Explosives,12,Remote Trigger,"","","","","","","","","","","","",A remote-controlled homemade roadside bomb was used in the attack.,1,0,0,9,0,0,1,3,Minor (likely < $1 million),-99,A vehicle was damaged in this attack.,0,"","","","","","","","","","","","","","","","The victims included Salman Najm. Casualty numbers conflict across sources. Following GTD protocol, the most recent reliable estimates are reported here.","\"\"\"Bahrain says deadly bus attack engineered by Iran","\"\" Reuters India",November 15,"2017.\"","\"\"\"Xinhua: Bahrain Slams Iran For Activating Terror Cells To Target Oil Facilities","\"\" Xinhua",November 15,"2017.\"","\"\"\"Homemade bomb used for attack"
201711100009,2017,11,10,"",0,"",18,10,Middle East & North Africa,Northern,Buri,26.147871,50.498844,1,1,"","11/10/2017: An explosive device detonated targeting a Bahrain Petroleum Company (BAPCO) oil pipeline near Buri, Northern, Bahrain. There were no reported casualties in the blast and resulting fire. No group claimed responsibility for the incident; however, sources attributed the attack to the February 14 Movement.",1,1,1,0,"","",0,1,0,3,Bombing/Explosion,"","","","",21,Utilities,108,Oil,Bahrain Petroleum Company (BAPCO),Oil Pipeline,18,Bahrain,"","","","","","","","","","","","","","","","",February 14th Movement,"","","","","","",0,"","",0,4,4,0,"","","","","","","","","",6,Explosives,16,Unknown Explosive Type,"","","","","","","","","","","","","",0,0,0,0,0,0,1,3,Minor (likely < $1 million),-99,An oil pipeline and an unspecified number of buildings and vehicles were damaged in this attack.,0,"","","","","","","","","","","","","","","","","\"\"\"UPDATE 3-Bahrain calls pipeline blast \"\"terrorism\"\" linked to Iran","\"\" Reuters News",November 12,"2017.\"","\"\"\"Buri pipeline blast four held","\"\" Gulf Daily News",February 8,"2018.\"","\"\"\"Bahrain arrests four linked to pipeline blast: ministry"
201711100031,2017,11,10,"",0,"",18,10,Middle East & North Africa,Northern,Jeblat Hibshi,26.213229,50.527792,1,0,"","11/10/2017: An explosive device detonated at a residential compound in Jeblat Hibshi, Northern, Bahrain. There were no reported casualties in the blast. No group claimed responsibility for the incident.",1,1,1,0,"","",0,1,0,3,Bombing/Explosion,"","","","",14,Private Citizens & Property,76,House/Apartment/Residence,Not Applicable,Residence,18,Bahrain,"","","","","","","","","","","","","","","","",Unknown,"","","","","","",0,"","",0,-99,0,0,"","","","","","","","","",6,Explosives,16,Unknown Explosive Type,"","","","","","","","","","","","",A roadside bomb was used in the attack.,0,0,0,0,0,0,1,3,Minor (likely < $1 million),-99,Unspecified property was damaged in this attack.,0,"","","","","","","","","","","","","","","","","\"\"\"BLAST SHOCK: Family moves out after 'device planted in compound'","\"\" Gulf Daily News",November 15,"2017.\"","","",START Primary Collection,-9,-9
