201502260032,2015,2,26,"",0,"",18,10,Middle East & North Africa,Central,Akr,26.143757,50.604046,1,0,"","02/26/2015: An explosive device detonated in Akr, Central governorate, Bahrain. One police officer was killed and another was wounded in the blast. No group claimed responsibility for the incident.",1,1,1,0,"","",0,1,0,3,Bombing/Explosion,"","","","",3,Police,25,Police Security Forces/Officers,Public Security Force (PSF),Officers,18,Bahrain,"","","","","","","","","","","","","","","","",Unknown,"","","","","","",0,"","",0,-99,0,0,"","","","","","","","","",6,Explosives,17,Other Explosive Type,"","","","","","","","","","","","",A homemade bomb was used in the attack.,1,0,0,1,0,0,-9,"","","",It is unknown if property was damaged in this attack.,0,"","","","","","","","","","","","","","","","","\"\"\"Bomb blast kills Bahraini policeman","\"\" Gulf News",February 26,"2015.\"","","",START Primary Collection,-9,-9
201503190028,2015,3,19,"",0,"",18,10,Middle East & North Africa,Capital,Karranah,26.231722,50.509521,1,0,"","03/19/2015: An explosive device detonated in Karranah village, Capital governorate, Bahrain. Two police officers were wounded in the attack. Al Ashtar Brigades claimed responsibility for the incident.",1,1,1,0,"","",0,1,0,3,Bombing/Explosion,"","","","",3,Police,25,Police Security Forces/Officers,Public Security Force (PSF),Officers,18,Bahrain,"","","","","","","","","","","","","","","","",Al-Ashtar Brigades,"","","","","","",0,"","",0,-99,0,1,7,"Posted to website, blog, etc.","","","","","","","",6,Explosives,17,Other Explosive Type,"","","","","","","","","","","","",A homemade explosive device was used in the attack.,0,0,0,2,0,0,-9,"","","",It is unknown if any property was damaged in this attack.,0,"","","","","","","","","","","","","","","","","\"\"\"Two policemen hurt in explosion","\"\" Gulf Daily News",March 20,"2015.\"","\"\"\"Two policemen injured by bomb at Shi'ite village in Bahrain: MOI","\"\" Reuters Canada",March 19,"2015.\"",""
201505100079,2015,5,10,"",0,"",18,10,Middle East & North Africa,Muharraq,Muharraq,26.253864,50.613705,1,0,"","05/10/2015: An explosive device detonated targeting a police patrol along the Khalifa al Kabeer Highway in Muharraq city, Muharraq governorate, Bahrain. There were no reported casualties in the attack. No group claimed responsibility for the incident; however, authorities arrested two people in connection with the attack.",1,1,1,0,"","",0,1,0,3,Bombing/Explosion,"","","","",3,Police,23,Police Patrol (including vehicles and convoys),Public Security Force (PSF),Patrol,18,Bahrain,"","","","","","","","","","","","","","","","",Unknown,"","","","","","",0,"","",0,4,2,0,"","","","","","","","","",6,Explosives,17,Other Explosive Type,7,Fake Weapons,"","","","","","","","","","",A homemade explosive device and a fake explosive device were used in the attack.,0,0,0,0,0,0,-9,"","","",It is unknown if any property was damaged in this attack.,0,"","","","","","","","","","","","","","","","","\"\"\"Two suspects held for blast","\"\" Gulf Daily News",May 18,"2015.\"","\"\"\"Four suspects involved in street bomb detonation","\"\" Bahrain News Agency",May 17,"2015.\"",""
201507150027,2015,7,15,"",0,"",18,10,Middle East & North Africa,Central,Eker,26.143757,50.604046,1,0,"","07/15/2015: An assailant attempted to plant an explosive device targeting police officers in East Eker city, Central governorate, Bahrain. The assailant was killed when the explosive device detonated prematurely. No group claimed responsibility for the incident.",1,1,1,0,"","",0,1,0,3,Bombing/Explosion,"","","","",3,Police,25,Police Security Forces/Officers,Public Security Force (PSF),Officers,18,Bahrain,"","","","","","","","","","","","","","","","",Unknown,"","","","","","",0,"","",0,1,0,0,"","","","","","","","","",6,Explosives,16,Unknown Explosive Type,"","","","","","","","","","","","","",1,0,1,0,0,0,0,"","","","",0,"","","","","","","","","","","","","","","","","\"\"\"1 dead in Bahrain village bomb blast","\"\" The Guardian Nigeria",July 15,"2015.\"","\"\"\"Bomber killed while trying to plant an explosive device","\"\" Gulf Daily News",July 15,"2015.\"","\"\"\"Funeral For Qassim Muhsin To Be Held Today"
201507180048,2015,7,18,"",0,"",18,10,Middle East & North Africa,Capital,Karranah,26.231722,50.509521,1,0,"","07/18/2015: An explosive device detonated near a police patrol in Karranah city, Capital governorate, Bahrain. No one was injured by the blast. No group claimed responsibility for the incident.",1,1,1,0,"","",0,1,0,3,Bombing/Explosion,"","","","",3,Police,23,Police Patrol (including vehicles and convoys),Public Security Force (PSF),Patrol,18,Bahrain,"","","","","","","","","","","","","","","","",Unknown,"","","","","","",0,"","",0,-99,0,0,"","","","","","","","","",6,Explosives,16,Unknown Explosive Type,"","","","","","","","","","","","","",0,0,0,0,0,0,0,"","","","",0,"","","","","","","","","","","","","","","","","\"\"\"Bomb attack targets police in Karranah","\"\" Gulf Daily News",July 19,"2015.\"","\"\"\"Highlights: Gulf Press 20 July 2015","\"\" OSC Summary",July 19,"2015.\"","\"\"\"Bahrain police escape blast in Shia village"
201507190049,2015,7,19,"",0,"",18,10,Middle East & North Africa,Central,Eker,26.143757,50.604046,1,0,"","07/19/2015: An explosive device detonated near a police patrol in Eker, Central governorate, Bahrain. One police officer was injured by the blast. No group claimed responsibility for the incident.",1,1,1,0,"","",0,1,0,3,Bombing/Explosion,"","","","",3,Police,23,Police Patrol (including vehicles and convoys),Public Security Force (PSF),Patrol,18,Bahrain,"","","","","","","","","","","","","","","","",Unknown,"","","","","","",0,"","",0,-99,0,0,"","","","","","","","","",6,Explosives,17,Other Explosive Type,"","","","","","","","","","","","",A locally-made explosive device was used in the attack.,0,0,0,1,0,0,1,3,Minor (likely < $1 million),-99,A police vehicle was damaged in this attack.,0,"","","","","","","","","","","","","","","","","\"\"\"Terrorists target police patrol in Bahrain","\"\" The Gulf Today",July 20,"2015.\"","\"\"\"Highlights: Gulf Press 20 July 2015","\"\" OSC Summary",July 19,"2015.\"","\"\"\"Bahrain police escape blast in Shia village"
201507280005,2015,7,28,"",0,"",18,10,Middle East & North Africa,Central,Sitra,26.169081,50.614277,1,0,"","07/28/2015: An explosive device detonated targeting a police bus outside of a school in Sitra village, Central governorate, Bahrain. Two police officers were killed and six others were injured in the blast. Saraya Waad Allah claimed responsibility for the incident and stated that the attack was carried out in retaliation for alleged police oppression.",1,1,1,0,"","",0,1,0,3,Bombing/Explosion,"","","","",3,Police,25,Police Security Forces/Officers,Public Security Force (PSF),Officers,18,Bahrain,"","","","","","","","","","","","","","","","",Saraya Waad Allah,"","","","","",Saraya Waad Allah claimed responsibility for the incident and stated that the attack was carried out in retaliation for alleged police oppression.,0,"","",0,-99,-99,1,7,"Posted to website, blog, etc.","","","","","","","",6,Explosives,12,Remote Trigger,"","","","","","","","","","","","","",2,0,0,6,0,0,-9,"","","",It is unknown if any property was damaged in this attack.,0,"","","","","","","","","","","","","","","","","\"\"\"Bahrain arrests several suspects over deadly bombing","\"\" Al Jazeera",July 29,"2015.\"","\"\"\"Bomb kills two policemen in worst Bahrain bombing in months","\"\" Reuters",July 28,"2015.\"","\"\"\"2 Police Killed in Terrorist Attack in Bahrain"
201508230019,2015,8,23,"",0,"",18,10,Middle East & North Africa,Muharraq,Muharraq,26.253864,50.613705,1,0,"","08/23/2015: An explosive device detonated in Al-Muharraq village, Muharraq governorate, Bahrain. There were no reported casualties. No group claimed responsibility for the incident.",1,1,1,0,"","",0,1,0,3,Bombing/Explosion,"","","","",20,Unknown,"","",Unknown,Unknown,18,Bahrain,"","","","","","","","","","","","","","","","",Unknown,"","","","","","",0,"","",0,-99,0,0,"","","","","","","","","",6,Explosives,16,Unknown Explosive Type,"","","","","","","","","","","","","",0,0,0,0,0,0,0,"","","","",0,"","","","","","","","","","","","","","","","","\"\"\"Mystery shrouds Muharraq bomb blast","\"\" Gulf Daily News",August 24,"2015.\"","\"\"\"Highlights: Gulf Press 26 August 2015","\"\" OSC Summary",August 25,"2015.\"",""
201508280010,2015,8,28,"",0,"",18,10,Middle East & North Africa,Capital,Karranah,26.231722,50.509521,1,0,"","08/28/2015: Two explosive devices detonated in Karanah village, Capital Northern governorate, Bahrain. One police officer was killed and four police officers and three civilians were injured in the blast. No group claimed responsibility for the incident.",1,1,1,0,"","",0,1,0,3,Bombing/Explosion,"","","","",3,Police,25,Police Security Forces/Officers,Public Security Force (PSF),Officers,18,Bahrain,14,Private Citizens & Property,67,Unnamed Civilian/Unspecified,Not Applicable,Civilians,18,Bahrain,"","","","","","","","",Unknown,"","","","","","",0,"","",0,-99,-99,0,"","","","","","","","","",6,Explosives,17,Other Explosive Type,"","","","","","","","","","","","",Two homemade explosive devices were used in the attack.,1,0,0,7,0,0,0,"","","","",0,"","","","","","","","","","","","","","","","","\"\"\"'Terrorist' blast kills Bahrain policeman",wounds 7,"\"\" CNN",August 28,"2015.\"","\"\"\"Explosion in Bahrain kills police officer",wounds 7 others,"\"\" Jordan Times",August 30
201508290089,2015,8,29,"",0,"",18,10,Middle East & North Africa,Northern,Saar,26.191792,50.484642,1,0,"","08/29/2015: An explosive device was discovered and defused near the Saar Mosque in Saar town, Northern governorate, Bahrain. No group claimed responsibility for the incident.",1,1,1,0,"","",0,0,0,3,Bombing/Explosion,"","","","",20,Unknown,"","",Unknown,Unknown,18,Bahrain,"","","","","","","","","","","","","","","","",Unknown,"","","","","","",0,"","",0,-99,0,0,"","","","","","","","","",6,Explosives,17,Other Explosive Type,"","","","","","","","","","","","",An explosives-laden cylinder was used in the attack.,0,0,0,0,0,0,0,"","","","",0,"","","","","","","","","","","","","","","","","\"\"\"Another bomb defused in saar","\"\" Gulf Daily News",August 30,"2015.\"","","",START Primary Collection,-9,-9
201509100019,2015,9,10,"",0,"",18,10,Middle East & North Africa,Capital,Bilad al-Qadeem,26.206879,50.556702,1,0,"","09/10/2015: An explosive device detonated at Al-Khamis Police Station in Bilad al-Qadeem, Capital governorate, Bahrain. There were no reported casualties in the blast. Al-Haydariyah Battalion claimed responsibility for the incident.",1,1,1,0,"","",0,1,0,3,Bombing/Explosion,"","","","",3,Police,22,"Police Building (headquarters, station, school)",Public Security Force (PSF),Police Station,18,Bahrain,"","","","","","","","","","","","","","","","",Al-Haydariyah Battalion,"","","","","","",0,"","",0,-99,0,1,7,"Posted to website, blog, etc.","","","","","","","",6,Explosives,16,Unknown Explosive Type,"","","","","","","","","","","","","",0,0,0,0,0,0,-9,"","","",It is unknown if any property was damaged in this attack.,0,"","","","","","","","","","","","","","","","Casualty numbers for this attack conflict across sources. Following GTD protocol, the majority reliable estimates are reported here.","\"\"\"Bomb attack on Bahrain police station",no casualties,"\"\" Arab News",September 11,"2015.\"","\"\"\"\\'No casualties in Bahrain police station blast': police\"\" Daily Tribune",September 11,"2015.\"","\"\"\"Highlights: Gulf Press 11 September 2015"
201510170064,2015,10,17,"",0,"",18,10,Middle East & North Africa,Northern,Hamala,26.13883,50.477737,1,0,"","10/17/2015: Assailants opened fire at the Hamala Al Kabeer Ma'atam, a Shia Muslim community hall, in Hamala village, Northern, Bahrain. There were no reported casualties in the attack. This was one of two related attacks on Muslim Community halls in the area on this date. The Islamic State of Iraq and the Levant (ISIL) claimed responsibility for the attacks.",1,1,1,0,"","",1,1,0,2,Armed Assault,"","","","",15,Religious Figures/Institutions,86,Place of Worship,Hamala Al Kabeer Ma'atam,Shiite Religious Congregation Hall,18,Bahrain,"","","","","","","","","","","","","","","","",Islamic State of Iraq and the Levant (ISIL),"","","","","","",0,"","",0,-99,0,1,10,Unknown,"","","","","","","",5,Firearms,5,Unknown Gun Type,"","","","","","","","","","","","","",0,0,0,0,0,0,1,3,Minor (likely < $1 million),-99,Unspecified property was damaged in this attack.,0,"","","","","","","","","","","","","","","","","\"\"\"Call to be alert after ma'atam shootings","\"\" Gulf Daily News",October 20,"2015.\"","\"\"\"Security beefed up at ma'atams","\"\" Gulf Daily News",October 19,"2015.\"","\"\"\"Bahraini scholars issue statement over attacks on mourners"
201510170065,2015,10,17,"",0,"",18,10,Middle East & North Africa,Northern,Damistan,26.123898,50.469706,1,0,"","10/17/2015: Assailants opened fire at the Shaikh Hassan Al Demistani Ma'atam, a Shia Muslim community hall, in Damistan, Northern governorate, Bahrain. There were no reported casualties in the attack. This was one of two related attacks on Muslim Community halls in the area on this date. The Islamic State of Iraq and the Levant (ISIL) claimed responsibility for the attacks.",1,1,1,0,"","",1,1,0,2,Armed Assault,"","","","",15,Religious Figures/Institutions,86,Place of Worship,Shaikh Hassan Al Demistani Ma'atam,Shiite Religious Congregation Hall,18,Bahrain,"","","","","","","","","","","","","","","","",Islamic State of Iraq and the Levant (ISIL),"","","","","","",0,"","",0,-99,0,1,10,Unknown,"","","","","","","",5,Firearms,5,Unknown Gun Type,"","","","","","","","","","","","","",0,0,0,0,0,0,1,3,Minor (likely < $1 million),-99,Unspecified property was damaged in this attack.,0,"","","","","","","","","","","","","","","","","\"\"\"Call to be alert after ma'atam shootings","\"\" Gulf Daily News",October 20,"2015.\"","\"\"\"Security beefed up at ma'atams","\"\" Gulf Daily News",October 19,"2015.\"","\"\"\"Bahraini scholars issue statement over attacks on mourners"
201511240072,2015,11,24,2015-11-24 00:00:00,0,"",18,10,Middle East & North Africa,Northern,Unknown,26.155191,50.482517,4,0,"","11/24/2015: Assailants threw Molotov cocktails at Abu Saiba Elementary Boys School in Northern, Bahrain. The walls of the school were damaged as a result of the attack. No group claimed responsibility for the incident.",1,1,1,0,"","",0,1,0,7,Facility/Infrastructure Attack,"","","","",8,Educational Institution,49,School/University/Educational Building,Abu Saiba Elementary Boys' School,School,18,Bahrain,"","","","","","","","","","","","","","","","",Unknown,"","","","","","",0,"","",0,-99,0,0,"","","","","","","","","",8,Incendiary,19,Molotov Cocktail/Petrol Bomb,"","","","","","","","","","","","",Molotov cocktails were used in the attack.,0,0,0,0,0,0,1,3,Minor (likely < $1 million),-99,A school building was damaged in this attack.,0,"","","","","","","","","","","","","","","","","\"\"\"Two schools attacked: Ministry","\"\" Daily Tribune",November 24,"2015.\"","","",START Primary Collection,-9,-9
201604160027,2016,4,16,"",0,"",18,10,Middle East & North Africa,Capital,Karbabad,26.230654,50.528118,1,0,"","04/16/2016: Assailants threw a petrol bomb at a police patrol in Karbabad, Capital, Bahrain. One officer was killed and two officers were injured in the attack. No group claimed responsibility for the incident.",1,1,1,0,"","",0,1,0,2,Armed Assault,"","","","",3,Police,23,Police Patrol (including vehicles and convoys),Public Security Force (PSF),Patrol,18,Bahrain,"","","","","","","","","","","","","","","","",Unknown,"","","","","","",0,"","",0,-99,-99,0,"","","","","","","","","",8,Incendiary,19,Molotov Cocktail/Petrol Bomb,"","","","","","","","","","","","",Molotov cocktails were used in the attack.,1,0,0,2,0,0,1,3,Minor (likely < $1 million),-99,A police vehicle was damaged in this attack.,0,"","","","","","","","","","","","","","","",The victims included Mohammad Naveed and Mohammed Arslan.,"\"\"\"Petrol bomb attack kills policeman in Bahrain","\"\" Jerusalem Post",April 16,"2016.\"","\"\"\"Suspects caught","\"\" Daily Tribune",April 18,"2016.\"","\"\"\"Bahrain policeman killed in bomb attack targeting patrol"
201610020038,2016,10,2,2016-10-02 00:00:00,0,"",18,10,Middle East & North Africa,Northern,Bani Jamra,26.210377,50.46233,1,0,"","10/02/2016: Assailants attacked police officers in Bani Jamra, Northern, Bahrain. No casualties were reported in the attack. The Martyr al-Nimr Battalion claimed responsibility for the incident and stated that the attack was carried out in retaliation for police personnel allegedly concealing Shia symbols during Shia celebrations.",1,1,1,0,"","",0,0,0,9,Unknown,"","","","",3,Police,25,Police Security Forces/Officers,Public Security Force (PSF),Officers,18,Bahrain,"","","","","","","","","","","","","","","","",Martyr al-Nimr Battalion,"","","","","",The Martyr al-Nimr Battalion claimed responsibility for the incident and stated that the attack was carried out in retaliation for police personnel allegedly concealing Shiite symbols during Shiite celebrations.,0,"","",0,-99,0,1,4,E-mail,"","","","","","","",13,Unknown,"","","","","","","","","","","","","","","",0,0,0,0,0,0,0,"","","","",0,"","","","","","","","","","","","","","","","","\"\"\"Bahraini armed group claims attack on police officers","\"\" MENA English (Middle East and North Africa Financial Network)",October 4,"2016.\"","","",START Primary Collection,0,0
201611190070,2016,11,17,"",0,"",18,10,Middle East & North Africa,Muharraq,Dair,26.28323,50.631496,1,0,"","11/17/2016: Assailants set fire to roads to prevent students from reaching Al Dair Primary Boys' School in Dair, Muharraq, Bahrain. There were no reported casualties. No group claimed responsibility for the incident.",1,1,1,0,"","",0,1,0,7,Facility/Infrastructure Attack,"","","","",19,Transportation,104,Highway/Road/Toll/Traffic Signal,Unknown,Roads,18,Bahrain,"","","","","","","","","","","","","","","","",Unknown,"","","","","","",0,"","",0,-99,0,0,"","","","","","","","","",8,Incendiary,18,Arson/Fire,"","","","","","","","","","","","","",0,0,0,0,0,0,1,3,Minor (likely < $1 million),-99,A road was damaged in this attack.,0,"","","","","","","","","","","","","","","","","\"\"\"Vandals block roads to school by setting fire","\"\" Daily Tribune",November 19,"2016.\"","","",START Primary Collection,-9,-9
201701010013,2017,1,1,"",0,"",18,10,Middle East & North Africa,Southern,Jaww,26.0,50.616667,1,0,"","01/01/2017: Assailants opened fire at the Public Security Force (PSF) prison in Jaww, Southern governorate, Bahrain. At least one police officer was killed and another was injured in the assault. Additionally, at least 10 prisoners were freed in the incident. No group claimed responsibility for the attack.",1,1,1,0,"","",0,1,0,2,Armed Assault,"","","","",3,Police,26,Prison/Jail,Public Security Force (PSF),Jau Prison,18,Bahrain,"","","","","","","","","","","","","","","","",Unknown,"","","","","","",0,"","",0,4,0,0,"","","","","","","","","",5,Firearms,2,Automatic or Semi-Automatic Rifle,5,Firearms,3,Handgun,"","","","","","","","",Automatic rifles and pistols were used in the attack.,1,0,0,1,0,0,1,3,Minor (likely < $1 million),-99,Unspecified prison property was damaged in this attack.,0,"","","","","","","","","","","","","","","","","\"\"\"10 on the run   after attack on   Bahrain jail","\"\" The Gulf Today",January 2,"2017.\"","\"\"\"Arab League Condemns Attack on Bahrain's Jau Reformatory Centre","\"\" Qatar News Agency",January 2,"2017.\"","\"\"\"'Terrorists' escape as armed men storm prison in Bahrain"
201701140039,2017,1,14,"",0,"",18,10,Middle East & North Africa,Northern,Bani Jamra,26.210377,50.46233,1,0,"","01/14/2017: Assailants opened fire on a police patrol in Bani Jamra, Northern region, Bahrain. At least one police officer was injured in the attack. Al-Ashtar Brigades claimed responsibility for the incident and stated that the attack was carried out in retaliation to the executions of its members the previous day.",1,1,1,0,"","",0,1,0,2,Armed Assault,"","","","",3,Police,23,Police Patrol (including vehicles and convoys),Public Security Force (PSF),Patrol,18,Bahrain,"","","","","","","","","","","","","","","","",Al-Ashtar Brigades,"","","","","",Al-Ashtar Brigades claimed responsibility for the incident and stated that the attack was carried out in retaliation to the executions of its members a day prior.,0,"","",0,-99,2,1,10,Unknown,"","","","","","","",5,Firearms,2,Automatic or Semi-Automatic Rifle,"","","","","","","","","","","","",Two Kalashnikov rifles were used in the attack.,0,0,0,1,0,0,0,"","","","",0,"","","","","","","","","","","","","","","","","\"\"\"Two suspected of shooting at police","\"\" Gulf Daily News",January 23,"2017.\"","\"\"\"Terror group claims responsibility for Bani Jamra shooting","\"\" Gulf Daily News",January 16,"2017.\"",""
201701160017,2017,1,16,"",0,"",18,10,Middle East & North Africa,Northern,Aali,26.146751,50.525586,1,0,"","01/16/2017: Assailants armed with brass knuckles and a knife stormed the Northern Municipality office in Aali, Northern region, Bahrain. The assailants held five employees hostage and detonated gas cylinders inside the office. There were no reported casualties in the attack and the hostages were released later the same day. No group claimed responsibility for the incident.",1,1,1,0,"","",0,1,0,5,Hostage Taking (Barricade Incident),3,Bombing/Explosion,"","",2,Government (General),21,Government Building/Facility/Office,"Bahraini Works, Municipalities Affairs and Urban Planning Ministry",Northern Municipality Office,18,Bahrain,"","","","","","","","","","","","","","","","",Unknown,"","","","","","",0,"","",0,5,0,0,"","","","","","","","","",6,Explosives,17,Other Explosive Type,8,Incendiary,19,Molotov Cocktail/Petrol Bomb,9,Melee,23,Knife or Other Sharp Object,"","","","","Explosives-laden gas cylinders, petrol bombs, knives, and brass knuckles were used in the attack.",0,0,0,0,0,0,1,3,Minor (likely < $1 million),-99,An office building was damaged in this attack.,1,5,0,-99,"","","",0,"","","","","",2,Hostage(s) released by perpetrators,5,"","\"\"\"Armed men storm municipality office","\"\" Gulf Daily News",January 17,"2017.\"","\"\"\"Terrorist Act: Firebomb attack on a municipality building in A'ali","\"\" Gulf Daily News",January 16,"2017.\"","\"\"\"Building torched as Bahrain Shias protest executions"
201701180020,2017,1,18,"",0,"",18,10,Middle East & North Africa,Central,Sitra,26.169081,50.614277,1,0,"","01/18/2017: Assailants detonated gas cylinders outside a bank in Sitra, Central governorate, Bahrain. There were no reported casualties in the blast. No group claimed responsibility for the incident.",1,1,1,0,"","",0,1,0,3,Bombing/Explosion,"","","","",1,Business,3,Bank/Commerce,National Bank of Bahrain (NBB),Bank,18,Bahrain,"","","","","","","","","","","","","","","","",Unknown,"","","","","","",0,"","",0,-99,0,0,"","","","","","","","","",6,Explosives,17,Other Explosive Type,"","","","","","","","","","","","",Two explosives-laden gas cylinders were used in the attack.,0,0,0,0,0,0,1,3,Minor (likely < $1 million),-99,A bank was damaged in this attack.,0,"","","","","","","","","","","","","","","","","\"\"\"Bank branch shut after arson attack","\"\" Gulf Daily News",January 19,"2017.\"","","",START Primary Collection,-9,-9
201701290002,2017,1,29,"",0,"",18,10,Middle East & North Africa,Capital,Bilad al-Qadeem,26.206879,50.556702,1,0,"","01/29/2017: Assailants shot and killed Hisham Hassan Mohammed Al-Hamadi, a police officer, in Bilad al-Qadeem, Capital, Bahrain. Al-Ashtar Brigades claimed responsibility for the incident.",1,1,1,0,"","",0,1,0,2,Armed Assault,"","","","",3,Police,25,Police Security Forces/Officers,Public Security Force (PSF),Officer: Hisham Hassan Mohammed Al-Hamadi,18,Bahrain,"","","","","","","","","","","","","","","","",Al-Ashtar Brigades,"","","","","","",0,"","",0,-99,1,1,7,"Posted to website, blog, etc.","","","","","","","",5,Firearms,5,Unknown Gun Type,"","","","","","","","","","","","","",1,0,0,0,0,0,0,"","","","",0,"","","","","","","","","","","","","","","","","\"\"\"Cop killer",several others arrested,"\"\" DT News is Bahrain's",February 22,"2017.\"","\"\"\"Bahrain police officer killed in attack claimed by militants","\"\" Ynet News",January 29,"2017.\""
201702050019,2017,2,5,"",0,"",18,10,Middle East & North Africa,Northern,Budaiya,26.210929,50.448907,1,0,The incident occurred on the Budaiya highway.,"02/05/2017: An explosive device detonated along Budaiya Highway in Budaiya, Northern governorate, Bahrain. There were no reported casualties in the blast. No group claimed responsibility for the attack.",1,1,1,0,"","",0,1,0,3,Bombing/Explosion,"","","","",14,Private Citizens & Property,73,Vehicles/Transportation,Not Applicable,Vehicles,18,Bahrain,"","","","","","","","","","","","","","","","",Unknown,"","","","","","",0,"","",0,-99,0,0,"","","","","","","","","",6,Explosives,16,Unknown Explosive Type,"","","","","","","","","","","","","",0,0,0,0,0,0,1,4,Unknown,-99,An unspecified number of vehicles were damaged in this attack.,0,"","","","","","","","","","","","","","","","","\"\"\"Blast on highway","\"\" Gulf Daily News",February 5,"2017.\"","\"\"\"Bomb blast in Budaiya","\"\" Daily Tribune",February 5,"2017.\"","\"\"\"Bomb blast rocks Bahraini capital; no injuries"
